abstract,summary
"Minnesota's public university system is exploring revisions to faculty tenure code that would allow cuts for first time in professors' salaries for reasons other than financial emergency and would allow dismissal of professors if their programs were eliminated; under current code, tenured professors can be laid off only if department or college is closed; in response, some faculty members have begun organizing drive to form union that would represent 3,000 or so professors at university's four campuses (M) ","Minnesota's public university system is exploring revisions to the faculty tenure code that would allow cuts for the first time in professors' salaries for reasons other than financial emergency and would allow the dismissal of professors if their programs were eliminated. The tenure proposal, made by the 12-member Board of Regents on Sept. 5, has been condemned by the Minnesota faculty, whose professors teach 67,000 students at campuses in Minneapolis-St. Fred L. Morrison, a University of Minnesota Law School professor who helped write the current tenure code, said he and many colleagues opposed the proposal because it'' dramatically shifts the burden of tenure decisions from the faculty to the regents, and reduces the right of appeal.''Nils Hasselmo, university president, has vigorously opposed the regents' proposal."
"John W Tuthill, US career diplomat, dies at age 85 (S) ","John W. Tuthill, who served as United States Ambassador to the European Economic Community and to Brazil, died on Sept. 9 in a Washington hospital. Tuthill, a highly regarded career diplomat, was Ambassador to the European Economic Community from 1962 to 1966. In 1964 he issued a warning in a speech to American businessmen visiting Brussels. That fear, he said,'' is a factor which you and the United States Government must bear in mind.'' He added,'' We must be especially regardful of local problems, local traditions and local pride.''Born in Montclair, N.J., he graduated from the College of William and Mary and received graduate degrees from Harvard and New York University. Serving in the Foreign Service,'' is to be published by Minerva Press."
United States Forest Service is working in Baltimore in pilot program aimed at cultivating barren city streets on East Coast; is working to organize Baltimore residents not only to plant trees but to see their city as an ecosystem (M) ,"In a pilot program, Revitalizing Baltimore, the service has been organizing residents not only to plant trees, but also to see their city as an ecosystem. A researcher for the Forest Service, Morgan Grove, said simply opening holes in a sidewalk for a red maple could turn a street of strangers into a community. Rather, community foresters fan out, going to meetings, churches and door to door to recruit people to plant trees or establish community gardens. The 1,238 street trees and 303 smaller barrel trees that community groups have planted have an 80 percent survival rate, compared with the 50 percent rate for city plantings. Trees cover 17 percent of Baltimore, which is fairly typical, said Mr. Neville, who searched nationally for the program."
Pernell Whitaker comments on his classic performance against Wilfredo Rivera to retain World Boxing Council welterweight title (M) ,"There was plenty of fight left in Whitaker, and plenty of talent left in his 32-year-old body. Rivera came to fight, but I was at my best. Whitaker controlled the fast-paced fight with his jab, he opened a cut under Rivera's eye in the fourth round, and he knocked down Rivera in the sixth round with a solid left. Rivera, the No. 1-ranked contender from Rio Piedras, P.R., fell to 23-2-1.''I thought I dominated the fight,'' said Whitaker.'' He won, but he did n't perform up to Pernell Whitaker's standards. Wilfredo Rivera, in my opinion, fought even better than he did in April. But Pernell proved that he's the best fighter in the world again.''What is next for Whitaker?"
"Michio Hoshino, wildlife photographer, was mauled to death by brown bear in August, while filming documentary on Kamchatka Peninsula in eastern Russia (S) ","Michio Hoshino, a photographer known for his pictures of bears and other wildlife, was mauled to death by a brown bear last month on the Kamchatka Peninsula in eastern Russia. The Japanese newspaper Mainichi reported that Mr. Hoshino-- who moved to Alaska from his native Japan in 1978-- was on the peninsula as part of a team making a documentary film about brown bears when he was attacked and killed on Aug. 8. The other team members'' heard Hoshino's screams and came running, but the bear dashed into the woods dragging Hoshino,'' Mainichi said. Hoshino's book'' Moose,'' published by Chronicle in 1988, was praised by Forbes magazine for its'' startling shots of bulls in battle for their own breeding territory.''"
"Documents made public by Pentagon show that training manuals used by United States Army's special school for Latin American military and police officers in 1980's recommended bribery, blackmail, threats and torture against insurgents; manuals--written in Spanish and carrying titles like 'Interrogation' and 'Revolutionary War and Communist Ideology'--advocated tactics that Pentagon said violated American policy and principle (M) ","Training manuals used by the United States Army's special school for Latin American military and police officers in the 1980's recommended bribery, blackmail, threats and torture against insurgents, according to documents made public by the Pentagon late Friday. Army intelligence officials compiled the manuals in 1987 from lesson plans that had been in use since 1982 at the School of the Americas, a military academy that opened in 1946 in Panama and moved to Fort Benning, Ga., in 1984.It has trained nearly 60,000 officers, including many dictators and military leaders accused of abusing human rights. The Army's Southern Command notified governments in Latin America that'' the manuals contained passages that did not represent U.S. Government policy,'' according to the statement."
"Crime remains hot issue with politicians and a major concern of voters, despite statistics showing drop in some crime rates; photo (M) ","There is nothing unusual in Tampa about Ed W. Block's belief that crime is just about the biggest problem around. In a recent survey taken in Hillsborough County, which includes Tampa, people ranked crime far ahead of their other concerns. The only thing odd about all this is that the crime rate has been falling in Tampa, as it has in many other cities around the country. Beyond Wichita, she said of crime,'' But in the same poll, almost two-thirds of the people surveyed said the crime problem in their own neighborhood was either improving or staying the same. Dole turned to the crime issue in part out of a confidence that the rate at which people are actually victimized might be of less political importance than their fears.''"
"Federal law-enforcement officials say that, seven weeks after deadly bombing at Atlanta Olympics, they have made little progress in solving attack and unable to implicate security guard Richard Jewell, who has been focus of their inquiry; Jewell has been neither charged nor cleared in case; photo (M) ","Nevertheless, the Federal Bureau of Investigation has hung onto its theory that Mr. Jewell is a suspect. Evidence developed since then seems to exclude Mr. Jewell. But law-enforcement officials said they remained unsure about whether the bomb battery had actually been sold through the Florida chain. That Jewell fellow they accused of that?' They were absolutely 100 percent convinced that Jewell was the guy,'' said one official, referring to investigators in Atlanta. F.B.I. officials planned to build a case against Mr. Jewell gradually, without alerting him to their suspicions. Under the original plan, the agents had not planned to advise Mr. Jewell of his constitutional rights."
"Teachers' unions, which have resisted movement to create charter schools out of concern about teachers' benefits, are changing their views; as 25 states have passed legislation to allow schools that are publicly financed yet independently run, National Education Assn is encouraging its chapters to start their own such schools; on smaller scale, American Federation of Teachers is making similar efforts (M) ","The first N.E.A-sponsored school opened this month in Lanikai, Hawaii. If the classes were incorporated into a charter school, she said, the teachers would like to extend the school day by two hours, an hour on either side. The statewide union in Connecticut hopes to choose its N.E.A. school before Dec. 2, the state's deadline for charter school applications. The American Federation of Teachers, with 900,000 members, has also been helping chapters begin charter schools. It is hard to say how the union charter schools will differ from the more than 260 other charter schools in the country that are run by private companies. In Colorado Springs, for example, the charter school will have a principal who teaches."
"French debate role of Roman Catholic Church in French society, as Pope John Paul II arrives for visit; detractors portray him as Christian Ayatollah at war with modern reality, while loyal supporters hail him as only clear moral voice in troubled world; Pope, in his addresses to French people, tells them that they should be kinder to one another, emphasizing social compassion; photo of Pope in Tours (M) ","As the French engaged in a furious debate on church-state relations before Pope John Paul II arrived here on Thursday, detractors depicted him as a Christian Ayatollah at war with modern reality while loyal supporters hailed him as the only clear moral voice in a troubled world. Behind the great debate over the role of the Roman Catholic Church in French society emerged another reality, perhaps even more worrying for the leaders of the French church. On his travels to the Vendee, Brittany and on Sunday to the great cathedral city of Rheims, he has traveled on French Government planes, one of the points in the debate over his trip to a country that has fiercely defended the separation of church and state."
"Political Briefing column; Democratic Natl Com gives $1 million to House and Senate campaign committees; effort is under way to raise $10 million for cause; in North Carolina race, new Mason-Dixon poll shows that Sen Jesse Helms has significant lead over his Democratic challenger, Harvey Gantt; survey shows Gantt with overwhelming support of blacks, while Helms has backing of almost two-thirds of North Carolina's white voters; in Georgia, Max Cleland, Democratic candidate for US Senate, has new television commercial that weaves his comeback from devastating injuries in Vietnam into broader appeal for personal responsibility; Maxon-Dixon poll shows Cleland leading Guy Millner (M) ","Congressional leaders had met with Mr. Clinton and his top political aides in recent days and delivered a simple message: The House and the Senate were within reach for the Democrats, but the campaign committees badly needed money. North CarolinaHelms and Foe Reach to CenterSenator Jesse Helms has a significant lead over his Democratic challenger, Harvey Gantt, in a new Mason-Dixon poll. The survey showed Mr. Gantt with the overwhelming support of blacks, while Mr. Helms had the backing of almost two-thirds of North Carolina's white voters. Over all, Mr. Helms stood at 50 percent, Mr. Gantt at 40 percent. Mr. Helms has devoted substantial advertising time to touting his own record, including the amount of Federal money he brought to the state and his role in bringing the Carolina Panthers to Charlotte."
"Gay rights activists denounce Pres Clinton's midnight signing of bill to deny Federal recognition and benefits to couples of same sex who might marry, dismissing it as 'historical misjudgment' that endorses 'needless and mean-spirited bill' (M) ","The President's spokesman, Michael D. McCurry, acknowledged that Mr. Clinton had signed the bill because'' the President believes the motives behind this bill are dubious and the President believes that the sooner he gets this over with the better.''No state allows same-sex marriage, but a court case is pending over efforts to permit it in Hawaii. Mr. Clinton has long supported gay rights but has also long opposed same-sex marriage, and he said in the spring that he would sign a bill defining marriage as the union of one man and one woman and allowing states to ignore same-sex marriages sanctioned by other states. Clinton used both the gay marriage issue and the motherhood questions he addressed today to portray himself as the architect of reasonable compromise on such questions."
"Pres Clinton, in his weekly radio address to nation, praises new legislation requiring insurance companies to pay for new mothers and their babies to stay in hospitals for 48 hours, and 96 hours if mother has Caesarean; contends doctors, not rigid insurance company rules, should determine when new baby goes home (In His Own Words column) (S) ","BILL CLINTONSpeaking to the nation yesterday by radio:''In 1970, the average length of stay for an uncomplicated delivery was four days. Today, a large and growing number of insurers refuse to pay for anything more than 24 hours, and some even recommend release as early as eight hours after delivery. And it can have severe health consequences.''We've all heard heartbreaking stories like the family in New Jersey sent home after 24 hours, whose baby died 24 hours after that from an infection that would have been detected and treated in a hospital. Doctors, not rigid insurance company rules, should decide when a new baby goes home.''This new legislation requires insurance companies to pay for new mothers and their babies to stay in the hospital for 48 hours, and 96 hours if the mother has had a Caesarean."
"New York City's fashion industry to join with Washington's movers and shakers for gala at National Building Museum in Washington, to raise funds to combat breast cancer; more than $1 million in designer clothing is shipped from Seventh Avenue to Washington, to be sold to raise funds; more than 1,100 guests, including Gen Colin Powell and Elizabeth Dole, are expected for gala and shopping on Tuesday night; Diana, Princess of Wales, is honorary chairwoman for evening; fashion industry has increasingly expressed its support for breast cancer research in recent years; photos (L) ","All proceeds will benefit Georgetown University's Nina Hyde Center for Breast Cancer Research, which will present its first humanitarian award to Mr. Lauren. Hyde, a fashion writer for The Washington Post who died of breast cancer in 1990, was a friend of Mr. Lauren.'' In the last year, breast cancer has been gradually emerging on a par with AIDS in the fashion industry's charitable hierarchy. Revlon has established a foundation, and Avon Products sponsors a program called the Breast Cancer Awareness Campaign. In Times Square, Linda Evangelista looms large on a billboard advertisement for Kenar sportswear seeking public support for the Breast Cancer Research Foundation."
"Gay voters in middle-American places like Canton, Ohio, and surrounding Stark County are seen generally supportive of Pres Clinton; they are seen identifying with Clinton's intensely pragmatic approach to politics, as they generally favor a quiet, pragmatic approach to life themselves; while they might be disappointed that Clinton retreated in his support for gay members of armed forces, they still support him; photo (M) ","Rick Ward, a bartender at Dar's, one of a half-dozen gay night spots in Stark County, opened a long-neck bottle of Budweiser for a customer ('' Need a glass? the gay bartender said.'' The words' gay marriage' scare straight people to death,'' Mr. Ward said.'' Being gay in a middle-American place like Stark County, a person tends to take a practical view of things. As for the President's plan to sign the Defense of Marriage Act, Mr. Resnick said:'' I just disqualify that. Perhaps once a year an issue breaks the quiet of the gay people living here."
"Our Towns column on shock over police corruption investigation in quiet town of Palisades Park, New Jersey; probe linking police officers to rash of burglaries has yielded Federal indictments against two officers (S) ","The police chief said bad guys must have discovered that two major highways, Route 46 and the New Jersey Turnpike, emptied into town. The police, the Bergen County Prosecutor and the sheriff set up surveillance teams. But members of the trusted, respected Police Department breaking and entering private homes? Palisades Park considers itself a clean-cut all-American town. Two weeks ago, the county dropped felony burglary charges against Sergeant Shirley, prosecutors said, to hand the case to the United States Attorney. The sergeant was then indicted on third-degree burglary and civil rights charges, misdemeanors. This will now be the town with the bad police,'' said Soo Yoo Kim, who moved to Palisades Park from Queens four years ago.' Our Towns"
Correction of front-page article in Sept 22 New Jersey section about intercollegiate women's sports ,"Because of a production error, a front-page article in the New Jersey section today about intercollegiate women's sports omits a line from the continuation on page 10. The affected sentence should read,'' But the women have an added burden: fighting endlessly for respect even as they have tried to ward off bitterness and keep their ambitions intact-- to be a good coach, to put together a winning team.''"
"Tables of statistics about New York City, in areas such as public safety, transportation, housing, sanitation, parks, libraries and education ","The numbers that are the life force of New York City government are born anew each year in the Mayor's Management Report, required by law each September. The reports always draw political fire, and the one that Mayor Rudolph W. Giuliani issued last week came under particular criticism for its sunny spin on the state of city services. But the report is much more than a political document. Its gray columns of figures create a snapshot of New York at this moment: how sick or well its residents are, how slowly cars move through midtown Manhattan, how many people skated at a public rink, how many died. These highlights are a small fraction of the complete urban almanac. DAVID FIRESTONE"
"Fierce battles are being waged in state legislative races in Hartford and across country; Republicans are trying to cement victories of their 1994 landslide, and Democrats are fighting aggressively to regain majorities they lost; Republicans picked up more state legislative seats in 1994 than they had in any election in 28 years, and they gained new majorities in 18 legislative chambers, among them Connecticut's State 5enate; Republicans now control 18 state legislatures, up from the eight they controlled in 1994; but in many chambers, their margins are slim, and they could lose control of 20, including Connecticut's Senate, with losses of just a few seats (M) ","Republicans picked up more state legislative seats in 1994 than they had in any election in 28 years, and they gained new majorities in 18 legislative chambers, among them Connecticut's State Senate. ' We were off track,'' said Mary Isenhour, caucus director of the Democratic Legislative Campaign Committee.' So this year, the Democrats are working closely with the state Clinton campaign and other Democratic candidates, sharing telephone banks, polling and other resources. In 1994, the Democratic majority in the State House of Representatives picked up five seats, more than any other legislative Democratic caucus in the country. Out of 45 special elections for state legislative seats, Democrats have won 35, including 10 seats that had been held by Republicans."
"Review of action in Solheim Cup play at St Pierre Golf and Country Club, Chepstow, Wales; photo of Laura Davies (M) ","It was early morning at the St. Pierre Golf and Country Club when a wasp struck the first major blow of the golfing day. When play began on the second day of this nerve-jangling three-day team event, the Europeans trailed the Americans by 2 points. Walker's players earned their 9- 7 advantage by winning 6 of the 8 points available in the morning foursome matches and afternoon fourballs. The only Americans to win a match were Kelly Robbins and Betsy King, who beat de Lorenzi and Joanne Morley 2 and 1 in the third fourball, or best ball, match."
"Nationalist political parties that plunged Bosnia into war four years ago dominated federal and regional legislative races, further jeopardizing hopes for unity, according to nearly complete returns made public from Sept 14 national election; Officials of Orgn for Security and Cooperation in Europe say that although they are not ready to certify vote they do not expect allocation of legislative seats to change; their tally shows that Muslim-led Party of Democratic Action takes 19 of 42 seats in House of Representatives, hard-line Serb Democratic Party takes 9 seats and Croatian Democratic Union wins 7; balance goes to smaller parties that were in opposition during war; tables; charts (M) ","According to their tally, the Muslim-led Party of Democratic Action took 19 of the 42 seats in the House of Representatives, which is intended to unite all three ethnic factions in a common legislative body. The hard-line Serb Democratic Party took 9 seats and the Croatian Democratic Union won 7. However, even with the support of its nationalist allies in the Serb Radical Party, which took 7 seats, the Serb Democratic Party falls short of a two-thirds majority. Furthermore, Bosnian refugees who voted with absentee ballots managed to hand the Muslim-led Party of Democratic Action 6 seats in the regional Serbian assembly. The Serb Democratic Party's nominee for president of the Bosnian Serb republic, Biljana Plavsic, won with 65 percent of the vote."
"Governing board of Virginia Military Institute, after defying Supreme Court order for three months, votes 9 to 8 to admit women, transforming nation's last single-sex school that is state supported; officials, however, in yet another act of defiance, say they will require women to get crewcuts and meet same fitness requirements that apply to men; Josiah Bunting 3d, VMI supt, asserts it would be 'demeaning to women to cut them slack'; vote, by Board of Visitors, comes in response to June 26 ruling in which US Supreme Court held that VMI could not exclude women while taking state money; case reviewed; photo of Bunting (M) ","After defying a Supreme Court order for three months, the governing board of Virginia Military Institute voted 9 to 8 today to admit women, transforming the nation's last single-sex school that is state supported. Women will be subjected to substantially the hair requirements and restrictions of young men-- a buzz cut.''Mr. Cadets have windows on their doors, and use toilets and showers without doors. Mr. Bunting said the institute would add shades to the barracks doors that'' may be used only when the young women or the young men are changing. The United States has 3 all-male colleges and 84 women's colleges. About 80 women have requested information about applying to V.M.I. since the Supreme Court ruling. The motion demanded that V.M.I. begin admitting women immediately."
"Recent roll-call votes in Congress for members from New York area; House votes, 285-137, to overturn Pres Clinton's veto of ban on late-term abortion procedure; House votes, 225-279, against resolution to make public ethics committee report on Speaker Newt Gingrich (S) ",Abortion: Vote to override President Clinton's veto of the ban on a late-term abortion procedure that opponents call partial-birth abortion. Report on Gingrich: Vote to kill a resolution requiring the House Ethics Committee to make public its counsel's preliminary report on charges against Speaker Newt Gingrich. A'' yes'' vote was a vote to kill the resolution. Gejdenson ( D ).. LoBiondo ( R ).. Smith ( R ).. Pallone ( D ).. Frisa ( R ).. Flake ( D ).. Velazquez ( D ).. Lowey ( D ).. Kelly ( R ).. Hinchey ( D ).. LaFalce ( D ).. Houghton ( R ).. Votes in Congress
"Columbia football team defeats Harvard in overtime, 20-13, Wien Stadium, New York City; photo (M) ","Overtime came to the Ivy League yesterday, and at Columbia's Wien Stadium, the extra period brought the Lions a 20- 13 victory over Harvard. Columbia won a coin toss after 60 minutes of regulation time concluded with the score tied, 13- 13. The Lions chose to take possession on the Harvard 25-yard line, under the overtime rule now mandatory for Division I- A and I-AA games. The turnover ended Harvard's overtime possession and gave the victory to Columbia. Harvard outgained Columbia, 213 yards to 186 for the game, and 147 to 43 in the first half, when Thomason could complete only 3 of 11 pass attempts. In 1993, freshmen became eligible for Ivy League varsity football, for the first time since 1946."
