abstract,summary
Court finding that John du Pont is pyschotic and unable to stand trial for murder of Dave Schultz noted; photo (S) ,"Declaring that John E. du Pont was'' actively psychotic,'' a judge in suburban Philadelphia ruled that the chemical company heir was mentally incompetent to stand trial for the January shooting death of the Olympic wrestling champion Dave Schultz. Judge Patricia Jenkins ordered the jailed du Pont, 57, to seek involuntary treatment at a psychiatric hospital. This does n't mean that he wo n't ever stand trial. Doctors said that with treatment, Mr. du Pont might be competent in two to six months. In a taped interview with defense psychiatrists, played at a recent competency hearing, Mr. du Pont called himself the Dalai Lama, the last Czar of Russia and a successor to the Third Reich. JERE LONGMANSeptember 22- 28"
Overrunning of Kabul by Taliban Muslim guerrillas noted (S) ,"It took nearly a decade to dislodge the Soviet Army from Afghanistan and three more years to oust the government Moscow had installed, but only three days to complete the Islamic revolution. When Kabul was overrun last week by Islamic fundamentalist rebels known as the Taliban, they took only minutes to hang the man who had become the symbol of Soviet intervention, Najibullah, the former president and most hated figure in modern Afghan history. The Taliban movement, named for students educated in Muslim religious schools, was welcomed by soldiers and civilians alike on the road to Kabul. Afghans clearly want peace. But do they want a state where girls can not go to school, where women, veiled and shunted into purdah, can not hold jobs outside the home?BARBARA CROSSETTESeptember 22- 28"
Stan Guthrie letter wonders that Sept 25 editorial would raise teacher salaries when too many teachers have not studied the subjects they teach ,"Then, in a classic non sequitur, you advocate increasing teacher salaries. Do you really think it is wise to reward mediocrity with fatter paychecks?As long as the education profession is dominated by unaccountable unions that demand tenure and block the real reforms you advocate, paying higher salaries is just throwing good money after bad. As you note the same day in an Education page article on Roman Catholic schools in New York City, teacher salaries are far from the key issue. In the schools you surveyed, which graduated at least 98 percent of students in four years, compared with 48.2 percent in the New York City public schools, teacher salaries were, on average, $ 19,000 to $ 20,000 less than those in the government-run schools."
Carmine J Giordano letter says teacher training should include time working in industries whose future employees will be taught in schools ,"To the Editor: Raising professional standards for teachers will not alone produce a teacher corps adequate to the demands of high-technology and the information age ( editorial, Sept. 25 ). It will also take community-based learning experiences to train the 21st-century teacher. Prospective teachers should be required to spend paid training and working internships in the industries whose eventual employees they will be teaching. Industry employees, in turn, should be allowed to participate in creating courses for and giving instruction to 21st-century teachers. This would assure the currency of the classroom teacher's data base and the possibility that academics would be made more relevant."
Matthew Menken letter says quality education cannot take place unless there is quality curriculum and teachers are given authority to fail students who do not meet standards ,"To the Editor: You rightly support better pay for better teachers ( editorial, Sept. 25 ), although that alone is unlikely to overcome the'' rising tide of mediocrity'' in the nation's schools. My late parents, with 50 years of teaching experience between them, encountered massive indifference to quality standards, because most people do not understand the foundation of education quality. A majority of people think that a traditional curriculum lacks relevance for modern society. Quality education can not occur unless teachers are given the authority to fail students who do not meet standards without facing meaningless administrative guidelines and an appeals process. For committed teachers, better pay is important, but less important than greater respect and autonomy. Teaching Does n't Warrant Better Pay"
Sen William V Roth Jr letter supports Bob Dole's tax-cut plan ,"To the Editor: At a time when the average American family pays more in taxes than it spends on food, shelter and clothing, I find it difficult to believe that anyone would suggest that Americans are n't warranted a real effort at tax reform ('' A Reckless Tax Cut,'' editorial, Sept. 25 ). Rejecting Bob Dole's plan, you offer no solution to the excessive taxes borne by American families, but conclude with the insipid contention that President Clinton's plan'' would do no harm.''Moreover, I do n't accept your claim that'' the economy is now operating at full bore.'' Economic growth creates jobs."
Vincent Ojeda letter on Bob Dole's tax cut and generosity of Americans who have paid trillions of dollars for failed welfare state ,"A Reckless Tax Cut,'' you seem concerned about Bob Dole's tax cut plan because'' he is vague where he will cut spending to pay for his generosity.'' How are we going to pay for President Clinton's tax increases on income and gas? In 1990, according to Internal Revenue Service statistics, the top 1 percent of wage earners paid about 25 percent of all Federal income taxes. Is it fair to punish the most successful Americans with the highest taxes? Bob Dole and Jack Kemp understand that the tax code is indeed unfair, and they know that people know how to spend their own money."
"Fiona Bayly letter asks how Bob Dole can say Americans know how to spend their money better than Government, when so many Americans cannot even pay off their credit cards ","To the Editor: How can Bob Dole say to Americans,'' You know how to spend your money better than the Government'' ( front page, Sept. 25 ) when a lot of Americans ca n't even pay off their credit cards?FIONA BAYLYNew York, Sept. 26, 1996Whose Money? And Whose Problems?"
Letter by AMA president Daniel H Johnson Jr calls for Federal law so that health maintenance organizations cannot prevent doctors from telling patients about all treatment options ,"The Tricky Business of Keeping Doctors Quiet,'' on the widespread use of health maintenance organization contract clauses that restrict what doctors can say to patients about treatment options and H.M.O. payment policies, and your Sept. 17 news article on state legislative initiatives aimed at banning such clauses, illustrate the need for patient safeguards. The American Medical Association, after reviewing more than 200 health plan contracts, found numerous examples of clauses like the ones excerpted your Week in Review article. We have worked with plans to provide contractual language to protect their business needs without compromising clinical disclosures to patients. Unfortunately, the position of some participants in the health plan industry has been to continue to fight against full patient access to medical information. This fall, 13 more states will introduce such legislation."
Shalini Gupta letter calls for more primary care in US to improve live expectancy figures ,"To the Editor: The life expectancy table in'' Aging World, New Wrinkles'' ( Week in Review, Sept. 22 ) comes as sad news. It is no secret that our health care cost is much higher than any of these countries. Why are we then spending a lot more for a shorter life span?Perhaps the most important reason for our poor results has been a lack of emphasis on primary care. Our obsession with high-technology medicine has not helped us to be a leader in life expectancy and infant mortality rates. It is time that we set a goal of producing a lot more physicians interested in practicing primary care."
Dr Harold Appel letter says poor treatment facilities at Moscow hospitals could point to similar situation in New York if government subsidies continue to be cut ,"To the Editor: Your Sept. 24 front-page article on the substandard care endured by Russian cardiac patients mentions that the Russian Ministry of Health requested $ 4.3 billion to run hospitals but received only $ 890 million. New York City's subsidy of the Health and Hospitals Corporation has dropped from $ 1.5 billion to $ 57 million in recent years. Perhaps the vision of Russian cardiac patients getting little care and a grim prognosis is a glimpse into our own future. HAROLD APPEL, M.D. New York, Sept. 26, 1996NO MOREBan All H.M.O.'s From Muzzling Doctors"
"Herbert N Lape letter resents Frank Rich's ridicule of Promise Keepers organization, saying it is only movement in which men of different races come together to promote male responsibility ","To the Editor: Re Frank Rich's Sept. 25 column''' I'm a Man,''' on the gathering of the Promise Keepers, the all-male, all-Christian movement, at Shea Stadium: I resent Mr. Rich's implication that people like me are a possible new army for the religious right. I am also a Quaker, and Quaker teachings are certainly not associated with the religious right. I am also the adoptive father ( white ) of a boy of mixed race and thus have a personal stake in racial reconciliation. PK is the only movement I know of where blacks, whites, Hispanic and Asian-Americans come together to keep the Rev. Dr. Martin Luther King Jr.'s message alive. Rather than promote understanding and reconciliation, Mr. Rich plays to our fears."
Alan Johnson letter notes that groups like Promise Keepers fill spiritual vacuum left by 'liberal' agenda of other Christian groups ,"To the Editor: I appreciate Frank Rich's Sept. 25 column,''' Thank God I'm a Man,''' but he neglects the crisis that prompts movements like Promise Keepers. Promise Keepers illumines the spiritual vacuum in much of the'' liberal'' agenda of mainline churches. Any church devoid of a vital, central Christian faith creates an entrance for groups like Promise Keepers, which can be a Trojan horse filled with hostility, misogyny and arrogance. The tone of Mr. Rich's column distances him from a needed spiritual engagement among men. Although he met some men at Shea Stadium who did'' hunger to overcome macho inhibitions and reconnect with God,'' why ca n't he pursue that tack? ALAN JOHNSONWestport, Conn., Sept. 26, 1996"
Correction of an article in today's Arts and Leisure section on the rerelease of the 1956 film Giant ,"Because of an editing error, an article on page 15 of the Arts and Leisure section today about the rerelease of the 1956 film'' Giant'' misstates its opening date at the Sony Lincoln Square Theater in Manhattan. It was Friday; it is not Oct. 4."
Correction of a listing in today's New Jersey regional on events at the Atlantic City casinos ,The'' At the Casinos'' listing on page 16 of the New Jersey section today includes an outdated listing for'' Cabaret of Illusions'' at the Grand. It closes tonight after performances at 7 and 9 P.M.
Detroit Lions waive linebacker Michael Brooks to get enough salary-cap room to sign rookie guard Jeff Hartings (S) ,"To get enough salary-cap room to sign their first-round draft pick, guard JEFF HARTINGS from Penn State, the Detroit Lions waived linebacker MICHAEL BROOKS on Friday. Brooks signed a two-year, $ 3.6 million contract in March. Coincidentally, another former Giants linebacker, PEPPER JOHNSON, will start at middle linebacker in place of Brooks.''Michael became a salary-cap casualty,'' said Lions Coach WAYNE FONTES.'' Pepper is moving well and is free of injuries.''Brooks, who spent eight seasons in Denver, was brought to the Giants in 1993 by Coach DAN REEVES, whom he played for with the Broncos. He was supposed to strengthen a linebacking corps that was depleted when Reeves waived Johnson and let CARL BANKS leave via free agency. Brooks, 32, lasted three seasons in New York."
"St Louis Rams, deciding against all-rookie backfield, start veteran Harold Green at tailback against Arizona ahead of Lawrence Phillips (S)&#xFFFD; ","The St. Louis Rams decided against an all-rookie backfield today at Arizona, starting HAROLD GREEN at tailback ahead of LAWRENCE PHILLIPS. Phillips has been slowed in practice by a sore knee this week, and Coach RICH BROOKS also wanted at least one veteran in the backfield to help quarterback TONY BANKS.(AP ) SPORTS PEOPLE: FOOTBALL"
United States men's champion Rudy Galindo to make professional deubt at United States Professional Championships (S)x ,"The United States men's champion, RUDY GALINDO, will make his professional debut at the United States Professional Championships Oct. 26, facing BRIAN BOITANO, VIKTOR PETRENKO, KURT BROWNING.(AP)SPORTS PEOPLE: FIGURE SKATING"
James P Newell letter holds Yankee Stadium is safer than Giants Stadium at Meadowlands; photo (S) ,"On Sept. 21, I drove in to Yankee Stadium from Long Island with my two sons and witnessed one of the most exciting baseball games that I have ever seen. The Stadium was packed with 55,000 enthusiastic fans, not all of whom were happy with the outcome. To Jets fans who remember the glory days of Joe Namath throwing into the gusts of Shea, Giants Stadium is as much a calamity as our head coaches have been. Like the Jets then, the Yankees do n't need a new stadium. The Bronx is as safe as any area that will have a new stadium, and if the Yankees, unlike the Meadowlands, continue their efficient and unobtrusive methods of crowd control, Yankee Stadium will remain the best place to witness a sporting event."
Randy Henrick letter on James Kunen's Sept 22 article on rooting for the Red Sox (S)7 ,"Like James Kunen ('' Rooting for the Red Sox,'' The Times, Sept. 22 ), I too am a lifelong Red Sox fan, but my 6-year-old son's loyalty and sense of the world do not depend on geography alone. To a Red Sox fan, the Yankees embody the evil of arrogant power. My son and I listen to the Red Sox on radio from Hartford, make an annual trek to friendly Fenway Park and attend several games in the Bronx despite the fan abuse. When the Red Sox do win the World Series, he and I will savor together the ultimate triumph."
Joe Mirsky letter on Jets-Giants game (S) ,"To the Sports Editor: Watching the Jets-Giants game was like watching two blind, toothless old men swing canes at each other. JON MIRSKYBrooklyn"
James Woods letter on rooting for New York Jets from Tennessee (S) ,"I was watching a black-and-white TV, watching a young Joe Namath throw a touchdown pass to a receiver ( was it Don Maynard? ) to beat the Oakland Raiders and propel the Jets into a game called the Super Bowl. I became a Jets fan that day. I've never been to a Jets game in person. There will, no doubt, be a call for the resignation of Coach Rich Kotite. He may be a poor coach, or a good coach, but as of this week, he is the only head coach the Jets have, so please do n't crucify him. Don't blame the players. There have been plenty of bad players for the Jets, from Al Woodall to Dexter Carter. But there have been good players, too."
"Mel Gussow profile of Alan Bates, English stage and screen actor who stars in Oliver's Travels, a new four-part BBC mini-series on PBS's Mystery series; photos (L) ","THE title character in'' Oliver's Travels,'' a new four-part BBC miniseries on Mystery, is a compulsive solver of crossword puzzles and an expert anagrammatician. When it is suggested that there is a common thread through these characters, beginning with their choice of profession, Mr. Bates looks abashed.' That just about sums up the character, who reveals little about himself while insistently probing others. With an evening performance coming up, Mr. Bates also had the character of Simon Hench on his mind. In the beginning, Oliver is such a noncommital character. By simply not pushing life and forcing events, he ends up with the right person,'' meaning Ms. Cusack's character.'' When Mr. Bates acts, the character becomes him.'"
"The Sports Reporters, ESPN's Sunday morning talk show, is entering its eighth year; photo (M) ","The Sports Reporters'' is a half-hour program, featuring mostly middle-aged newspapermen, and infrequently women, in a sort of McLaughlin Group about sports. But these guys are stereotypical old-fashioned sports purists.''The four men at the Atlanta dinner are all in a core group of about 10 sportswriters that appear on the show. Three panelists and Mr. Schaap discuss three current sports issues and each panelist ends the program by delivering a 45-second essay called a'' parting"
"Janet Maslin reviews movie A Self-Made Hero, which will be shown as part of New York Film Festival (M) ","It follows the opportunistic rise of Albert Dehousse ( Mathieu Kassovitz ), who must be deemed a veteran extraordinaire, since he begins his career in the French Resistance when World War II is effectively over. Albert appears to act out of facile self-interest for as long as he possibly can, a tactic for which the film largely appreciates him. At the Walter Reade Theater tonight at 9 and tomorrow at 6 P.M. as part of the 34th New York Film Festival. Mathieu Kassovitz ( Albert Dehousse ), Anouk Grinberg ( Servane ), Sandrine Kiberlain ( Yvette ) and Albert Dupontel ( Dionnet )."
Amnesty International USA Exec Dir William F Schulz letter urges independent judicial inquiry into killing of Diarmuid O'Neill in London ,"To the Editor: Amnesty International is urging an independent judicial inquiry into the killing of Diarmuid O'Neill in London. As you report in your Sept. 27 London Journal, Mr. O'Neill, who is said to have secretly worked for the Irish Republican Army, was shot to death by members of a counterterrorism police force. You report that the police used tear-gas during the operation. If it was as potent as described by another London newspaper, The Guardian, what effect would the gas have had on Mr. O'Neill's behavior or mental reasoning?We understand that the police investigation is being carried out by a senior officer of the Metropolitan Police Service, the same police force that was involved in the incident. Nothing short of an independent and impartial inquiry into the circumstances of Mr. O'Neill's death will suffice."
Dr R Michael Benitez letter contends that Edgar Allan Poe may have died of rabies encephalitis ,"Data published by the Centers for Disease Control and Prevention indicate that over the past 20 years in the United States there have been 33 reported cases of human rabies, yet only 24 percent of these victims could recall an appropriate history of animal exposure. Bat-related sub-types of rabies have been identified in 15 cases of human rabies since 1980, although patient contact of any sort with bats could be documented in only 7 of these patients. Finally, although physicians knew how rabies was transmitted at the time of Poe's death, even at the time of Louis Pasteur's first use of a rabies'' vaccine'' in 1885 the causative agent, a rhabdovirus, was unknown."
Amitava Kumar letter responds to Bharati Mukherjee Sept 22 Op-Ed article on new immigration bill ,"To the Editor: One could cite about 187 propositions to counter Bharati Mukherjee's claims made on behalf of applying for citizenship in this country ( Op-Ed, Sept. 22 ). The current measures taken against immigrants are not an invitation to apply for citizenship, as Ms. Mukherjee seems to believe. Six years ago, Ms. Mukherjee offered the dictum:'' Make the familiar exotic, the exotic familiar.'' In the light of her recent piece, it sounds like the motto engraved on the very fair forehead of a global traveling salesman. AMITAVA KUMARGainesville, Fla., Sept. 26, 1996 The writer is assistant professor of English, University of Florida. Immigration Agency Has Record of Success"
Neil Strauss reviews peformance of comedian Eddie Izzard at Performance Space 122; photo (M) ,"A household name in Britain, Mr. Izzard is practically unknown here. Yet in an hour-and-a-half monologue on Thursday night, Mr. Izzard gradually brought a sold-out house into his imaginative re-rendering of the everyday world. Unlike comics who work the club circuit, Mr. Izzard rarely interacted with the audience, but he always engaged it, closely sticking to prepared material. Near the beginning of the show, for example, he talked about a British dog food that, in an inexplicable marketing move, changed its name from Mr. Dog to Caesar. One hour and many topics later, after portraying such characters as Pliny the Younger and Hannibal of Carthage, he introduced one of the greatest statesmen and generals of the Roman Empire: Mr. Dog."
Christopher Lehmann-Haupt reviews book Tyranny of the Normal by Leslie Fielder; photo (M) ,"TYRANNY OF THE NORMAL Essays on Bioethics, Theology and Myth By Leslie Fiedler 155 pages. $ 22.95.''Tyranny of the Normal'' is Leslie Fiedler's 25th book, and what he is doing from line to line in these nine essays will seem familiar to anyone who has followed his work since'' ( 1978).As always, in his new book Mr. Fiedler examines human myths as they reveal themselves in popular culture. By popular culture, he means everything from movies to comic strips, from television shows to musical comedies. Jekyll and Mr. Hyde'' and H. G. Wells's'' Island of Dr. Moreau'' reveal the human psyche's deep revulsion with medical practices like blood transfusion and the interchange of human parts. BOOKS OF THE TIMES"
"Janet Maslin reviews movie Sling Blade, part of New York Film Festival; photo (M) ","The core of Billy Bob Thornton's'' Sling Blade'' is Mr. Thornton's own arresting performance as Karl Childers, a terse, withdrawn character with unspoiled innocence despite a terrible past. Tentative and shy, Karl strikes up a friendship with a boy named Frank ( Lucas Black ), whose mother, Linda ( Natalie Canerday ), is in the thrall of her overbearing, drunken lover. Shown as part of the 34th New York Film Festival. Billy Bob Thornton ( Karl Childers ), Dwight Yoakam ( Doyle Hargraves ), J. T. Walsh ( Charles Bushman ), John Ritter ( Vaughan Cunningham ), Lucas Black ( Frank Wheatley ), Natalie Canerday ( Linda Wheatley ), James Hampton ( Jerry Woolridge ) and Robert Duvall ( Karl's Father).FILM FESTIVAL REVIEW"
Caryn James reviews ABC television program Dangerous Minds; photo (M) ,"The movie was based on the true story of Louanne Johnson, a former marine turned high school teacher. , Ms. Johnson has become just another stereotypical television teacher, whose job description defies the boundaries of time and space. One of Ms. Johnson's brightest students, a teen-ager named Callie, has a 2-year-old daughter and a demanding job. At the end, Ms. Johnson and some other teachers talk about whether she is crossing a professional line. Instead, the conversation simply serves to shine Ms. Johnson's halo. Series executive producers, Ms. Frolov and Mr. Schneider. Executive producers, Mr. Bass, Don Simpson and Jerry Bruckheimer. Series co- executive producer, Michael Vittes; series supervising producer, James Hayman; premiere supervising producer, Ms. Rusconi; premiere editor, Maryann Brandon."
Alan Truscott Bridge column; diagram (M) ,"He was 81, but was able to play one session a day for three days against America's best players. The final double, a doubtful venture, was based on East's club strength. Hearts were led, and West held up his ace for one round and then shifted to a club. Dummy played low, and East won with the queen and led the spade ten. South won with the king, a good play, and cashed another top heart. Next she cashed the club ace and led the last diamond, forcing West to concede a trick to the spade jack at the finish. The annual Jim Becker Memorial Charity Game will be played at the Beverly Club, 130 East 57th Street in Manhattan, on Oct. 8."
Anthony Tommasini reviews New York City Opera production of La Boheme (M) ,"Even at the New York City Opera, where giving opportunities to emerging American singers is a house policy, it is not too often that three cast members make simultaneous debuts. But that is what Friday night offered with Graziella Sciutti's rewardingly intimate production of Puccini's'' Boheme.''William Joyner, a North Carolina-born tenor making his debut as Rodolfo, seemed vocally jittery in Act I, with breathy low notes and a tight top range. The soprano Laurinda Nikkel, in her debut as Musetta, mostly relied on the standardized portrayal of the character as a coquettish Latin Quarter diva. Lester Lynch, a robust baritone, made a hearty Marcello. No one will yet mistake the New York City Opera Orchestra for a great ensemble."
"Kinshasa Journal: Booming City, Flush With Rats and Dying Children**Peasants from all over Zaire make their way to Kinshasa in search of better life; few find one; urban development experts say Kinshasa is city with exploding population, many slums and virtually no planning or management; map; photo (M) ","From their two-room shack that clings to the hillside next to a gully carrying raw sewage through one of this city's many slums, Georgine Meme and her nine children set out each morning in search of life's basics. Every day Mrs. Meme's story is repeated by the thousands, as wave after wave of peasants from all over Zaire make their way to Kinshasa in search of a better life. Last year, a health crisis erupted when, depending upon whose version one believes, city officials either made off with funds budgeted for the chlorine used to purify the municipal water supply, or the money for that purpose simply ran out. And as groups like this multiply, people say the existence of well-functioning councils can mean the difference between life and death."
