abstract,summary
"Soup Nutsy take-out shop on East 46th Street is latest spinoff from Seinfeld television program's famous 'Soup Nazi' show, about West Side soup dictator Al Yeganeh; Indian-born partners offer more friendly service, as do owners of Daily Soup, third Manhattan soup emporium; photo (S) ","In the beginning, there was Al Yeganeh, a Manhattan soup maker so autocratic that the comedian Jerry Seinfeld parodied him on television as the Soup Nazi. When somebody said Soup Nutsy, we all cracked up. what does Mr. Yeganeh think about Soup Nutsy? If soups were cars, the three soup makers would be Mercedes-Benzes. Soup Nutsy's chef, Gilbert Le Liboux, trained at the Hotel de Crillon in Paris.'' If you are a good saucier,'' he said,'' then you can make good soup.''For now, the three soup makers do n't really compete: Soup Nutsy is nearly half a mile northeast of Daily Soup."
Saturn auto plant in Tennessee now offers tours; photo; list of some other US auto plants open to public (S) ,"SINCE it opened in 1990, the Saturn auto plant has been a magnet for tourists in the hills of central Tennessee. Tours of car plants in other states are just as popular. Paradoxically, a tour of a Lincoln plant outside Detroit is the only one near the nation's Motor City. Reservations, which are required, may be made by calling ( 615 ) 459- 1444.SATURN: Public tours begin at 12:30 P.M. on Tuesdays and Thursdays at the plant in Spring Hill, Tenn. Reservations, which can be made by calling ( 615 ) 486- 5083, are required. The company has suspended tours until fall while it shifts production to 1997 models, but the plant's visitors center-- which includes displays of cars and interactive video screens, remains open."
"Article by Repr Charles E Schumer urges competition for credit card companies; says American Express, Discover and other potential credit card companies want the chance to offer their products through banks; holds current restrictions in credit card arena contradict the principles of open markets and price competition that are hallmarks of capitalist economy (L)g ","Virtually all the 6,500 banks nationwide that issue credit cards belong to the Visa or Mastercard associations, and the handful of big banks that control these groups have collaborated successfully to eliminate unwanted competition. American Express, Discover and other potential credit card companies want the chance to offer their products through banks. Visa and Mastercard banks are allowed to issue each other's cards, however, and both groups are also allowed to issue Diners Club cards. few big banks dominate the United States credit card market through their control of the Visa and Mastercard associations. If we restore fair and healthy competition to the credit card market, everybody will benefit."
Peter Passell appraises Saab 900 SE turbo model; photos (S) ,"IN the mid-1980's the yuppie car of choice was the Saab 900 Turbo-- preferably in jet black. The real kick here is The Kick: a surge of power delivered by the 900 SE's four-cylinder, two-liter turbocharged engine, which is rated at 185 horsepower. The 900 SE's suspension and steering take bumps with the aplomb of a big Lexus. Dual air bags, anti-lock brakes, rear side window demisters, headlamp washers, fog lights and daytime running lights are standard equipment. Probably the most serious obstacle to selling a lot of Saab 900 SE turbos is the sticker price. BEHIND THE WHEEL / Saab 900 SE"
Oberweis Emerging Growth fnd manager James Oberweis and USAA Aggressive Growth fund co-manager John Cabell comment on guidelines they used when they sold large positions in Valujet Airlines following cash of Flight 592 in Florida Everglades on May 11; photo (L)&#xFFFD; ,"When Valujet Flight 592 crashed in the Florida Everglades on May 11, tragically taking the lives of 110 people, James Oberweis held about 120,000 shares of the airline in his Oberweis Emerging Growth fund, about 1 percent of its assets. The rule of thumb is to preserve capital,'' explained John Cabell, a co- manager of the USAA Aggressive Growth fund in San Antonio, which also had a large position in Valujet at the time of the crash.' About eight months before the Valujet crash, Mr. Cabell cut his then 400,000-share position in the carrier in half, to take some profits when the stock was selling between $ 20 and $ 25. Mr. Cabell said. Even if it was a good company, it was not a good stock.''MUTUAL FUNDS"
Halton Adler Mann says Columbus Circle in New York has most repulsive conglomeration of architectural atrocities ever to inhabit a public space; suggests creating park-in-the-round (S) ,"To the Editor: Herbert Muschamp's analysis of the'' white elephant'' at 2 Columbus Circle ( appraisal, July 31 ) does not mention that the circle has the most repulsive conglomeration of architectural atrocities ever to inhabit a public plaza with the possible exception of Boston's Government Center. It is too late for Columbus Circle to aspire to the 19th-century symmetry of a Parisian place or square. But if the Huntington Hartford and Edward Durell Stone folly is to be razed, it would create an opportunity for a vest-pocket park with a waterfall, trees and benches. Columbus Circle could be made into a park-in-the-round with grass and shade trees replacing the dreadful macadam, and traffic could be diverted with tunnels under it connecting Eighth Avenue with Central Park West and upper and lower Broadway."
"Cover story profiles FDA Comr David Kessler, who has spent past 20 months being squeezed in fist of Republican deregulation revolution; Kessler is unapologetic enforcer of food and drug laws, and he has much to enforce; FDA regulates, in effect, every supermarket and pharmacy in America, one-fourth of all consumer spending--some $1 trillion of goods, including food, drugs, cosmetics, medical devices and nation's blood supply; as result, FDA is constantly placing itself at center of controversy; for deregulationists, Kessler is personification of overbearing, intrusive Govt; this is partly because of his Pres Clinton-anointed role as Public Enemy No. 1 of Big Tobacco; it was Kessler who 18 months ago handed White House a fat political winner by redefining tobacco as a 'pediatric disease,' not as an issue of adult choice, as cigarette industry would have it; White House is trying to protect Kessler's scientific independence; photos (L) ","Any day now, President Clinton, undoubtedly with Kessler by his side, will announce that the F.D.A. will begin regulating nicotine as a drug. All of them would like to see more quiescent F.D.A. than the one Kessler now commands. But it became a burden for the F.D.A. Kessler mutters. Kessler finished. Cooper, a former F.D.A. official, responds with a rare note of understanding for Kessler:'' Because the tobacco companies are suing the F.D.A. to keep it out of the nicotine-regulation business, Kessler steps lightly. But what if the tobacco industry truly matched the F.D.A.'s plan, proposal for proposal? David Kessler, right?'' Butnot to Kessler. The announcement would surely be the climax of Kessler's F.D.A. stewardship."
Cory Franklin letter on news media's naming of suspect in bombing at Atlanta Olympic Games; says impact of such reports on public perception should not be underestimated ,"To the Editor: Regarding your Aug. 1 news article on the news media's naming of a bomb suspect in the Atlanta Olympics case, the impact of press reporting on public perception of a suspect's guilt or innocence should not be underestimated. We need look no further than the case of Trans World Airlines Flight 800, in which a bomb is strongly suspected as the cause of the crash. Even though the alleged Unabomber, Theodore J. Kaczynski has not yet been convicted of anything, the reason he is not a suspect in the T.W.A. crash in that the public is convinced, through media reporting, that the Unabomber has been captured."
"Barry Ginsberg letter recounts real-life incident demonstrating that New York City police detective Thomas McKenna, model for Hollywood films, is really a 'cop's cop' (S) ","Detective McKenna told the attendant to call the police. Moments later, a new Mercedes came speeding up the exit ramp and screeched to a halt inches from Detective McKenna's Nissan. Then, Detective McKenna and the other police entered the garage, finding one of the remaining two robbers in a BMW with the garage's cash register in the back seat. Detective McKenna and the garage attendant were asked to view a line-up."
"Philip L Elkus letter on August 1 obituary about Harold Fox; recalls how his own father, Nathan Elkus, designed zoot suit in 1939 (S) ","It was back in 1939 when my dad took a regular suit, marked it with a host of chalk marks and sent it off to Blankson Clothes of New York to have a sample garment made. I was there when the sample suit came back from New York and my dad opened the package. He was furious because Blankson made the sample with regular pockets instead of slash pockets and had a normal button front instead of a fly front. Incidentally, the model shown in your article was a later revision of the original suit, which was a single-breasted model, fly front, slash pocket with a one-piece back with peg legs having a 30-inch knee and a 15-inch bottom."
"Publicist Peggy Siegal discusses party for children and adults to mark opening of film Matilda, based on Roald Dahl's book; Danny DeVito directs and also stars, along with his wife, Rhea Perlman (S) ","I'VE never met a child who did n't love a movie at a premiere,'' Peggy Siegal said on Tuesday at the'' Matilda'' party, at Circo on West 55th Street.'' It's a party, and children get it.''Ms. Ms. Siegal said. I mean, what normal parent would bring their child to a party at 10 o'clock at night?'' Siegal, whose resume includes planning parties for her niece, age 8 ('' When I invite her to a screening,'' she said,'' she asks if the talent will be there'' ), is probably the only world-class authority on the well-made children's premiere. goody bags, Ms. Siegal said:'' At age 4, kids know from gift bags."
"Neptune microbrewery in Manhattan offers La Reina Latina, full-boded beer suggested by two Honduran-born employees, Armando and Emilio Hernandez; label photo (S) ","The beer is the brainchild of Armando and Emilio Hernandez, brothers from Honduras who are employed by the year-old Neptune microbrewery on West 16th Street. They got the go-ahead from Paul Levitt, Neptune's owner, and came up with La Reina Latina, which has a full-bodied flavor-- stronger than most commercial beers but lighter than many microbrews. The beer was introduced this spring, with the Hernandez brothers handling the line's marketing. The clients include Latino restaurants in the South Bronx and northern Manhattan, and restaurants and bodegas in Brooklyn, Queens and Long Island, said Neptune's brewmaster, Craig Montano. Neptune, whose staff is largely Latino, also makes an American-style pale ale, Neptune 66; a British-style, nut-brown ale, Neptune U, and a dry, Irish-style Black Sea Stout."
"Article on Mark G Holowesko, manager of Templeton's Foreign and Growth funds, who placed 18th out of 25, representing the Bahamas, in Star class division of Olympic yachting in Atlanta, Ga (L) ","PERFORMANCE being so important to attracting cash, most mutual fund managers would be disheartened to end up ranking 18th out of 25, even if it was a tie. After graduate school, he worked as John Templeton's research assistant for two and a half years before he became a fund manager. The Foreign fund is up 6.1 percent, putting it in the top third of its group. But over 10 years, the funds move way up in performance. Growth, with a 13.75 percent return, is in the top 7 percentile of similar funds, and Foreign, with a 15.07 percent return, is sailing away in the top 4 percent of its group. MUTUAL FUNDS"
Photos of some summer benefit parties in New York ,Gatherings to honor a vintage film maker and Tiffany's chief window designer. EVENING HOURS
"Sahara Hotel, vacant SRO that blights corner of Third Avenue and 14th Street in Manhattan, may finally be sold to developer; photo; owners have stalled on 1985 promise to sell building to avoid prosecution(S) ","To local business leaders, the vacant Sahara Hotel on Third Avenue and 14th Street has long been a blight, keeping the bloom of Union Square's economic revival from reaching this down-and-out strip two blocks to the east. But over the last decade, the owners, Jay Wartski and Louis Pappas, held onto the building, despite another court ruling in 1990 that required them to dispose of the Sahara within four months. Since then, the building has stood vacant, except for a peep show and a triple-X video store.''The Sahara has been nothing but misery for this community,'' said Robert Walsh, executive director of the 14th Street Local Development Corporation."
"Korean American Senior Center in Flushing, New York City, agrees to have gardeners grow flowers in city-owned plots; photo; neighbors had complained that gardeners were using public land to grow vegetables for commercial sale (S) ","Then this immigrant couple from Korea came to be involved with a little plot of land in the Kissena Park Corridor on Colden Street. Mr. Park said, stomping the ground for emphasis. It is an arrangement that the gardeners and the Parks Department consider mutually beneficial-- it saves the city money on land maintenance and gives pleasure to the growers. But longtime neighbors of the garden are angry because the gardeners have turned the plot of city-owned land into a profit-making enterprise.''The trucks would come at harvest time and take the produce away to sell it somewhere,'' said Otto Fiorillo, who lives across the street from the park.' Still, regardless of whether the vegetables are sold, the Parks Department prefers that community groups grow flowers on park land."
"Interview with Daphne Hellman, 80-year-old harpist who enjoys playing occasionally in New York City subway stations, as well as in clubs; photo; Hellman was born to wealthy social family and lives in East Side town house, but chose more unconventional career, and enjoys playing her eclectic mix of baroque, country-western and pop ballads; interview (M) ","DAPHNE HELLMAN wants a gig. At the insistence of her strong-willed mother, Ms. Hellman took up the harp at 12, and first performed at a Presbyterian church in New Jersey two years later.'' Last year, at one of her parties, Ms. Hellman surprised everyone by beating Mr. Mailer at a game of Ping-Pong.' Ms. Hellman married Hsio-Wen Shih in 1961, whom she described as'' a brilliant architect who drank too much.'' With rush-hour crowds swarming all around last week, Ms. Hellman sat on the R train platform at 59th Street strumming a rococo version of'' King of the Road.'' Half an hour later, Ms. Hellman was playing to a nearly empty lounge at the Hotel Wales, where she performs several times a week.''"
South Asian Lesbian and Gay Assn plans demonstrations at sidelines to protest exclusion from India Day and Pakistan Day parades in New York; events mark countries' independence from Britain; Pakistani organizer says homosexuality is against Islam and common sense (S) ,"Angered by their exclusion from parades celebrating India's and Pakistan's independence from British rule, some gay and lesbian South Asians plan to demonstrate and celebrate on the sidelines this month. The South Asian Lesbian and Gay Association contends that organizers of the India Day Parade, scheduled for Aug. 18, and organizers of the Pakistan Day Parade, scheduled for Aug. 25, have barred them from participating. Faraz Ahmed, 23, a native of India and the gay association's coordinator, argues that the rules for participating in the parade keep changing.' The exclusion of gay people from the Indian parade is particularly upsetting to the association because the Indian actress Sridevi is its grand marshal."
"Growing number of rock groups, theatrical shows and museum exhibits are providing discount tickets; motivation for doing good ranges from a chance to score public relations points to keeping the faith with grass-roots supporters; providing some good seats at discounted prices also keeps tickets out of scalpers hands; table; photo (L)/ ","But some brokers charge far more, especially when they get their tickets illegally, as apparently was the case at the Hootie concert. Tickets for even a Broadway dud can still go for $ 65. He did n't camp out for that ticket.''' Whether the tickets are obtained by brokers legally or not, they certainly can be hard to buy at the box office. Yet when the Olympics finally opened, 3 million of the original 11 million tickets were still available, at their original prices. There are no tickets to be scalped. The truth is that if you want a ticket to the Open, you can get it. ' Not only will the ticket be more difficult to scalp, the fan will know exactly how much it will cost."
Summary of news stories on inside pages of City section ,"MAKING IT WORK3 Pluck is more than just a description of playing the harp for Daphne Hellman, 80.NEW YORKERS & amp; CO.4 For models, figurative art is back-- and sometimes bare. MOVIE CLOCK10 What's showing at the local movie houses, today through Thursday. PLAYING IN THE NEIGHBORHOOD16 Environmental fun by the Harlem River; outhouse artifacts; an Asian film festival. GOOD EATING16 SoHo's variety; compelling cooking at Cascabel; juicy Peruvian chicken at El Pollo; soul food at Kwanzaa. SOAPBOX17 Where there's cigarette smoke, there's an angry restaurant critic. And letters."
"Article on whether accountants are professionals who exercise independent judgment or whether they just follow rules and checklists; issue is at base of many disputes and it is part of what may be dumbest ethics investigation by a profession; some corporate officials see emphasis on super-detailed rules as a way of accountants trying to get out from under both pressure from clients and any legal liablity; one of accounting profession's most visible and vigorous critics, Abraham Briloff, raised such concerns in criticizing proposed rule on when companies should consolidate their results with related companies (L) ","Are accountants professionals who exercise independent judgment, or do they just follow rules and checklists?That question, at heart, is at the base of many disputes over accounting rules. In accounting, it is often possible to account for a transaction in two or more different ways. The trend has been for the Financial Accounting Standards Board to set rules that go into great detail, so that the accountant has little or no discretion. One of the accounting profession's most visible and vigorous critics, Abraham Briloff, raised such concerns in criticizing a proposed rule on when companies should consolidate their results with related companies. It would be nice to believe that the state of accounting ethics is so high that Mr. Briloff is among the most serious transgressors."
"Anthony Avena, 81-year-old shoe shine man at LIRR stop in Flushing, will have to vacate stall he has used since 1920's; MTA has found tenant to pay much higher rent (S) ","After nine months of waiting for word from the Metropolitan Transportation Authority, an 81-year-old shoe shine man who has been working out of a 240-square-foot stall underneath the Long Island Rail Road stop at Flushing since the 1920's got the dreaded news he had been expecting last week: he is to pack up and leave by Aug. 31.''It's a psychological blow,'' said the proprietor, Anthony Avena.' It's cruel.''Last October, the M.T.A. told Mr. Avena that the rent on the kiosk,, would increase from $ 750 to $ 6,500 a month. An M.T.A. spokesman, John Cunningham, said a new tenant is close to signing a lease. He made me go to college and get an education.''JANE H. LIINEIGHBORHOOD REPORT: FLUSHING"
"Community advocates in Mott Haven section of the Bronx are angry at possible reopening of two medical waste incinerators that were shut down two years ago, after being cited for numerous environmental violations (S) ","Two years ago, a coalition of Mott Haven residents appeared to be gaining some success in their drive to shut down two three-story medical waste incinerators at 138th Street and Locust Avenue. State inspectors agreed and the incinerators were temporarily shut down. In 1993, the incinerators' operator, Metro New York Health Waste Processing Inc., which had a limited partnership with Resource Management Technologies, filed for bankruptcy. Last August, Houston-based Browning-Ferris Industries, the country's second-largest waste management company, bought the incinerators. Philip Angell, an assistant to the chairman of Browning-Ferris, said the company has spent nearly $ 2 million to have the incinerators comply with state and city environmental regulations. They say Browning-Ferris has fallen short of assuring them that the incinerators' operation would not have negative health effects."
Article on investing in foreign stocks after dramatic downturn in US stocks in July; graph (L)v ,"AFTER a scary July in the stock market, many American investors may be looking abroad this summer for more than just a nice vacation. But despite all the talk about globalization, economies and stock markets throughout the world are typically out of sync. That means when the American market is troubled, others may be thriving. And many foreign economies, and thus their stock markets, simply grow faster than ours do. It is overweight in our international funds.''Europe is n't the only place to find cheap stock markets and economic growth.'' China and Mexico also have cheaply priced markets and good growth prospects, she said."
Ancient Indian art of painting designs and symbols on hands with henna is demonstrated at New York art gallery; photos (S) ,"There was a party at an art gallery in the East Village on Thursday, but no one was looking at art. On hands. It arrived at the Bridges & amp; Bodell Art gallery at 13 East Seventh Street thanks to the efforts of Loretta Roome, a pop singer from Manhattan, and Rani Patel, a native of Kanpur, India. Wednesdays through Sundays in August, the price will be from $ 5 for a small hand design up to $ 250 for an entire back. Mehndi designs go on green, take about an hour to dry, then turn burnt orange. I tend to change my mind a lot.''MONIQUE P. YAZIGINEIGHBORHOOD REPORT: EAST VILLAGE"
Some workers comment on summer employment; drawing (L)L ,"Summer jobs? Sometimes it verges on the ridiculous.''But magazine readers can rest assured, she adds, that someone like her is doing the doubting for them. What did Keith A. Styrcula of Westport, Conn., learn from his summer job in the late 1980's? After his first year of law school, he hooked up with a professional'' pro se'' plaintiff for $ 400 a week. When it says she constructed marketing strategies, it means she did word processing and mass mailings of the boss's strategies. She's been making coffee.''What has Adam Chalom of Beverly Hills, Mich., been doing in the summer between his junior and senior years at Yale?"
"Activists in Red Hook section of Brooklyn are cicrulating petitions to get bank to open local branch; Independence Savings Bank president Charles J Hamm has offered $1 million in loan money or new branch if 3,000 signatures are collected (S) ","The three men, members of the Red Hook Banking Committee, are part of an effort to attract a bank to Red Hook, an isolated neighborhood of public housing projects, row houses and crumbling warehouses. The closest bank branch is in Carroll Gardens. This community needs this bank.''Earlier this year, Charles J. Hamm, the president of Independence Savings Bank, challenged members of the committee to demonstrate that need by collecting signatures from at least 3,000 Red Hook residents. SOMINI SENGUPTANEIGHBORHOOD REPORT: RED HOOK"
Up to 35 percent of a mutual fund can be invested in something other than the fund name suggests; that is something Securities and Exchange Commission has been thinking about changing; among proposals that commission is considering is one to increase percentage of particular securities that a fund must own before it can assume that monikor (M)4 ,"THAT'S in a mutual fund? The name implies the fund is concentrated, which, at that time anyway, it was not. In fact, up to 35 percent of a fund can be invested in something other than what the fund name suggests. Scudder Imposes Fee on AnnuitiesWatch out for more fees on annuities. Such fees are common on mutual funds, but not on investments embedded in annuities. The fee applies to five of the seven portfolios of the Scudder Variable Life Insurance fund, which is sold through insurance companies. The fee will be determined by each insurance company, Scudder says, but can not exceed a quarter of 1 percent of the assets each year. FUNDS"
"New York City community boards review Transportation Department proposal to encourage harmonious street design by allowing single vendors to design and build specified numbers of bus shelters, newsstands, automatic toilets and other kiosks; Manhattan board wants to reduce sizes and advertising (S) ","City Hall and its supporters say the proposal will lead to handsome newsstands, bus shelters with pay phones and computer terminals and needed public toilets. But critics say the proposal will pinch already crowded sidewalks and produce structures that are too big and carry too much advertising, like a nearly two-story kiosk that can display 108 square feet of ads, the equivalent of 18 men standing shoulder to shoulder. For example, the board would like a limit on advertising and smaller structures. In addition, the city is encouraging vendors to also bid on a separate pay-telephone franchise so phones could be added to other structures. The vendor would share with the city the revenue from advertising."
