abstract,summary
"Boston Red Sox defeat New York Yankees, 7-5; photos (M) ","Those are directions to the Yankee Stadium bullpen, and that's where Dwight Gooden's new baseball home should be in October. He is fatigued, he has scant confidence and he would be a detrimental starter.''It was n't one of his better games,'' said Manager Joe Torre, who, curiously, said Gooden was still in contention for a post-season start.'' But Gooden's laborious 98-pitch fiasco tonight after one week of rest should erase him from any of the four starting spots. Gooden is 1- 2 with a 5.71 e.r.a. versus Texas. Torre cited Cone's experience in selecting him over Andy Pettitte, a 21-game winner who will pitch two innings Saturday and start in Game 2.''The experience, you ca n't buy that,''"
"North Korea warns that rising tensions over grounding of its submarine off South Korea might lead to war, and it suggests that it might have to attack South (M) ","The dispute broke out on Sept. 18 when a 325-ton North Korean submarine ran aground in South Korea. It is believed that 26 North Koreans slipped ashore, armed with sidearms and machine guns, some disguised in South Korean military uniforms. South Korea denounced the incursion, but the North responded today by condemning the way South Korea had carried out an intensive manhunt for the infiltrators. So far South Korean troops have captured one commando alive, killed 9 and found 11 already dead, possibly murdered by other North Koreans; they are searching for 5 others.$(South Korean troops killed a 10th infiltrator on Saturday, Reuters reported, quoting the Defense Ministry."
"Lt Gen Pavel A Sudoplatov, legendary Soviet spymaster, dies at age 89; exploits, including death of Leon Trotsky, recounted; photo (S) ","General Sudoplatov said that Oppenheimer and the other scientists passed the secrets to people they knew to be Soviet agents and that they did so both because they wanted to help the Soviet Union defeat Hitler and because they believed that spreading knowledge of the secrets of making nuclear bombs would promote world peace. General Sudoplatov directed Communist underground activities against Nazi Germany in World War II. He was the scientific director of the Los Alamos laboratory, where the first atomic bomb was made, not the head of the Manhattan Project."
"New Jersey Nets new coach, John Calipari, is treating players to posh Florida training camp and luxury hotels in effort to boost team; photo (M) ","Coach John Calipari is counting on a luxury tax of sorts, a payback for the star treatment he gives his players: fly a guy first class, and he'll upgrade his game in return. The upgrade is n't just for the Nets' training camp. Sounds like a Pat Riley camp. Calipari will enter his first National Basketball Association camp with similar control and salary, as well as hair gel. So far, Calipari's off to a good start. Before camp opens, Calipari has arranged to have all the players' families stay at the resort this weekend. REBOUNDSKEVIN EDWARDS is in rehabilitation for his knee injury and will not be in training camp...."
"Philadelphia Phillies defeat New York Mets, 6-5; photo (M)y ","Within hours of undergoing arthroscopic surgery on his throwing arm, Jason Isringhausen was in uniform in the Mets' dugout eager to watch batting practice.' Isringhausen had four bone chips-- two large ones, two small-- removed from his right elbow and a tear in the labrum of his right shoulder repaired during a two-hour procedure at the Hospital for Special Surgery in Manhattan. The Mets dodged a scare yesterday when a magnetic resonance imaging test on Paul Wilson's throwing shoulder showed no structural damage. Isringhausen said he has a small tear in the ligament in his elbow. PITCHThe Mets could not hold a 4- 3 lead for PETE HARNISCH as the Phillies rallied for three runs in the eighth inning and a 6- 5 victory at Shea Stadium last night."
"Zhao Ziyang, former General Secretary of China's Communist Party, is living out his days in kind of internal exile that is reserved for purged party bosses; Zhao in 1989 refused to order military crackdown against pro-democracy demonstrators occupying Tiananmen Square; his photo (M)D ","Only seven years ago, Mr. Zhao was at the very apex of power as General Secretary of the Communist Party. But now, Mr. Zhao's voice is being heard again-- however indirectly-- in the Chinese capital, where he has summoned old friends in the party establishment to his courtyard to vent his anger. Zhao is said to be livid over the publication of a book that suggests that he was disloyal to Hu Yaobang, the Communist Party chief he succeeded in 1987 and who was so admired by the Chinese that his death in April 1989 sparked the Tiananmen demonstrations. But Mr. Zhao's complaint has circulated widely in Beijing."
"Defense Sec William J Perry, after meeting of NATO defense ministers in Norway, says Estonia, Latvia and Lithuania are 'not ready' for inclusion in Western military alliance (S)&#xFFFD; ","The United States today dashed the hopes of Estonia, Latvia and Lithuania that the three Baltic nations would be among the first new NATO members drawn from Eastern Europe. Defense Secretary William J. Perry said after a meeting of NATO defense ministers here that the three nations were'' not ready'' for inclusion in the Western military alliance. Russia has opposed NATO expansion, and it has been adamant that Estonia, Latvia and Lithuania remain outside the Western alliance both because of their proximity to Russia and because of their treatment of Russian ethnic minorities."
"San Diego Padres defeat Los Angeles Dodgers, 5-2, to clinch at least tie for National League wild-card berth (M)&#xFFFD; ","The San Diego third baseman, who needs shoulder surgery after the season, may have delayed the operation a while. His heroics gave the Padres a 5- 2 victory over the sloppy Los Angeles Dodgers tonight and clinched San Diego at least a tie for the National League wild-card berth. The Dodgers-- who clinched at least a wild-card berth with Montreal's loss to Atlanta tonight-- could have clinched the division with a victory, but their lead is now trimmed to one game with just two to play. Steve Finley opened with a sharp single to left, and Caminiti followed with a spinning line drive to the left-field corner off of reliever Antonio Osuna ( Should the Padres win again, it would all boil down to a winner-take-all game for the division title on Sunday."
Western Resources Inc says its Westar Security unit has acquired Safeguard Alarms Inc in another move to expand in Kansas City market (S) ,"WESTERN RESOURCES INC., Topeka, Kan., said its Westar Security unit had acquired Safeguard Alarms Inc. in another move to expand in the Kansas City market. Terms were not disclosed. NEW YORK BANCORP INC., Douglaston, Queens, a bank holding company, said it planned to buy back up to 10 percent of its common stock. As of June 30, the company had 11.5 million shares outstanding. COMPANY BRIEFS"
New York Rangers announcers will read commercials selling New Jersey Devils tickets when Rangers play Devils at Meadowlands tonight (S) ,"When the Rangers play the Devils at the Meadowlands tonight, the Ranger announcers on the Madison Square Garden network will read commercials selling Devils tickets. According to LOU LAMORIELLO, the president and general manager of the Devils, the MSG Network has to broadcast the commercials because it decided to televise the game from the Devils' arena before getting approval from the Devils.''They evidently assumed they could broadcast that game, and they needed permission to do so,'' Lamoriello said.'' slightly different story comes from Madison Square Garden, where JOSEPH M. COHEN, the executive vice president, supervises the television operation. Cohen said MSG had bought telecast rights from the Devils for an undisclosed sum before making the agreement to broadcast the Devils commercials.''Lou and I got into,' What can you do for me?"
Brent Jones of San Francisco 49ers is sidelined with shoulder injury (S)( ,"A shoulder injury has sidelined tight end BRENT JONES, the second marquee 49ers player knocked out of action this week. Jones will miss tomorrow's game against the Atlanta Falcons in San Francisco. He will be on the sideline with quarterback STEVE YOUNG, who is bothered by a groin strain. ELVIS GRBAC is starting in place of Young. ( AP)SPORTS PEOPLE: FOOTBALL"
"Detroit Lions sign guard Jeff Hartings, last NFL first-round draft choice to come to terms (S) ","The Detroit Lions yesterday signed guard JEFF HARTINGS, the last National Football League first-round draft choice to come to terms. Terms were not disclosed, but published reports said Hartings signed a five-year, $ 5.25 million contract. ( AP)SPORTS PEOPLE: FOOTBALL"
Phoenix Suns guard Kevin Johnson undergoes abdominal surgery and will be sidelined up to two months (S) ,"Suns guard KEVIN JOHNSON underwent abdominal hernia surgery last night in Phoenix and will be sidelined up to two months. Johnson, 30, who has said that this, his 10th season, would be his last, was bothered by pain in his lower abdomen and groin last season and missed 26 games. RICHARD EMERSON, the team physician, said surgery became necessary when treatment did not resolve the ailment. ( AP)SPORTS PEOPLE: BASKETBALL"
"Sacramento Kings say they have withdrawn from international arbitration proceeding in London over their first-round draft choice Predrag Stojakovic; Stojakovic, 19, will play this season for Greek League team PAOK (S)8 ","The Sacramento Kings said yesterday they have withdrawn from an international arbitration proceeding in London over their first-round draft choice, PREDRAG STOJAKOVIC.Stojakovic, 19, will play this season for the Greek League team PAOK, which signed him last week to an $ 800,000 contract. The Kings will retain the 6-foot-9-inch forward's rights and rookie salary slot. ( AP)SPORTS PEOPLE: FOOTBALL"
Herbert Muschamp article on fantasy city of future as conceived by architect Rem Koolhaas; drawing (S) ,"Fantasies about the city of tomorrow are invariably rendered in terms of material reality-mile-high skyscrapers, atomatic elevators, people flying about with jet packs. The heart of this urban mirage looks like Rockefeller Center- as it might appear after taking some 21st-century designer mood drug-'' a forest of skyscrapers, some of them leaning, semmingly felled,'' says Koolhaas. Why should n't buildings emulate the Rockettes?We promenade on a plaza between two immense floating slabs. Information scrambles across their surfaces of energized crystals: advertisements, jokes, exchange rates, lofty crown of California redwoods in foreshortened perspective, Art Nouveau stained-glass skylights. Think'' shirt,'' and you have an instant choice of hundreds-virtual ones and real ones. The floor slab dissolves to reveal an immense arena filled with a crowd of thousands."
"Practical Traveler column on airline liability for fatal accidents under terms of Warsaw Convention, in light of crash of TWA Flight 800; proposals by airlines to end payment ceiling to speed settlement of survivors' claims noted (S) ","As it exists now, the $ 75,000 limit does not apply if the airline can be proved grossly negligent, a provision that is the source of tortuous trials. As many as 30 percent of the cases actually go to trial to prove damages, usually based on income lost to the families, if airline offers are considered too low. Discussions have been held by the airlines, the aerospace industry, the Government, the American Trial Lawyers Association, the airlines' underwriters and the families of victims, with the United States Department of Transportation granting the airlines exemption from antitrust prosecution for the purpose. At this writing, 56 world airlines have signed the declaration of intention. The Warsaw Convention would not require this case to go to an American court."
Lesley Hazleton comment on off-road driving adventures in Anza-Borrego Desert State Park near San Diego (S) ,"So I was prepared for the worst this summer when I joined a small group of off-roaders on the famed Rubicon Trail. But above all, the assurance that the trail wound through stunningly beautiful country. We drove up from Lake Tahoe early in the morning, a convoy of 10 Jeep Wranglers ready to drive the toughest nine-mile section of the trail in to Rubicon Springs. But there was still an element of the absurd: I could have walked the Rubicon Trail in a third of the time it took to drive it. Some 12 miles in, past a series of high waterfalls, the trail abruptly changed. High above the valley, the trail ended at the rough remains of a gold miner's hut."
Jody Alesandro article on visit to Niagara Falls on New York and Ontario sides; photos; map (M) ,"MY family and I were among the last few people to board the Maid of the Mist IV, one of four tour boats that sail up the Niagara River, past the base of the American Falls and into the U-shaped basin that gave Canada's Horseshoe Falls their name. SINCE we planned to view the falls from both sides of the river, we had reserved a room at the Skyline Brock, at the western foot of Rainbow Bridge, which spans the Niagara about a mile downstream from the falls. If Clifton Hill is the 42d Street of Niagara Falls, then Goat Island, landscaped by Frederick Law Olmsted, is its Central Park. Fees are $ 8.25, $ 4.75 for children 6to 12.Niagara Falls Museum, 5651 River Road, Niagara Falls, Ontario."
"Question-and-answer column on travel; on car rentals in Italy, visiting Naples area, touring Franklin Roosevelt's former yacht in Oakland ","Can you supply me with the names of companies in England and their age restrictions?-- Representatives of these companies cite higher accident rates among certain age groups as the primary reason for such restrictions. We are planning a trip to the San Francisco area in mid-October, and have heard that the Potomac, Roosevelt's former yacht, is available for tours and cruises. Ninety-minute cruises around Treasure Island in San Francisco Bay are offered April through October on the second Thursday and fourth Saturday of each month at 10:30 A.M. and 1:30 P.M. On the third Saturday of each month, three-hour cruises on San Francisco Bay depart at noon."
Janny Scott article on travel attractions and amenities of New York City; photos; map (What's Doing in...article) (M) ,"Autumn is the best time to see New York City in the way it is best seen. Tickets, from $ 40 to $ 55, Royale Theater, 242 West 45th Street, or through Tele-charge, ( 212 ) 239- 6200. Call the garden, at 200th Street and Southern Boulevard, at ( 718 ) 817-8700. The New York Public Library at Fifth Avenue and 42d Street, an impressive example of the city's Beaux-Arts architecture, houses one of the biggest research collections in the world. ( 718 ) 885-2478, fax ( 718 ) 885-1519.Within walking distance of Radio City Music Hall and Rockefeller Center, the Portland Square Hotel, at 132 West 47th Street,"
Frugal Traveler article on visit to Pennsylvania's Amish Country; photos; map (M) ,"After lengthy consultation, the helpful young woman at Accommodations Express suggested the Historic Strasburg Inn, a few miles east of Lancaster. The following day brings more trains, at the Railroad Museum of Pennsylvania. Kitchen Kettle Village, 3529 Old Philadelphia Pike, Intercourse; ( 717 ) 768- 8261.The People's Place, 3513 Old Philadelphia Pike, Intercourse; ( 717 ) 768- 7171. The current exhibit at the Quilt Museum is on until Nov. 2.Railroad Museum of Pennsylvania, Route 741, Strasburg; ( 717 ) 687-8628. Julius Sturgis Pretzel House, 219 East Main Street ( Route 772 ), Lititz; ( 717 ) Wilbur Chocolate Company's Candy Americana Museum, 48 North Broad Street, Lititz; ( 717 )"
"Huge outbreak of wildfires in West this year leads ecologists to recomment 'prescribed burns,' low-level fires that recreate natural cleansing effect of ancient fires; environmentalists point out that fire suppression and logging of big trees have led to ferocious burning of smaller trees that remain; map (S) ","Ignited by lightning or by Indians, fires swept through forests about every 15 years. Fire crawled along the forest floor, cleaning out the clutter of dead branches, shrubs and low trees. Without regular low-level fires, Western forests grew dense, and massive amounts of fuel built up. Racing from tree crown to tree crown, fires last longer and travel farther. This summer, 219,000 acres burned in one Idaho fire, 155,350 acres burned in a Nevada fire, and 135,000 acres burned in a Utah fire. To restore fire to the forest, ecologists advocate'' prescribed burns''-- or low-level fires that recreate the natural, cleaning effect of ancient fires."
Class offering tips on traveling as courier noted (S) ,"LECTURECourier TipsTraveling as an air courier can be one of the cheapest ways to fly, but also one of the most unpredictable. Judy Salwen, a professor of early childhood and elementary education at Manhattan Community College, will discuss the subject there next Saturday. Ms. Salwen has flown to the Far East as a courier. .People who need people may need to take the tour at the new Streisand Center for Conservancy Studies. The environmental think tank is on a 22.5-acre tract in the canyons above Malibu that was donated to the Santa Monica Mountains Conservancy by Barbra Streisand in 1993. The cookbook is available onlyon line, at http://www.americanair.com/ aahome / special / recipes.htm and gives such recipes as cream of yucca soup, peanut brittle french toast, thyme-grilled turkey with cranberry vinaigrette and cheesecake with dried pesto."
"Eagles Auditorium, Seattle landmark, is renovated as new home of A Contemporary Theater, 31-year-old regional theater company known as ACT; photo (S) ","The Eagles Auditorium, a landmark building in downtown Seattle, has been reborn as Kreielsheimer Place, the new home of A Contemporary Theater, the 31-year-old regional theater company known as ACT.The building opened in 1925 as the national headquarters of the Fraternal Order of Eagles, and was the site of Martin Luther King Jr.'s only Seattle appearance as well as the setting for many major rock concerts. The former home of ACT was a single 449-seat theater in the Lower Queen Anne district of Seattle. The new facility, named for the family foundation that was a major contributor, provides two 390-seat theaters, one of which is a theater in the round, and a smaller cabaret space, to be used for experimental works, solo performances and one-act plays."
New offers for airline mileage-club members noted (S) ,"Dollar Rent-a-Car is now a participant in Onepass, Continental Airlines' frequent-flier program, and Alamo Rent a Car has joined the Canadian Airlines frequent flier plan, Canadian Plus. Members of Onepass, ( 713 ) 952-1630, can earn 500 frequent flier miles by renting a car at any Dollar or Eurodollar location in the world. Mileage earned by participants in Canadian Plus, ( 800 ) 426- 7000, when renting at any Alamo location in North America or Europe, ordinarily 500 points, will be doubled for the rest of this year. 443855 when making a reservation, and provide his Canadian Plus membership number at the rental counter. Renaissance Hotels and Resorts is the newest affiliate of the Delta Air Lines frequent flier program."
"Paula DiPerna article on playing Robert Trent Jones Golf Trail in Alabama; describes seven separate complexes scattered across state from Appalachian foothills to Gulf of Mexico; notes places to stay along the way; photos; map; trail was planned by David Bronner, chief executive of Retirement Systems of Alabama (M) ","In all, the trail, opened in 1992, comprises 24 different public golf courses, all designed by the renowned Robert Trent Jones Sr., and operated at affordable prices. The printed course guide called the greens here'' pedestal''-- and they were certainly up there. The Short Course was no pushover, with many holes nearly 200 yards long, even excluding the bionic tees. And, demanding holes are not just scattered here or there-- as at the average golf course-- but come unrelentingly one after the other. The Links at Grand National was the only trail course I played twice, and its challenges were even more fulfilling the second time around. Motorized carts are $ 15 at championship 18-hole courses, $ 10 at 18-hole short courses."
Peter M Nichols reviews for children the documentary film The Leopard Son (S) ,"The Leopard Son A documentary about the coming-of-age of a leopard cub on the Serengeti in TanzaniaProduced and photographed by Hugo van Lawick No rating 84 minutesLife's no idyll for a baby leopard, particularly with those lions waiting to make an hors d'oeuvre of him while his mother is off hunting. Lions are a nightmare,'' intones John Gielgud, the narrator. Eventually the son returns to his mother's territory, where she has given birth to two more cubs before herself falling victim to a lion. VIOLENCE Leopards kill for food, and so do lions, who also kill other cats to eliminate the competition. AGES 11 and up Many children will like it, but many others will have turned off to animal films."
"Herbert Muschamp reviews exhibit A Place for Us: Vernacular Architecture in American Folk Art at Museum of American Folk Art, NYC, and first issue of House &amp; Garden, home-decorating magazine newly introduced by Conde Nast; photos (L) ","A Place for Us: Vernacular Architecture in American Folk Art,'' a superb exhibition at the Museum of American Folk Art. House & amp This is the saga of American architecture before 1893, when the Columbian Exposition, the great Chicago World's Fair, unfurled the banner of architectural unity over urban America. Henry Adams thought the fair was America's first great expression of cultural unity. The painting shows the evolution of architectural style in the building's two wings. By the time the new House & amp; Garden picks up the story, American industry has boomed and busted many times over. The most attractive house in the magazine's first issue is a Long Island summer house designed for a SoHo retailer. ARCHITECTURE VIEW"
"Interview with Mario T Gaboury, director of Center for the Study of Crime Victims' Rights, Remedies and Resources at University of New Haven; center was established in 1994 to providing training in victim services administration as well as to work for victims' rights; photo (M) ",The center was established in 1994 to provide training in victim services administration as well as to work for victims' rights. The center also recently held a conference in North Haven for professionals who help crime victims. Q. Who are the proponents for victims' rights?A. both supporting a Federal Constitutional amendment for victims. The constitutional amendment first puts victims on par with defendants. The second area is to provide more resources to victims. Do many crime victims ask for leniency for the accused?A. What about the victims' rights Almost all states have their victim services programs run primarily out of the executive branch. No victim advocate should tell the victim what he or she should or should not do. So I do n't think the victims' movement is really as monolithic and single-minded as some believe.
"Shaker community once thrived in Enfield, Conn, but what remains is difficult to detect; some of plain, dignified 19th-century buildings are enclosed in state prison, and a few that are privately owned stand in shadow of giant complex of Lego Systems, toy manufacturers; photos (L) ","LITTLE is left of the once-thriving Shaker community in Enfield and what remains is difficult to detect. Some of the plain, dignified 19th-century buildings are enclosed within a state prison; a few that are privately owned stand in the shadow of the giant complex of Lego Systems, the toy manufacturers. Known as Shakers because of the ecstatic dances they performed in the meeting house, they were pledged to hard work, celibacy, common property and physical separation from'' the world,'' their term for non-believers. They built their communities by hand, with men and women assigned to different tasks and living separately as brothers and sisters in communal dwelling houses. Their intent is to preserve the Shaker buildings.''Few A dozen students and volunteers assisted in the field work throughout the summer of 1993."
"Makers of film Surviving Picasso hired artists Bruno Pasquier-Desvignes and Vernon Witham to create Picasso-like paintings for movie because Picasso's son, Claude, would not allow use of his father's paintings; photo (M) ","The artist's son Claude would not let the film makers use actual art by Picasso. Such legal quagmires affected the recent film'' Basquiat,'' whose director, the artist Julan Schnabel, painted the imitations himself. For'' Surviving Picasso,'' the film makers commissioned two artists to make works in Picasso's style."
"Rita Reif reviews exhibit A Colombo Retrospective: Italian Design in the 60's, featuring works of late designer Joe Colombo, at New York School of Interior Design; photos (L) ","THE IMPACT OF THE DESIGNER Joe Colombo on the Italian Modern movement of the 1960's was brief but decisive. Two years later Colombo was described as Italy's most prolific and innovative designer. Mr. Solin, a former importer of modern furniture, supplemented his Colombo pieces with others lent by the Museum of Modern Art, the Montreal Museum of Decorative Arts, five manufacturers and several collectors. Of Colombo's 400 designs, 80 were put into production in his lifetime and 25 others after his death. MASSIMO VIGNELLI, an Italian born New York designer who had known him since high school in Milan, said,'' Joe Colombo was ahead of the time.''''He was a prime star of the Italian design movement,'' Mr. Vignelli said.''"
