abstract,summary
"Treasury securities prices rise in lackluster trading; 30-year bond rises 8/32, to 96 5/32, to yield 7.02 percent; graph (M) ","Prices of Treasury securities rose yesterday in lackluster trading as traders prepared for today's meeting of Federal Reserve policy makers. The core rate has not shown signs of picking up. Analysts note that since the last Federal Open Market Committee meeting in August, at which the Fed left rates unchanged, there has been evidence to support both a rate increase and no increase. The uncertainty in the market has increased since Reuters reported last week that eight of the 12 regional Federal Reserve presidents favored a rate increase. The three-month bill was awarded an average discount rate of 5.18 percent, up from 5.07 percent last week, and the six-month bill awarded a rate of 5.30 percent, up from 5.19 percent."
Patterns column discusses fashion industry news (M) ,"A Contender for GivenchyAn arresting new name has moved to the fore in the two-tier guessing game of who will fill the designer vacancy at the house of Dior. A source close to Mr. McQueen, an employee at a New York-based fashion company with an international clientele, said on Friday that the designer had said he was to take the job of head designer for Givenchy. Bernard Arnault, chairman of LVMH Moet Hennessy Louis Vuitton, the French conglomerate, which also owns the Christian Lacroix and Celine fashion houses, did not return telephone calls seeking comment. There's always a new interpretation of something.''Correction: October 2, 1996, WednesdayA report in the Patterns column on the Fashion page on Sept. 24 about speculation that Alexander McQueen will become the head designer for Givenchy misstated his age."
New York Yankees manager Joe Torre discusses Dwight Gooden's chances of making post-season roster (S) ,"It seemed yesterday as if Manager Joe Torre had decided to lean the other way regarding Dwight Gooden's chances of making the Yankees' post-season roster. Before, it appeared that Gooden had to pitch himself into a spot as one of the Yankees' 10 pitchers by throwing well in his next start on Friday. Torre said.'' Once he shows he has the arm strength, his experience is priceless.''Less than a half hour after Torre's comments, Gooden walked into the clubhouse. He appeared concerned about his right shoulder and quickly ducked into the trainer's room for treatment. If Gooden is not healthy and does not perform well on Friday, then the last spot could go to one of three right-handers: David Weathers, Dave Pavlas or Ricky Bones."
"R W Apple Jr analysis contends that mini-crisis in US relations with Iraq has only emphasized how meager a role foreign policy has played during this long campaign year, especially when compared with past Presidential contests; maintains that some of Bob Dole's advisers think he could profit from discussing foreign policy because it is area where his experience considerably exceeds Pres Clinton's (M) ","The mini-crisis in United States relations with Iraq in the last few weeks has only emphasized how meager a role foreign policy has played during this long campaign year, especially when compared with past Presidential contests. But taxes and crime and other domestic policy questions have remained at the heart of the campaign. At least some of Mr. Dole's advisers think he could profit from discussing foreign policy. Even among those whose work centers on foreign policy, there is nothing approaching consensus. '' No foreign policy in the campaign?'' Only in national elections does the American public have much influence over the course of American foreign policy. POLITICS: FOREIGN POLICY"
Article discusses outlook for Major League Soccer playoff series between MetroStars and DC United (M) ,"The team with the home-field advantage in each series will play the first game away. The Crew clinched the last playoff spot with a 1- 0 triumph at New England in the last game of the season thanks to some brilliant goalkeeping by Brad Friedel, who has won 9 of his last 10 games. Dallas won three of the four meetings in the regular season, but neither team has an advantage at this point. The Galaxy won its first 12, sagged in the middle of the season and then won its last three. The Galaxy also won all four games against the Clash during the regular season, and there is no reason things should change now."
"Dorothy Lamour, movie actress in late 1930's and 40's who is perhaps best known for her 'road pictures' with Bing Crosby and Bob Hope, dies at age 81; her career discussed; photo (M) ","Dorothy Lamour, whose sarong-draped charms adorned many films of the late 1930's and 40's, especially the'' road'' pictures she made with Bing Crosby and Bob Hope, died on Sunday at a hospital in Los Angeles. No, ca n't you tell?''During World War II, Miss Lamour was also known as'' the bond bombshell'' because of her volunteer work selling United States War Bonds. In tours around the country, she was credited with selling some $ 300 million of the bonds. She received a belated citation for her bond work from the Treasury in 1965. Although Miss Lamour worked closely with Mr. Hope and Mr. Crosby for many years, she said that she was not close to them personally. Howard 3d, in 1943 while she was on a bond tour."
"Growing number of white-dominated South African corporations are courting black investors; deals, including recent purchase at discount of large stake in Anglo American Corp by black consortium led by former top African National Congress aide Cyril Ramaphosa, could help shield firms from potential hostility of new black Government, while helping to assure nation's political future by bringing blacks into mainstream economy; blacks now have control or major influence over companies representing almost 10 percent of Johannesburg Stock Exchange capitalization; critics charge deals mainly enrich well-connected businessmen; photos (M) ","Blacks bought a big share of the nation's best-known company at 11 percent below market price. For that reason, black economic empowerment may be the most important trend in South African business today. The Anglo American deal, the largest yet, brought together investors ranging from black-owned holding companies to union pension funds, a small-business group and the National African Chamber of Commerce. It waited for a black group to assemble. The biggest empowerment deal before Anglo American's was in 1994, when Sanlam, the Afrikaner-dominated South African National Life Assurance Company, sold its $ 220 million subsidiary for black policyholders to a group led by Dr. Ntatho Motlana, a longtime Soweto community leader.''"
"Growing number of Afrikaner farmers are migrating to Congo because of persistent drought and political changes in South Africa; Congo has encouraged farmers to settle in Nkayi, where soil is extremely fertile; map; photo (M) ","Now, persistent drought and political changes in South Africa, with the end of apartheid, have led a growing stream of Afrikaner farmers like Mr. Fouche to this fertile equatorial valley, which many see as their new promised land. Here in the city, children starve to death.''A year after they began to arrive here, the South African newcomers, 16 families in all, are still agog over the productivity of the land and river that cuts through the rolling hills around this small frontier town. And the positive results most of the original settlers have had is drawing newcomers at a rate that is expected to more than double the immigrants' number every year for the next several years."
College football report (M) ,"That was the advice of Coach John Majors of Pittsburgh, whose Panthers lost to the Buckeyes, 72- 0. They have n't been tested yet.''Pitt did not put up much of a test.'' It was a miserable ball game. Dan Henning, the Boston College coach, said:'' It's a combination of the wishbone and the option. The Big East record in non-conference games this season is 10- 9, including 1- 4 against Big Ten teams."
"Last year North Carolina gave Bald Head Island permission to put series of 300-foot-long tubes at right angles to shoreline to fight erosion; conservationists fear that pressure from other beach communities to do same will undermine state policy favored by environmentalists; that policy, allowing nature to take its course, was adopted by North Carolina in 1985; map; photos (M) ","The storm, which devastated 120 miles of beaches and many homes farther up the North Carolina coast, merely brushed Bald Head, shaking loose barely a shingle or two. This lush strand of dunes and maritime forest, the southernmost of North Carolina's barrier islands and perhaps the most exclusive, sought for years to protect its beaches from erosion. As a result of the waiver, Bald Head proceeded with a project of artificial beach protection, or'' hardening,'' completed in May. He sued the state, seeking to overturn its strictures on beach protection. North Carolina officials were perturbed. But Mr. Miller, of the North Carolina Coastal Federation, is unconvinced.''"
"Former Tyson Foods Inc chairman Donald J Tyson and friend, Frederick Lee Cameron, settle Securities and Exchange Commission charges that Tyson told Cameron in advance about firm's 1992 acquisition of Arctic Alaska Fisheries Corp; agree to pay total of over $150,000; deal seems to clear any others who might have been involved in trading; photo (M) ","The civil suit, filed in Federal District Court in Fayetteville, Ark., brings to an end a long investigation of trading in the shares of the Arctic Alaska Fisheries Corporation. There was substantial buying of Arctic Alaska stock in the days before the Tyson takeover was announced.''After a thorough investigation, this is what we will be bringing,'' said Joan McKown, the chief counsel in the S.E.C.'s enforcement division. Williams and Tyson Foods have denied those charges. The S.E.C. said Mr. Cameron had been tipped off by Mr. Tyson regarding the pending acquisition. The takeover was announced on June 16, with each Arctic Alaska share to be acquired for cash and Tyson stock then worth about $ 12.75. A lawyer for Mr. Tyson did not return a telephone call."
"Nassau County, NY, police officers, responding to reports that shots had been fired on residential street in Woodmere, say they discovered arsenal of weapons at home of Daniel Trachman; Trachman is arrested on charges of criminal possession of illegal weapons; photo (M) ","The Nassau County police said they found the arsenal in the home of Daniel Trachman, a self-employed importer of automobile parts. Robert Cuerbo of the Nassau Police Department.'' Trachman, 39, was arrested and charged with seven counts of criminal possession of illegal weapons. The police said that the shots apparently came from a starter pistol fired by Mr. Trachman, causing no injuries."
"Article profiles career of Utica, NY, Mayor Edward A Hanna; several of Hanna's unorthodox actions and proposals, particularly during financial crisis, discussed; photo; map (M) ","One of the inexplicable things Edward A. Hanna did when he was Mayor here 20 years ago was to declare that Utica was'' a lousy place to live.'' Another was to construct the Tower of Hope outside City Hall in honor of Bob Hope, who has no particular connection to Utica. Mr. Hanna said. Some here said Mr. Hanna's return to the Mayor's office in January was a sign of just how desperate Utica, like many older cities across the state and nation in recent years, is for solutions to intractable financial problems. City government should be closed down,'' he said. You inherit a bankrupt city. And he said he viewed governing this city as a business where he can help people. Who Loves to Hate His City"
"British police kill suspected Irish Republican Army terrorist, arrest five other suspects and seize 10 tons of explosives and weapons in series of raids in London (M) ","A terrorist suspect was shot dead, five men were arrested and some 10 tons of explosives and weapons were uncovered today in a series of raids before dawn that the police said had forestalled imminent I.R.A. attacks in the British capital. Bombs made of fertilizer pellets, household chemicals and small amounts of Semtex attached to a timer have been the weapon of choice of the I.R.A. in recent attacks. The raids represented the fourth setback for the I.R.A. in London this year. In February, an I.R.A. guerrilla blew himself up with his own bomb on a London bus, and the police later found a bomb factory at his home. I.R.A. spokesmen in Northern Ireland, however, had warned that there was no basis for optimism."
"Sec of State Warren Christopher and Russian Foreign Min Yevgeny M Primakov announce that US and Russia have reached agreement on first part of understanding that would allow US to proceed with efforts to build defenses against shorter-range missiles, while preserving Anti-Ballistic Missile Treaty of 1972 (M) ","It was a confirmation of a tentative agreement reached in June, at the end of a meeting that covered contentious topics like Russian opposition to the expansion of NATO, Russian opposition to missile strikes on Iraq and Russian support for Secretary General Boutros Boutros-Ghali, whom Washington wants to replace. In a brief news conference, both Mr. Christopher and Mr. Primakov emphasized their areas of cooperation, particularly the Russian participation in the Bosnia peacekeeping force and the Comprehensive Test Ban Treaty that President Clinton and Mr. Primakov will sign on Tuesday. The announcement of agreement on the first stage of the issue of'' theater missile defense,'' covering low-velocity systems, seemed intended to highlight Russian-American cooperation."
"Paul Weston, pop arranger, conductor and composer who was one of inventors of modern mood music, dies at age 84 (M) ","The novelty'' Shrimp Boats,'' written with Paul Mason Howard, was a Top 10 hit for Ms. Stafford in 1951.With his wife, Mr. Weston also recorded four classic albums of musical parody under the pseudonyms Jonathan and Darlene Edwards. Accompanied by Mr. Weston's deliberately rinky-dink arrangements, Ms. Stafford's comic alter ego, Darlene, affected a hard, countryish twang, hitting many wrong notes as she hilariously slaughtered well-known popular songs. While a student at Dartmouth, he played in a college band and in 1934 sold his first arrangement to Joe Haymes's orchestra. Then, in 1944, Mr. Weston became musical director for the fledging Capitol Records. He also ran Corinthian Records, the company that distributed his and Ms. Stafford's Capitol and Columbia albums."
"Canadian Automobile Workers union again threatens to strike General Motors unless GM drops plans to sell factories; threat is latest in series of coordinated moves by union and United Automobile Workers to derail GM's plans to slim down; Canadian union president Basil E Hargrove comments, interview (M) ","The Chrysler Corporation reached a three-year contract with the Canadian union on Sept. 17 that bars the company from selling or closing any of its factories in Canada. The Canadian union's aggressive stance was prompted by G.M.'s effort to sell or close unprofitable auto parts plants. Hargrove said if a strike at the assembly plants lasted 8 to 10 days, he would consider ordering a walkout at G.M.'s parts factories in Canada. Hargrove said he would insist that the sale of these factories be canceled, and that G.M. halt moves to buy from outside vendors certain auto parts previously produced by his union's members.'' A 17-day strike last March at two brake factories in Dayton, Ohio, crippled G.M.'s North American operations and produced an after-tax loss for the company of $ 900 million."
"Increasing number of New York State legislative members say thet expect to return to Albany for special session after November 5 elections to give themselves a raise, and a potentially hefty one at that (M) ","Few issues are as thorny, and this year in particular the question of a pay raise is twisting the lawmakers into political contortions. How do you advocate for that?''Complicating matters is the fact that challengers around the state are recognizing the toxic quality of the pay raise issue. No legislator has publicly argued that he or she is poorly paid. Their base pay is the second highest among state legislatures, after California's $ 75,600 a year. If you want people who are really interested in the job, sometimes you have to pay some money for it.''Personally, I think a raise every eight years is not excessive.''"
"Several of North Carolina's major newspapers and television and radio stations have agreed on what real concerns are for residents this year, and working together, they are trying to force candidates to address them; among newspapers, coordination is so tight that they have begun publishing virtually identical articles by same reporters each Sunday; reports describe Presidential and statewide candidates' stands on issues that residents consider important; Rick Thames, public editor of Charlotte Observer, comments; photo (M) ","But they are generally taking the same approach, emphasizing interviews with voters and playing down'' horse race'' coverage and dispatches from the campaign trail.''There's more concern than ever before in the media as to whether candidates are really addressing issues that matter to readers and the public,'' said Rick Thames, whose title is public editor of The Charlotte Observer, the state's largest newspaper and a leader of the'' Your Voice, Your Vote'' coalition. The other members of the coalition are The Raleigh News & amp; Observer and four other newspapers, five television affiliates, three public radio stations and public television. Except for public broadcasting, the television and radio stations that joined are in different media markets."
"Goldman, Sachs &amp; Co reportedly plans to create managing director posts as part of a continuing reorganization; new rank would confer status and probably improved compensation for some younger and ambitious executives, without substantially expanding partnership (M) ","The new title also would give Mr. Corzine and Goldman's other senior partners another instrument with which to manage the firm's younger, talented, and sometimes frustrated, executives. Goldman, with more than 8,500 employees, now has only 173 partners, and it has a fast-growing corps of senior managers pressing for a partnership. Young executives toil at the firm for years for the chance to become a Goldman partner, a ticket to substantial financial wealth. The creation of the managing director title also reflects Goldman's decision to become a limited liability partnership under New York State law. As at Lazard, Goldman partners would be participating limited partners and managing directors. In recent months, they remodeled Goldman's ruling committee, splitting it into two parts: an executive committee and a management committee."
"Election for Manhattan Borough President will not be held for year, and office carries only trace of its former grandeur and power, but candidates have already begun their campaigns to succeed Ruth W Messinger, who is expected to challenge Mayor Rudolph Giuliani in November; photo of several possible candidates (M) ","But candidates have already begun hungrily eying the office of Manhattan borough president. Two current Borough Presidents, Fernando Ferrer of the Bronx and Ms. Messinger, are trying to do the same. Also, Ms. Glick, who is running for re-election this year, will retain her seat in the Assembly if she does not win the borough president race. But the potential of all these candidates in the race has created a political ripple effect throughout Manhattan, since the three of the five would-be candidates-- Ms. Fields, Mr. Pagan and Mr. Powell, who represents East Harlem and parts of the Bronx-- would have to give up their seats on the Council."
Ross Perot files suit in Federal District Court seeking to force his way into this year's Presidential debates and portraying process that led to his exclusion as corrupt and unconstitutional (M) ,"The crux of their argument, filed before Judge Thomas F. Hogan, is that the commission is required by a new Federal regulation to use only objective criteria to determine who should be invited to the debates. Perot received 19 percent of the vote four years ago after he participated in the three Presidential debates, running as an independent. Thus, he argued, the Federal Election Commission's rules were violated. The debates commission was explicitly set up to inoculate itself against the charge that it was an arm of the Government by accepting no public or party monies. Professor Raskin said today said that the debates commission could also be shown to be an arm of the Government because it depends for its authority on the Federal Election Commission."
"Kuwait deported tens of thousands of foreign workers after Persian Gulf War and its leaders declared that new Kuwait should be run by Kuwaitis; today Egyptians, Pakistanis and others have filled void that foreign workers, mainly Palestinians, left behind, and Kuwaitis are as much minority in their own land as ever before; as US vows anew to defend country, many Kuwaitis say they feel no qualms about relying on others; despite promise let loose by liberation, Kuwait--whose own citizens pay no taxes, account for just one-sixth of work force and are guaranteed high-paying jobs in Government ministries, has yet to set clear course for future; graph; map; photo (M) ","The new Kuwait, its leaders declared, should be run by the Kuwaitis. And since the gulf war Kuwait, with a per capita income of about $ 23,000 and an estimated 10 percent of the world's oil reserves, has ended its once-generous aid to the Palestinians and Jordan. Kuwait's population, about 2.1 million before the war, plunged as Kuwaitis and foreigners alike fled Iraqi occupation. Today, Kuwait's population stands at 2 million, 1.3 million of whom are non-Kuwaitis, according to the most recent Government statistics."
"Campaign to oust trustees of Adelphi University has focused on dual roles of its board chairwoman, Ernesta G Procope; board's critics have accused her of conflict of interest for serving simultaneously as Adelphi chairwoman and as owner of brokerage handling university's insurance; Adelphi has paid more than $7 million on insurance premiums arranged by her company, E G Bowman Co; photo (M) ","Adelphi has paid more than $ 7 million in premiums on insurance policies arranged by her company since it took over the account in 1987, according to university records subpoenaed by the committee. Procope and other Adelphi officials have denied any wrongdoing. Adelphi records cited in hearings before a regents panel show that in 10 years, the trustees have never formally voted on hiring E. G. Bowman. Adelphi's records did not specify the commission for every policy in every year. Procope was already well-established in business and at Adelphi. That same year she became an Adelphi trustee. She also served from 1978 till 1995 on the board of the Chubb Group insurance company, which underwrites many Adelphi policies."
"Coalition of business groups, led by US Chamber of Commerce and National Association of Manufacturers, begins running radio and television advertisements in support of over 20 House Republicans; after House voted 225 to 179 to delay release of special counsel's report on whether Speaker Newt Gingrich violated tax laws, Democratic candidates began showering news organizations with faxes condemning Republicans who voted to protect Gingrich; recent survey by Rocky Mountain Media Watch, Denver-based media monitoring organization, finds that local TV news programs are devoting vast majority of their political coverage to Presidential race and little time to Congressional campaigns (M) ","One of the first votes that Chabot cast as our representative was to protect Newt Gingrich's questionable book deals,'' Mr. Longabaugh said in a statement faxed to news organizations by the Democratic campaign committee two hours after the House vote.'' A recent survey by a Denver-based media monitoring organization has found that local television news programs are devoting the vast majority of their political coverage to the Presidential race and precious little time to the Congressional campaigns. The group, Rocky Mountain Media Watch, measured election news coverage on 52 stations in 32 cities on evening newscasts on Wednesday, Sept. 11. More than 80 million people watch local television news programs and for many people it is their sole source of news."
Real estate executives and agents discuss significant increase in incidents in which co-op boards in New York City have rejected more and more applicants in growing number of neighborhoods and income brackets; some suggest that boards believe they can raise value of apartments in their buildings by turning more people down (M) ,"Co-op boards insist they are simply protecting their shareholders, but real estate agents and company owners say that the historically willful boards have become even more capricious and demanding. A few suggest that some boards believe they can even raise the value of apartments in their buildings by turning more people down. In some buildings, brokers say, the rejections stem from what several called'' a new attitude.'' There was no board interview and no explanation.''Why?'' Boards, reacting to the difficulties shareholders were having trying to sell apartments, were gentler with hard-to-find buyers, real estate agents say. These rejections puzzle the agents."
