abstract,summary
Rhode Island tourist official Ann O'Neill letter notes telephone number for travel information on state ,"To the Editor: Your listing on fall foliage omitted Rhode Island. The Division of Tourism's toll-free telephone number is ( 800 ) 556- 2684. We would also be more than happy to give callers information about southern Rhode Island, which includes Block Island and Narragansett. Our number is ( 880 ) 548- 4662.ANN O'NEILL, President Rhode IslandSouth County Tourism Council"
Robert L Boyar letter warns that British Airways has very strict limits on size and weight of carry-on bags for trips within Europe; airline explains ,"Not only does British Airways require carry-ons to conform to the widely disseminated size regulations to which our carry-on readily conformed, but it also requires that the bag not weigh more than 6 kilograms or 13 pounds. Since our carry-on contained breakables and valuables, I refused to check it without a guarantee of its security and safety, both of which British Airways refused to provide. British Airways has confirmed this policy and providing a response that included an apology of sorts. ROBERT L. BOYARWoodmere, L.I.John W. Lampl, British Airways vice president for communications, responds: The carry-on allowance is explained in our worldwide timetable as well as by agents. The weight limit is 13 pounds a passenger, and the dimensions of a bag are limited to a total of 45 inches."
Aaron Latham article on chills and thrills of rides at Universal Studios Hollywood; photos; map (S) ,"Actually a visit to Universal Studios is n't a tour in the way, say, a tour of Venice is a tour. What Universal Studios Hollywood really is is a trip into what it feels like to be in a movie. The Back to the Future ride suggests a possible road to the movies' future. So was born the Universal Studios Tour sequel. When he was just 18, Steven Spielberg took the Universal Studios Tour. That Universal tour keeps paying dividends of one kind and another. Universal spent $ 110 million on the ride, which is about what a high-tech adventure movie usually costs. How long would it be before this ride, like the movie, had a sequel?"
Katha Pollitt letter on Phillip Lopate Sept 8 article Sans Teeth on state of poetry in America (M) ,"To the Editor: In his insightful discussion of poetic cliches ('' Sans Teeth,'' Sept. 8), Phillip Lopate forgot to mention the monologue by the oppressed woman artist of the past ( Frida Kahlo, Emily Dickinson, Camille Claudel ); the poem nostalgically recounting baseball or basketball games of the poet's youth; the weird Southern childhood poem; and what I call the CNN poem, which retells in overheated free verse a prominent news story involving war, famine, torture, child abuse or murder. This saves a lot of bother all around, and enables poet and reader to drowse together in a warm bath of mutual admiration for each other's capacity for deep feeling and right thinking."
Joel Conarroe letter on Denis Donoghue Sept 15 review of Angela's Ashes: A Memoir by Frank McCourt (S) ,"To the Editor: Denis Donoghue does a fine job of summarizing Frank McCourt's'' Angela's Ashes'' ( Sept. 15 ), and his comments about his own childhood are engaging. Perhaps, though, because a peculiarly Irish kind of vernacular poetry and sly taletelling are part of his heritage, and as such are taken pretty much for granted, he does not give potential readers a sense of just how laugh-out-loud funny a good deal of Mr. McCourt's memoir is. Much of the material, to be sure, is heartbreaking, but Mr. McCourt, who has clearly kissed the Blarney stone, is an irrepressibly comic raconteur, and it is as much for the high-spirited comedy as for the eloquent depictions of deprivation that I found his book irresistible. Joel Conarroe New York"
Sherman L Greene letter on Neil A Lewis Sept 8 review of William N Eskridge Jr's book The Case for Same-Sex Marriage: From Sexual Liberty to Civilized Commitment (S) ,"The Case for Same-Sex Marriage: From Sexual Liberty to Civilized Commitment'' ( Sept. 8), Neil A. Lewis writes,'' Eskridge starts with a premise that is obvious to all but some homosexual advocates: Gay men tend to be ( gasp! ) more promiscuous than straight men and may even have an unhealthy interest in young men.''Even assuming it to be true, which it is not, that gay men are more interested in young men than straight men are in young women , to believe that either of these interests ( which are really the same interest in youthful pulchritude and vulnerability ) is unhealthy is to make a value judgment. Value judgments, by definition, can not be obvious. This one, for instance, is a thoughtless prejudice masquerading as conventional wisdom."
"Hallie Black letter on Joyce Carol Oates Sept 1 review of David Denby's Great Books: My Adventures With Homer, Rousseau, Woolf and Other Indestructible Writers of the Western World (S) ","To the Editor: As a teacher of high school humanities, I was thrilled with the cover of the Sept. 1 Book Review. I refused to turn to the review of David Denby's'' Great Books: My Adventures With Homer, Rousseau, Woolf, and Other Indestructible Writers of the Western World'' until I had figured out who was represented in the illustration. One figure, the vaguely medieval blond to the right ofthe words'' Alma Mater,'' stumped me. Imagine my surprise to find him identified as Virgil. First, Virgil was immensely proud to wear the toga and would certainly resent being depicted in anything else. More important, we possess a mosaic that is considered a true likeness of Virgil. Hallie Black Chicago"
David Gates reviews book Drown by Junot Diaz; drawing (M) ,"young Dominican-American writer Junot Diaz begins his first collection of stories with an epigraph from the Cuban poet Gustavo Perez Firmat to the effect that writing in English'' already falsifies what I / wanted to tell you.'' In five of these ten stories, his narrator is young Ramon de las Casas, called Yunior, whose father abandons his wife and children for years before returning to the Dominican Republic and bringing them back with him to New Jersey. In other stories, the nameless tellers may or may not be Yunior, but they're all young Latino men with the same well-defended sensitivity, uneasy relations with women and obsessive watchfulness. He whips story after story into shape by setting up parallel scenes."
Megan Harlan reviews book Darkest England by Christopher Hope (S) ,"DARKEST ENGLAND By Christopher Hope. Norton, $ 25.In this satire of African travelogues written by 19th-century British explorers, the South African novelist Christopher Hope offers a mirrorlike inversion of the genre.'' Darkest England'' annotates the supposed journals of a contemporary South African Bushman, David Mungo Booi, who sets off to explore the wilds of England and establish diplomatic ties with Queen Elizabeth ( whose great-great-grandmother,'' Thanks to Mr. Hope's incisive turns of phrase, the novel's broad lampoons of the English are always amusing; the price, however, is that David's observations of his subjects never rise above the level of their stereotypes."
Scott Veale reviews book Uncertainty by Michael Larsen (S) ,"UNCERTAINTY By Michael Larsen. The Danish writer Michael Larsen and his translators, Lone Thygesen Blecher and George Blecher, work hard to give'' Uncertainty'' a raw edge, but the book is, finally, a rather standard thriller, complete with such hoary conventions as the exploding cigarette and a final showdown that suffers from the villain-who-talks-too-much syndrome. Nevertheless, there are some interesting passages about the potential of computer technology to manipulate images ( thus seamlessly creating a parallel reality ), as well as a disturbing message about the dark side of our digital society:'' We live a godless existence with our new god."
Felicia Lee reviews book Sarah's Psalm by Florence Ladd (S) ,"By Florence Ladd. Scribner, $ 23.The enchantment of this first novel by Florence Ladd, the director of Radcliffe College's Bunting Institute, is in its exploration of a social set that's seldom portrayed in literature. The disappointment is in discovering that it reads like a good outline, with stilted dialogue and starchy exposition that fails to convey the richness and complexity of the characters. Sarah Stewart is a Harvard doctoral student in literature, a Wellesley graduate from a black bourgeois family who marries the boy next door, an M.I.T. graduate student with a similar pedigree. Sarah's Psalm'' is an entertaining novel that falters because we never get deep enough inside its main character, a young woman who is torn between her aspirations for a career and the lures of motherhood and marriage."
Malachy Duffy reviews book Dark Debts by Karen Hall (S) ,"DARK DEBTS By Karen Hall. Random House, $ 24.With demonic posession, a deadly hotel fire, satanic rituals, a fallen priest and visitations from Jesus as key elements, this first novel instantly casts a spell. If you can read past this section ( and ignore the continually annoying conceit of presenting the characters' interior monologues in italics ), then you'll be rewarded with the tale of the priest, Michael Kinney, and his struggle to save a poor Southern family from an unspeakable curse that has brought it to the edge of ruin. As Kinney unravels the secrets of this family's past, he collides with his own personal demon, hellbent on destroying him. The moments when Kinney confronts the demon are as gratifyingly chilling as an old-fashioned horror movie."
Douglas A Sylva reviews book Hail to the Chief: The Making and Unmaking of American Presidents by Robert Dallek (S) ,"Hail to the Chief The Making and Unmaking of American Presidents. Hyperion, $ 22.95.American political history is peppered with examples of Presidents bemoaning the limitations of office and carping about inadequate powers, intractable problems or a vicious press. He proposes a more common-sense explanation: Presidential performance depends on the character of the man in office. Abraham Lincoln and Franklin D. Roosevelt possessed qualities unavailable to mediocre Presidents like Millard Fillmore or Jimmy Carter. Unfortunately, these properties are so broad that they are as applicable to student-body presidents as to Presidents of the United States. Moreover, Mr. Dallek cites the same examples, sometimes even similar lists of Presidential accomplishments, in several chapters.''"
Warren Goldstein reviews book Our War: What We Did in Vietnam and What It Did to Us by David Harris (S) ,"Our War What We Did in Vietnam and What It Did to Us. By David Harris. Times Books / Random House, $ 21.David Harris, perhaps this country's best-known imprisoned draft resister of the Vietnam era, has written a moving memoir of what the Vietnamese call'' the American War.'' In particularly chilling sections on the Phoenix program of rural pacification-- in reality an operation of'' rump legality, kidnapping, torture and assassination'' run by the Central Intelligence Agency-- and on the massacre at My Lai, Mr. Harris takes us back to the horror of a war that degraded those it did not kill and ruined so much of our public life."
Michael Anderson reviews book Split Image: The Life of Anthony Perkins by Charles Winecoff (S) ,"The Life of Anthony Perkins. By Charles Winecoff. Dutton, $ 24.95.Anthony Perkins is a peculiar pop culture icon. Although he was a talented actor on stage and screen, in roles ranging from an Old West lawman in'' His private life was also a series of frustrations: his father, the actor Osgood Perkins, died when Anthony was 5; his mother was distant and cutting, yet Perkins gave her control of his finances until she died; although he was married to Berry Berenson for the last 19 years of his life, Perkins remained actively homosexual. Such a life requires a biography of taste, insight and intelligence, qualities glaringly absent from Charles Winecoff's first book,'' Split Image.''"
Brief reviews of new &amp; noteworthy paperback books; photo (M) ,"author recalls his first 39 years ( to 1964 ), which were filled with important people-- Tennessee Williams, Jack Kennedy, Jack Kerouac-- but perhaps none so important to Mr. Vidal as Jimmie Trimble, a young friend and lover killed at Iwo Jima. Such memories serve as'' a reminder that the happiest of lives are only splendid wrecks of what used to be a future,'' Michael Wood wrote in the Book Review last year. Last year our reviewer, H. D. S. Greenway, called the book'' full of complicated characters... Bill Kent said here last year. Last year our reviewer, Bruce Bawer, described the book as'' vintage Urvashi Vaid, proffering... Abby Frucht said in these pages last year."
"Crime-preventing wrist cuff described; personal defense device, encompassing laser and microwave technology, detects physiological changes in person about to commit crime and emits disabling arc of electricity; photos (M) ","Someone about to commit a crime undergoes distinct physiological changes: body temperature, blood pressure and heart rate all rise and the body emits a musky scent. This wrist cuff, encompassing laser and microwave technology, would be able to read those vital signs and zap a potential attacker with a disabling arc of electricity. At that point, the system'' taps'' your wrist and points you at your foe. If the possible assailant advances within a predefined radius, the cuff fires a bolt of electricity, in an amount set to stun, wound or kill. As a precaution, the wrist cuff could be fired only by its user."
Bruce Handy humorous article on changing etiquette lessons for children of future; drawings (S) ,"As long as there are humans and solid food, there will be dentists and dentists' offices; as long as there are dentists' offices, there will be fidgety children in waiting rooms absorbing gentle lessons in politeness from Goofus and Gallant of Highlights for Children magazine...."
"Verlyn Klinkenborg article on outlook for future discusses human nature and rejects view that 20th century atrocities are aberration in human history; holds humanity is capable of being governed, but largely incapable of governing itself (M) ","It is common to talk about the 20th century as though it were an aberration in human history, unique in the suffering it has created. Looking back over this century, you realize that humanity is capable of being governed but largely incapable of governing itself. But any vision of the future that depends on the collective, interdependent self-governance of this species is essentially a delusion, for what most people contribute to their own governance is resignation. There will be no getting out of the 20th century without carrying it with us. But some of the most hideous acts of this century have been committed in the name of memory, and the past, as Orwell knew, is as pliable in its uses as the future."
Victor Navasky article on assessing forecasts of future; drawing (M) ,"It was just that in our work we had never uncovered any accurate predictions. Hence our conclusion: Prediction is at best an unpredictable business. How then to assess the accuracy of predictions of things to come? Ditto for pessimistic predictions. The president of Michigan Savings Bank advised Henry Ford's lawyer not to invest in the Ford Motor Company, because'' the horse is here to stay but the automobile is only a novelty a fad.''Career counseling is one thing, but career prediction is something else entirely.''You ai n't goin' nowhere, son-- you ought to go back to drivin' a truck,''"
"Prof Paul Krugman article, written as though looking back from future, discusses economic transformations late 20th century economists failed to predict; cites virtual disappearance of white-collar workers, soaring prices of natural resources, key role of environmental protection, rebirth of big cities, eroding payoff of higher education and growing economic role of celebrity; drawing (L) ","Still, many people understood that the major forces driving economic change would be the continuing advance of digital technology and the spread of economic development throughout the world; in that sense, there were no big surprises. Second, the Information Revolution of the late 20th century was a spectacular but only partial success. In the 19th century, great fortunes were made in heavy industry; in the late 20th, they were made in technology; today's super-rich are, more frequently, Modern telecommunications eliminated much of the need for physical proximity in routine office work, leading more and more companies to shift back-office operations to suburban office parks. The Celebrity EconomyThis century's last great trend was noted by acute observers in 1996, yet most people failed to appreciate it."
Prof Ronald Steel article on how some of operating myths of 1996 about world relations might collapse; holds United States is not likely to decline soon as world leader; drawing (L) ,"The Information Age Is Knitting the World Together. It has already come to most of Eastern Europe and Russia, as well as Latin America. The whole world does not have to be democratic for us to make our way in it. Of course China will dominate the next century. For centuries China has been the great emerging power and the bogy man of the West. Not only people, but whole countries are growing poorer. The Soviet Union disintegrated, and Yugoslavia splintered into warring ethnic states. The world has not been the same since."
Jane and Michael Stern article discusses which of today's pop-culture icons are likely to grow in value and which remain mere curios; photos (M) ,"Three years ago, Christie's auctioned a coin bank shaped like a man playing cymbals for the astonishing sum of $ 63,000. The bank had no great value when it was made 100 years ago, but because handmade toys have become as rare as vintage amontillado, the bank is now worth more than all the money it could hold. .Similarly, GAS STATION MAPS are destined for auction glory when every motor vehicle is equipped with global-positioning satellite-system guidance; most valuable of all will be maps of places like Idaho formerly wide-open spaces untrammeled by planned communities and strip malls.... .While any piece of FUR APPAREL is likely to be viewed as a relic of the barbaric past, the true collectibles are going to be battle-souvenir coats splashed Jackson Pollock-style, courtesy of P.E.T.A..."
"Dr Perri Klass article on future of human reproductive medicine; cites advances in care of premature infants and fetuses, in technology and genetics and ethical questions such advances raise; drawing (L) ","But we are at a moment when the fetus, during its obligatory time in the womb, is no longer inaccessible, no longer locked away from medical interventions. Throughout gestation, the lungs are filled with the appropriately named fetal lung fluid. This machine fills the lungs with fluid that flows into the tiny passageways and air sacs of a premature human lung. Shaffer remembers, not long ago, when many people thought the whole idea was crazy, when his was the only team working on filling human lungs with liquid. Continue a pregnancy, knowing the fetus will almost certainly die? During those 13 weeks, the fetal heart pumped normally with no fluid backup, and the fetal lung tissue developed properly. She is a pediatrician at Boston Medical Center."
Philip Kitcher article on how understanding of genetics of human disease promises to transform medical practice; cites importance of social policy in shaping applications of biomedical research; cites danger of genetic discrimination; drawing (L) ,"The pace and extent of the genetic revolution makes it tempting to speculate about life at the end of the 21st century. Yet our understanding of the genetics of human disease does promise to transform medical practice. At one extreme are the diseases for which genetic knowledge will lead to successful treatment. With luck, more common genetic diseases-- cystic fibrosis and fragile X syndrome-- are also ruled out. That is what we can hope genetic technology will bring. The story of Baby K was optimistic partly because her genetic abnormalities could be addressed with preventive strategies. Genetic discoveries already underscore old prejudices and create new ones. Economic and genetic differences amplify each other, reinforcing pressure on the affluent to produce only'' genetically correct'' children. The Genetic Revolution and Human Possibilities.''"
James Gleick article on privacy issues in technological age; notes information-gathering about individuals by Government and corporation computers has reached astounding level of completeness; holds peoples' concerns about such information compilation are greatest if they distrust Government (L) ,"People in large numbers are doing just this: acting out their private lives before on-line cameras, accessible to the world. But transition to what?''There's a very important and long-term debate taking place right now about technologies of privacy in the next century,'' says Marc Rotenberg, director of the Electronic Privacy Information Center in Washington.'' An Intimate History of Humanity.'' Large chains now invite customers to link personal identifying information with the records of what they buy, in exchange for discount cards or other promotions.*Your electronic mail and your telephone messages. Ordinarily Net exploring is an anony-mous activity, but many information services ask users to identify themselves and even to provide telephone numbers and other personal information. Aggressive privacy implies much more."
Squirrel monkey discussed as potential pet; photo (S) ,"What you'll want is a second pair of hands a very small pair of hands. What you'll want is a squirrel monkey. It's not the smartest guy around maybe double your average golden retriever,'' says John Robinson, a primate specialist at the Wildlife Conservation Society. But picture that intellect in a cute nine-inch body, with nimble-fingered hands hardly larger than paper clips, and the days of layabout pets are numbered. Capuchin monkeys- the larger, more intelligent cousins of squirrel monkeys- have been successfully trained to help quadriplegics: flicking on lights, setting the television to the proper channel. Squirrel monkeys, Robinson supposes, might be trained to do the same things.' Can we see domesticated monkeys?''"
"Timothy Ferris article on inability of physicists to reconcile some of oddities of quantum world with common sense dictates; at issue is 'nonlocal' behavior of subatomic systems, which can produce instantaneous effects at distance with no discernible causal mechanism between two points; photo (L) ","But quantum physics itself is not the problem. But with quantum systems, what you see is all you get. A wave is all over the place; a particle is in one place only. Are photons particles or waves? They are neither-- or they are both. The physics equations tell us that the two particles must have opposite spin: if one is'' spin up,'' the other must be'' spin down.'' So now we observe one particle and find, say, that it is spin up. We have thus'' resolved'' the spin state of a particle that allegedly had no such state until we made the observation. If so, clearing up quantum weirdness would be only one of the attainments of handshake theory."
Drugs and devices to be found in medicine chests of future discussed; drawings (S) ,"Some of the real miracles of 21st-century medicine, pharmaceutical experts say, will be found in your medicine cabinet. Homeopathic remedies will shed the stigma that most 20th-century doctors placed on alternative medicines. SKIN- GROWTH PRESCRIPTION They are custom-made at the local pharmacy and specific to the exact strain of the disease ( indicated by an alphanumeric code ) and the patient's gene type, a broad category similar to blood type. MOISTURIZERContains sun block and enzymes that repair damage caused by ultraviolet rays. SCANNERSecurity system and medical aid in one. The device also enters transdermal blood readings and other statistics into a computerized and confidential medical record accessible to doctors. SKIN GLUEHolds minor cuts closed. Sold by prescription, since overuse could lead to resistant strains of bacteria."
"Prof Richard Rorty article, written as if looking back from year 2096, discusses shift to view in United States that state's first duty is to bar gross economic and social inequality, not merely to insure equal protection of laws; drawing (L) ","T he apparent incompatibility of capitalism and democracy is, of course, an old theme in American political and intellectual life. So the first fault line in American politics was not between the rich and the poor. Instead, it was between those who saw chattel slavery as incompatible with American fraternity and those who did not. The Promise of American Life.'' Only the growth of the increasingly miserable black underclass reminded white Americans that the promise of American life was still far from being fulfilled. For the first time, white and black Americans started to think of each other as fellow citizens. Those weapons burst into the streets in 2014, in the revolution that, leaving the cities in ruins and dislocating American economic life, plunged the country into the Second Great Depression."
