abstract,summary
"Allen E Adams, who entered kicking contest at Pittsburgh Steelers game, is arrested during halftime on assault warrant (S) ","ALLEN E. ADAMS was a bust kicking a football. Adams was arrested Sunday during halftime of the Steelers' 31- 17 victory over the Baltimore Ravens at Three Rivers Stadium in Pittsburgh. Adams, 36, of Pittsburgh, was among three fans chosen at random to attempt field goals to win prizes; all three of his kicks missed. During the contest, Allegheny County Police Sgt. He heard Adams's name over the loudspeakers, recognized it, called his office to confirm the warrant and made the arrest as Adams walked off the field. In 1992, Allegheny County Judge ROBERT DAUER revoked Adams's bond and ordered him arrested because he missed a preliminary hearing. Adams is charged with simple assault, making terroristic threats, disorderly conduct and public drunkenness.(AP)SPORTS PEOPLE: FOOTBALL"
Montreal Alouettes football player Tommie Frazier is sidelined indefinitely with pneumonia (S) ,"TOMMIE FRAZIER, who led Nebraska to consecutive national championships and is the backup quarterback for the Montreal Alouettes of the Canadian Football League, is sidelined indefinitely while he recovers from pneumonia. Doctors said he is being put on blood thinners because of his history of blood clots. Frazier, who was bypassed in the National Football League draft, has played only once for the Alouettes, in the fourth quarter against Ottawa on Aug. 30.(AP)SPORTS PEOPLE: FOOTBALL"
Atlanta Olympics security chief Bill Rathburn says Summer Games were marred by behind-the-scenes management problems because they were simply too big to handle (S) ,"The Atlanta Olympics were marred by behind-the-scenes management problems because they were simply too big to handle, the security chief for the Summer Games said yesterday. The security operation, for example, was stuck with filthy dormitories for officers, a severe shortage of two-way radios and some volunteers so disgruntled that they might have quit if not given souvenir watches, BILL RATHBURN, the security chief, said.''They were too big,'' Rathburn said.' Just to sell all the tickets you can sell is not necessarily the right approach.''Rathburn said, however, that the problems were in the operations of the Games and did not contribute to any security breakdown, including the pipe bomb explosion at Centennial Olympic Park.(AP)SPORTS PEOPLE: OLYMPICS"
"Gardnar Mulloy, 82, once America's top tennis player, is ousted from Country Club of Coral Gables in Florida (S) ","GARDNAR MULLOY, 82, once America's top tennis player, is an honorary member of the world's finest clubs-- from Wimbledon to Forest Hills. But he got the boot from the Country Club of Coral Gables, Fla. Mulloy says it was because he stuck up for the club's tennis pro, BUNNY SMITH, when she was fired. Downsizing, the club said, was the cause of her dismissal.''Shabby,'' Mulloy said. He wrote letters to the club president, PAUL HAWKINS, and other officers. Hawkins's reply was that Mulloy's complimentary membership had'' expired,'' and that if Mulloy wanted to play at the club, he would have to pay.''If"
Metropolitan Diary; drawing (M) ,"DEAR DIARY: Being a native New Yorker and proud of it KATTENDear Diary: We raise our mugs to each other and toast the day. EMILY S. HOUPTDear Diary: with nothing on it.''Dear Diary: I live in Freeport, L.I., with my wife, who loves to go shopping for bargains in the town's thrift shops. What are you doing in Freeport, New York?''The young woman gave me a delicious little giggle then, with that distinctly Diana clipped British inflection said:''I was talking to the Duchess of Sudbury the other day and mentioned I needed a little housedress, but I did n't want to go to London shops. Have you considered Freeport, New York?' HERBERT JAFFEMetropolitan Diary"
Union Square Greenmarket farmers to join with local restaurants on Sept 19 for party to celebrate 20th anniversary of 14th Street-Union Square Local Development Corp (S) ,"THE farmers at the Union Square Greenmarket usually pack up their produce trucks by late afternoon. But on Sept. 19 they are coming to town to be on hand until well past their bedtimes, joining with nearby restaurants in a celebration of the 20th anniversary of the 14th Street-Union Square Local Development Corporation. The benefit party, which will toast the harvest moon from 7 to 10 P.M., will offer food stalls of more than two dozen restaurants and purveyors. Admission is $ 10 in advance and $ 15 at the door. Coupons for purchase of food and beverages, $ 2 each, will be sold in books for $ 10 or $ 20. For reservations: ( 212 ) 529- 5626."
"Glatt kosher tandoori chicken livers are among kosher dishes available at Bombay Kitchen in Forest Hills, Queens; Copeland Marks, restaurant's consultant and a specialist in ethnic cuisines, who lived for many years in Jewish community in Calcutta, comments on Jewish Indian cuisine; recipes; photo (M) ","They are just one among dozens of kosher dishes now served at Bombay Kitchen. The notion of kosher Indian food may come as a surprise to some. He was amazed to discover the Jewish community there.''The Jewish food especially fascinated me,'' he said.'' Their food combined the stuffed vegetables and dumplings they brought with them with the Indian spices, like ginger and chilies. The food was kosher. Originally, the plan at Bombay Kitchen was to serve the Baghdadi Jewish menu alongside the regular menu of northern and southern Indian food. Like Mr. Natarajan, they had never tasted Indian Jewish cooking. There are bottles of sweet Manischewitz red wine on the bar, perhaps not the best complement for Indian food. He said he hopes to open another kosher Indian restaurant in Los Angeles."
Marion Burros Plain and Simple column on some end-of-summer dishes; recipes (S) ,"Pork, Corn and Black Beans With Nectarine Salsa8 ounces whole onion or 7 ounces chopped, ready-cut onion ( 1 2/3 cups)2 teaspoons olive oil1 large clove garlic8 ounces pork tenderloin1 1/2 teaspoons cumin1 teaspoon ground coriander2 ears corn1 15-ounce can no-salt-added black beans1/8 teaspoon saltFreshly ground black pepper to taste.1. Chop whole onion.2. Saute onion until it begins to soften.3. Trim fat from pork and cut into small dice. Push the onion mixture aside and brown the pork pieces on all sides.5. Approximate nutritional analysis per serving: 540 calories, 11 grams fat, 80 milligrams cholesterol, 215 milligrams sodium, 45 grams protein, 70 grams carbohydrate. Approximate nutritional analysis per serving: 85 calories, 1 gram fat, 0 milligrams cholesterol, 15 milligrams sodium, 2 grams protein, 20 grams carbohydrate."
Marian Burros comments on some sophisticated yet healthful dishes being prepared by San Francisco Bay-area chefs; photo; recipes (L) ,"fresh basil leaves16 cilantro sprigs ( 12 for salad, 4 for garnish)1 tablespoon lemon juice3 tablespoons rice vinegar3 tablespoons olive oilSalt and pepper to taste.1. 1 hour6 medium portobello mushrooms1/2 cup balsamic vinegar plus 2 tablespoons5 medium-size tomatoes6 cloves garlic, peeled and thinly sliced3 shallots, peeled and thinly sliced3 tablespoons olive oil plus 2 tablespoons15 leaves fresh basilSalt to tasteAbout 2 cups reduced-sodium soy sauce1/4 cup mirin1/4 cup sake6 tablespoons sugar1 teaspoon fresh ginger, coarsely grated1 teaspoon garlic, minced. For the soy mix:1/4 cup reduced-sodium soy sauce2 1/2 tablespoons mirin2 1/2 tablespoons rice vinegar1/4 teaspoon minced garlic1/4 teaspoon ginger, grated1/2 tablespoon sugar4 tablespoons toasted-sesame oil."
"International architectural competition fails to solve problem of how to expand Prado Museum in Madrid; jury for 17-month competition, which attracted nearly 500 entries from architects worldwide, rules that none warrants first prize, although it does award two honorable mentions; Culture Minister Esperanza Aguirre says Government does not know when final design will be chosen (S) ","The jury for the 17-month competition, which attracted nearly 500 entries from architects worldwide, ruled on Friday that none warranted a first prize, though it did award two honorable mentions. She said the Government would aim for a final design incorporating the best aspects of the submissions. An honorable mention went to the Madrid architects Alberto Martinez and Beatriz Matos. The other honorable mention went to the Zurich architect Jean-Pierre Durig. His $ 105 million proposal envisions a new building extending about three blocks parallel to and behind the Prado. Beyond that, he would add a U-shaped building around the ruins of the Jeronimos Church cloisters."
Frank J Prial Wine Talk column comments on finding good values in reds at time of rising prices; photo (M) ,"WINE prices have been rising for several years. Gone, too, are the days when great California cabernets could be had for a few dollars more than jug wine. Bear in mind that the world's annual wine grape harvest is far larger than anyone can consume. This week, red wines; next week, white. Unfortunately, distribution of these wines is haphazard at best. Some day, Americans will latch onto Spanish wines in a serious way. From the Penedes, the Torres family produces an astonishing array of wines. Italy could reasonably be called the land of wine bargains. In a country abounding in wine bargains, Montepulciano d'Abruzzo is in a class by itself. These wines will be discovered one day. Wine Talk"
"Growing number of people are trading corporate world for the kitchen; they seek creative fulfillment, satisfaction in their work, greater mobility and, if they start their own businesses, control over their own lives; all would rather cook or work with food than do anything else; most make switch at considerable financial and personal sacrifice; jobs are plentiful; in next 10 years, restaurants and hotels will need additional 500,000 chefs, cooks and other kitchen workers--increase of 16% over current needs; drawings (M) ","Mr. Quintiere now earns $ 40,000 a year as head pastry chef at Firebird, a new restaurant in midtown. How many people have a job like that?''If culinary school enrollment is any indication, more people want jobs with those criteria and are willing to pay thousands of dollars to attend prominent schools in the hope that it will lead to the kitchen of a notable chef. At the New York Restaurant School, about 60 percent of the new students are switching careers, compared with about 40 percent four years ago, said Stephen Tave, director of admissions. They will pay $ 15,000 for a nine-month certificate in culinary arts, or $ 10,000 for a pastry arts certificate. About 1,200 students enroll each year and pay $ 24,000 for a two-year program in culinary or pastry arts."
Florence Fabricant Food Notes column (M) ,"a panel at the New-York Historical Society, 2 West 77th Street, will discuss Amelia Simmons, this country's first cookbook author 200 years ago. 220-7182.The New School, 66 West 12th Street, has three six-session courses,'' Information and registration: ( 212 ) 229-5620.''The Culinary Roots of American History'' will be explored on Nov. 18 from 6:10 to 9 P.M. in New York University's department of nutrition and food studies, 35 West Fourth Street ( near Broadway ). Sept. 28 will probably be the last day for Claude Troisgros's highly regarded restaurant, which opened about two years ago at 111 East 22d Street."
"Program of experimental music is presented at Ohio Theater, in two all-day events called Swirled Music; photo of Kato Hideki; Ben Ratliff review (S) ","David First, a guitarist and the mastermind of the event, invited 53 musicians, who worked on three stages ( including one for disk jockeys ) playing for short intervals. Each stage had a clock and a schedule that staggered the musicians' performances into short overlapping sets, so that new solos, duos and trios were constantly born. By 5:30, Loop, a new disk jockey, had engaged the trumpeter Roy Campbell, who began a lyrical, plangent solo, the day's only smattering of real jazz. Run-D.M.C.'s old-school rap record'' By nightfall, Darryl Hell, a disk jockey, was playing the scratched end grooves of records to create long stretches of antique, popping rhythms."
"Unexpected findings from new study add to concerns about possible dangers of calcium channel blockers, most widely prescribed class of medications in US; new study involved calcium channel blocker known as isradipine, or DynaCirc; small apparent increased risk of angina, heart attacks and strokes is found among those who took isradipine in study (M) ","The new study involved a calcium channel blocker known as isradipine, or DynaCirc. Doctors prescribe at least 10 forms of calcium channel blockers to treat high blood pressure, chest pain from angina and other ailments. The Food and Drug Administration has approved isradipine for the treatment of high blood pressure, or hypertension. They said that uncertainties about the choice of drugs should not interfere with efforts to control high blood pressure, which if untreated could lead to complications like strokes and heart attacks. The studies suggest that such drugs may cause an increased incidence of fatal heart attack, bleeding from the stomach and intestinal tract and cancer. Yet calcium channel blocker drugs have been marketed for two decades. Both drugs offered similar benefit in lowering blood pressure."
"First of two Jane E Brody columns on living safely with dogs focuses on the problem of biting; notes that in United States, about 20 people a year--mostly children--are killed by dogs, and 800,000 need medical attention from bites; about 70% of dog-bite victims are children under 10; Brody discusses guidelines for preventing dog bites, pet selection and treatment, and learning dog-safe behavior; drawing (M) ","Preventing Dog BitesDr. Dogs, like children, need to be properly socialized into the human family. A dog should not have to be hit to learn. Dogs should be properly restrained on a leash or chain when outside the house. Even then, the dog should have a chance to see you and sniff you first. Children should be taught not to play with a dog unless they are supervised by an adult. When approached by an unfamiliar dog, stand still and stay quiet. Stay still until the dog tires of you and walks away. I have found this effective even for dogs that do not'' speak English.''Next: Remember that you must attend classes with your dog. Training the dog owner is as essential to success as training the dog."
"John J O'Connor Critic's Notebook column on remarkable longevity of TV program Star Trek, which has enjoyed several incarnations over past 30 years; suggests that current Star Trek series is showing signs of fizzling; photo of Kate Mulgrew (M) ","Star Trek: Voyager'' Running from 1957 to 1965,'' Wagon Train'' whipped up a series of adventures each week as post-Civil War contingents of settlers wended their way to California. Then, too, Mr. Roddenberry's somewhat cockeyed optimism about a future of no wars or prejudice was a perfect tonic for the stoked anxieties of the cold war years. In some ways, the series spinoffs have improved on the original. Star Trek'' offered a vision that leapt 300 years into the future. Deep Space Nine'' will offer'' Trials and Tribble-ations,'' in which Captain Sisko and crew will seem to mingle with the original Enterprise gang through Forrest Gump-type special effects, returning to a'' Star Trek'' episode featuring cuddly fur balls called Tribbles."
Curtis Institute of Music chamber orchestra gives concert at Merkin Concert Hall under 24-year-old conductor Mischa Santora; Aaron Rosand is violin soloist; photo; Allan Kozinn review (M) ,"It may be early in the school year for a conservatory orchestra to test its mettle in public, but the faculty of the Curtis Institute of Music in Philadelphia apparently has great confidence in its students, and on Monday evening at Merkin Concert Hall, the school's chamber orchestra showed that this confidence is not misplaced. Mr. Truniger, a doctoral candidate at the New England Conservatory, has a firm command of the orchestra's resources, and each of the short movements he offered was compelling in its short-winded way. MUSIC REVIEWCorrection: September 12, 1996, ThursdayA picture caption yesterday with a review of a performance on Monday by the chamber orchestra of the Curtis Institute of Music at Merkin Concert Hall misspelled the surname of the guest violin soloist."
Dr Paul P Casadonte letter comments on Sept 6 article on New York State's approval of alternative medication to methadone (M) ,To the Editor: Your Sept. 6 news article on New York State's approval of an alternative medication to methadone should offer relief to clinicians who treat heroin addicts and to neighborhoods that live with the drug dealing associated with methadone clinics. The New York Veterans Administration Medical Center's opiate substitution program is treating more than 160 patients with this medication and finds it to be as effective as methadone in reducing heroin use. The medication is subject to the monitoring and regulations of Federal and state governments and can be given only in methadone treatment clinics. The V.A. and National Institute on Drug Abuse are about to evaluate a new medication that will offer treatment for addicts intimidated by the negative associations of methadone clinics.
Victoria L Kerns letter comments on Sept 2 article on Saratoga Race Course (S) ,"To the Editor: Regarding your Sept. 2 news article on Saratoga Race Course, we should applaud Kenny Noe Jr., the new chairman of the New York Racing Association, whom your article quotes, for his efforts to improve conditions in New York racing. As far as squalid backstretch conditions are concerned, most of us endure them upon entry into employment in the industry. It's a question of pulling yourself up by your bootstraps. Opportunity ( not limited to thoroughbred racing ) exists for those willing to work hard and accept responsibility. VICTORIA L. KERNSHalesite, L.I., Sept. 4, 1996The writer buys and sells race horses."
Letter from Manhattan Borough Pres Ruth W Messinger lauds proposal of Charles W Juntikka in Sept 6 article that political candidates in New York City who receive public financing participate in debates and that campaign contributions be limited to $100 (S) ,"To the Editor: As the principal architect of New York City's campaign finance law and an all-but-announced candidate for mayor, I would like to comment on Charles W. Juntikka's ballot proposals to require candidates receiving public financing to participate in debates and to limit campaign contributions to $ 100 ( news article, Sept. 6).The flaw with Mr. Juntikka's proposal is not its intent but its target-- the candidates. They must now raise so much money because of the escalating cost of television advertising. Real reform and reductions in campaign spending will occur only when local stations begin doing what the national networks have done: provide free television time to candidates. RUTH W. MESSINGERNew York, Sept. 6, 1996The writer is Manhattan Borough President."
David Krein letter comments on Sept 9 article on media's intense focus on political consultants (S) ,"To the Editor: Re'' The New Campaign Story: Consultants Steal Spotlight'' ( front page, Sept. 9 ): In an election so far devoid of substantive presentation and discussion, I no longer wonder why the consultants have captured headlines. There is little that has not been identified in advance by opinion polls or experts and analyzed to the nth degree. Why wait for the Clinton or Dole delivery when I know their options and impact well before they do?DAVID KREINChicago, Sept. 10, 1996"
Mariam Razak discusses her ordeal in Togo since undergoing genital mutilation at age of 15; photo (M) ,"Just around the corner from the Kassindja family compound lives another young woman who ran away from home-- but too late to escape having her genitals sliced off against her will. The woman, Mariam Razak, was 15 when her family locked her in her room and sent in five women to hold her down, as she struggled wildly, while a sixth cut off her clitoris and genital lips. It was love that led to Mrs. Razak's disfigurement. It took Mr. Razak six more years to woo her back. But Mariam Razak knows what she has lost. Razak promises that he will not take another wife, even if Mariam does not get pregnant.'' Since we were children, I have loved Mariam,'' he said.''"
Rudin Management Co has leased or is about to lease out over 60 percent of lower Manhattan office building that it renovated with latest telecommunications equipment; building was vacant for over five years (M) ,"A LITTLE more than a year after the Rudin Management Company began spending $ 15 million to renovate a vacant 400,000-square-foot office building at 55 Broad Street, installing the latest telecommunications equipment, more than 60 percent of the downtown building, now known as the New York Information Technology Center, is spoken for. Sun also has space in Manhattan at 1 New York Plaza, between Park and Broad Streets downtown, where it has recently completed an expansion. Kaplan, a subsidiary of the Washington Post Company, has leased about 46,000 square feet, part of the 21st and all of the 22d and 23d floors, at 888 Seventh Avenue, a 45-story, 866,000-square-foot office building at 57th Street."
"New study confirms that some women with asthma seem more likely to have attacks around time that their menstrual periods begin; even though possibility of such a link was first reported in medical journal in 1931, it has never been proved or studied extensiviely; new study appearing in current issue of Archives of Internal Medicine provides evidence that connection is real, and authors say that some women who have asthma might benefit from additional treatment with preventive medications to ward off attacks at that time (M) ","SOME women with asthma find that they seem more likely to have attacks around the time that their menstrual periods begin. Researchers found that 46 percent of the patients were in the'' perimenstrual'' phase of their cycles, defined as the sevn-day interval beginning three days before the start of a period. Counting the day that bleeding begins as day 1 of a woman's 28-day cycle, the perimenstrual interval would include days 26 through 4.Dividing the cycle into three other weeklong intervals-- before, during and after ovulation-- the researchers found that 20 percent of the patients were preovulatory and 24 percent were in the ovulatory phase. About 10 million Americans have asthma."
"Thomas L Friedman Op-Ed article says current US policy toward Iran, aimed at halting terrorism, , is not best way to change country's behavior, and that US should consider reworking and adapting its diplomacy (M) ","On the KLM connection to Iran! I was going to TEHERAN, IRAN, and security agents Which brings me to Iran. What is worthy of debate is whether U.S. policy toward Iran today is the best way to change its behavior. The present U.S. policy is economic and political containment of Iran, coupled with a standing offer to negotiate with any'' authorized'' Iranian officials. And no Iranian leader will authorize a dialogue with the U.S. while Iran is under economic sanctions. So what are U.S. options? The U.S. should then indicate to Iran that if it takes specific steps toward meeting these concerns, the U.S. will take specific steps toward lifting the economic and diplomatic isolation of Iran."
"Poignancy and sense of history of Rosh ha-Shanah are enhanced this year by publication of In Memory's Kitchen: A Legacy From the Women of Terezin; In Memory's Kitchen, originally written in German by women at Terezen, ghetto and concentration camp in what was then Czechoslovakia, is record of lives these starving women left behind--flavors, feasts, even the pots and pans; with recipes, poems and personal letters, it is also a story of survival of spirit amid horrors of Holocaust; in effort to endure hours of hunger, cold and terror at camp, an anteroom to Auschwitz, women carefully wrote out about 80 recipes, using what pen or pencil and paper they could find, and later sewed together the pages; photo; recipes (M) ","In Memory's Kitchen'' ( Jason Aronson, 1996)Total time: 1 hour6 large eggs, separated1 cup sugar1 cup unsalted butter, melted and cooled1/4 cup ground almonds1/2 teaspoon almond extract2 1/2 cups sifted all-purpose flour2 teaspoons baking powder1/2 teaspoon salt1 cup milkGrated rind of 1 lemonConfectioners' sugar.1. Cincinnati Jewish Bake Shop SchneckenTotal time: 1 1/2 hours plus overnight refrigerationFor the dough:2 scant tablespoons or 2 packages active dry yeast1/2 cup lukewarm water1/2 cup sugar2 sticks ( 1 cup ) unsalted butter at room temperature1 cup 1/4 cups sugar1 teaspoon baking soda3 large eggs1/2 cup warm honey1/2 teaspoon cinnamon1/4 teaspoon ground cloves1/4 teaspoon ground ginger1/2 teaspoon salt1/4 cup blanched almonds or walnuts.1."
