abstract,summary
"Peter Beard, fashion and wildlife photographer, is seriously injured on Sept 9 after he is trampled by elephant during safari in Kenya (Chronicle) (S) ","PETER BEARD, the fashion and wildlife photographer, was seriously injured on Monday, when an elephant charged and trampled him while he was on safari in Kenya. He was listed in stable condition at Nairobi Hospital.''Every now and again you get a nut-case elephant,'' Mr. Beard said yesterday in his hospital bed.'' It was just a freak-58-year-old American photographer was on an outing with friends just beyond the Masai Mara national reserve near the Tanzanian border when they spotted a herd of about 15 elephants. When the elephant caught him, he said, he wrapped his arms around her leg and tried to hold on. Then the elephant sat down on him. Beard said he bore no ill feelings toward the elephants.'' A really tight squeeze with an elephant is very preferable.''CHRONICLE"
"Humberto de la Calle, Vice President of Colombia, announces resignation; urges Pres Ernesto Samper, accused of accepting money from drug dealers for Presidential campaign, to do likewise (S) ","Colombia's Vice President, Humberto de la Calle, announced today that he would resign and repeated his previous calls for President Ernesto Samper, who has been accused of taking drug money for his campaign, to do likewise. Mr. de la Calle said that he could no longer be part of a Government that was in disarray and had suffered a'' loss of credibility.''He said he was convinced that drug traffickers had financed Mr. Samper's campaign in 1994.''My decision is based on the crisis of governability that dates from the financing of the campaign,'' Mr. de la Calle said.'' I want to publicly tell the President: I have already resigned, let him resign too. I want a gesture of generosity by the President.''World News Briefs"
"Letter from Charles A Rodriguez, majority leader of Puerto Rico Senate, disputes remarks by Third Party Presidential candidate Ross Perot in Sept 5 article attacking Pentagon's procurement policies (S) ","To the Editor: You quote Bob Dole on the Presidential campaign trail as saying with regard to the record low joblessness rate,'' People are working, but many are working because they have to work to pay the Federal taxes'' Is n't this the opposite of the theory behind his 15 percent tax cut plan-- that more people would work if the Government cut taxes?Just what Federal taxes do people pay if they are n't working? Are the rich working only to pay the taxes on interest and capital gains income?Perhaps this is the real answer to the welfare problem: Levy a Federal tax on the poor, and they will have to work. It is n't a new idea but is older than Caesar Augustus."
Stephen H Miller comments on Sept 8 article on campaign by transsexuals for respect (S) ,"To the Editor: Your Sept. 8 report about'' transgendered'' people's fight for respect indicates some friction within gay and lesbian groups. The aims of transsexuals are divergent from those of gay men and lesbians. Transsexuals desire'' gender correction'' surgery so that they can live as heterosexuals. A male-to-female transsexual is legally a woman and can marry a man. Neither the Federal Government nor the states have any problem with this-- a departure from the prevailing attitude about same-sex matrimony. Transsexuals may have legitimate claims to press, but the gay movement loses focus when it is stretched to incorporate every group that happens to differ sexually from the mainstream. STEPHEN H. MILLERWashington, Sept. 8, 1996"
Christopher Ott letter disputes Sept 8 article on campaign by transsexuals for respect (S) ,"To the Editor: Your Sept. 8 news article on the transgender movement oversimplifies the anxiety many gay men and lesbians feel about the association between gay and transgender issues. Gay men and lesbians who reject this alliance are not ungrateful for the help we have received from transgender activists. But we are alarmed by the suggestion that gay men and lesbians belong in the same category as the transgendered. If we say gay men and lesbians are the same as people who suffer from'' gender identity dysphoria,'' we will reinforce the myth that homosexuals are unhappy and that we wish to change. A close association between gay and transgender issues provides ammunition for anti-gay activists, and confuses young gay men and lesbians who are still coming out. CHRISTOPHER OTTDenver, Sept. 8, 1996"
Khosrow Akmal letter disputes Thomas L Friedman's Sept 8 Op-Ed column on political outlook in Iran (M) ,"To the Editor: Thomas L. Friedman's hope for an'' Ayatollah Gorbachev'' ( column, Sept. 8) to moderate the behavior of the Islamic Republic of Iran is a pipe dream. The mullahs have continued to sponsor terrorist activities, and have tortured and murdered dissidents inside and outside Iran. The majority of Iranians hate the Islamic Republic and its leaders for violating the rights of the Iranian people and for damaging the interests of Iran. A few miles from the Islamic Republic's Guidance Ministry that Mr. Friedman visited ( column, Sept. 4 ), the mullahs torture and execute Iranians who oppose the regime's tyranny. Iranians will replace the illegitimate Islamic Republic with a secular democratic government sooner than Mr. Friedman believes. Iranians will surprise Mr. Friedman and the mullahs."
James Opie letter comments on Thomas L Friedman's Sept. 8 Op-Ed article on political outlook for Iran (S) ,"To the Editor: As Thomas L. Friedman suggests ( column, Sept. 8), the Islamic Republic of Iran is here to stay. If there is to be a fruitful dialogue, factions in Iran and the United States that have fueled a mutual demonization should not be permitted to have the last word. JAMES OPIEPortland, Ore., Sept. 9, 1996Iran Will Get Moderate Leader, but Not a Mullah"
New Jersey Nets sign free agent Tony Massenburg to one-year contract (S) ,"The Nets grabbed another player left out of the free-agency sweepstakes yesterday by signing TONY MASSENBURG to a one-year deal believed to be worth the National Basketball Association minimum of $ 247,000.Massenburg, a 6-foot-9-inch forward, made about three times that last year as a part-time starter in Toronto and then Philadelphia, the team he was traded to during the season. Massenburg, 29, is not expected to start for the Nets, but he could play 20 minutes a game as a backup to JAYSON WILLIAMS.''I'd say Jayson is a better rebounder than I am,'' Massenburg said.'' I'm probably a little better offensively.''SPORTS PEOPLE: PRO BASKETBALL"
Marcus Camby signs three-year contract with Toronto Raptors (S) ,"MARCUS CAMBY has agreed to a three-year contract with the Toronto Raptors. Under terms of the N.B.A's rookie salary scale, Camby will make $ 8.4 million, including the allowable 20 percent increases over the base pay of just over $ 7 million.(AP)SPORTS PEOPLE: PRO BASKETBALL"
"Sports agent Leigh Steinberg is arrested, Newport Beach, Calif, for investigation of driving under influence of alcohol (S) ","LEIGH STEINBERG, the sports agent who recently added the Olympic gymnast KERRI STRUG to his star-studded client list, was arrested over the weekend for investigation of driving under the influence of alcohol, the Newport Beach, Calif., police said yesterday. Steinberg, 47, was arrested after his car rear-ended another vehicle early Saturday morning, police Sgt. JOHN DESMOND said. No one was injured in the accident.''He was given a field sobriety test, subsequently taken to the station and given a blood test and was booked on misdemeanor drunk driving charges,'' Desmond said. Steinberg was released on $ 1,400 bail.(AP)SPORTS PEOPLE: SPORTS BUSINESS"
Figure skater Rudy Galindo turns professional (S) ,"RUDY GALINDO, who stunned the figure skating world by winning the United States championship in January, turned pro yesterday. Galindo, an also-ran in the sport until his sensational performance in his hometown of San Jose, Calif., lifted him to the top of American skating, was third in the world championships. But, at 26, Galindo decided now was a good time to cash in on the professional offers. He will make his pro debut Oct. 26 at the United States Professional Figure Skating Championships in Albany.(AP)SPORTS PEOPLE: FIGURE SKATING"
"Fu Mingxia, Chinese diver who at age 17 captured two gold medals for China at Atlanta Olympics, is retiring from sport (S) ","FU MINGXIA, the Chinese diver who at age 17 captured two gold medals for China at the Atlanta Olympics, said in yesterday's editions of The China Youth Daily that she wanted to end her athletic career and enroll in college.''I want to retire,'' Fu told the newspaper.'' I'm already too old. It's like climbing a hill. When you reach the top, there's no way to go other than down.''Fu's platform and springboard golds at Atlanta made her the first woman in 36 years to win both Olympic events, adding to a gold she won at the 1992 Games in Barcelona, Spain.(AP)SPORTS PEOPLE: DIVING"
"Phoenix Coyotes are confident that they will sign center Jeremy Roenick, although his agent is pushing for trade (S) ","The Phoenix Coyotes are confident that they will sign center JEREMY ROENICK, although his agent, NEIL ABBOTT, is pushing for a trade. Roenick, acquired in an Aug. 16 trade with Chicago, is reportedly seeking a five-year contract worth $ 4.5 million to $ 6 million a season.(AP)SPORTS PEOPLE: HOCKEY"
"Country Home magazine's brand-new home that feels like an antique makes its debut Sept 12 in Greensboro NC, and remains open through Sept 16; home is designed by Thomas Gordon Smith, chairman of school of architecture at University of Notre Dame; floor plan; photos (L) ","Country Home's'' new old'' house makes it debut today in Greensboro, N.C., and remains open through Monday. A donation of $ 5 benefits Camp Carefree, a Greensboro retreat for critically ill children. The house will also be featured in an issue of Country Home next spring. Designed by Thomas Gordon Smith, the chairman of the school of architecture at the University of Notre Dame, the 3,000-square-foot, $ 380,000 house derives its old-fashioned attitude from more than mere cosmetics-- though the front porch and a plethora of Greek Revival-style details all help. As do the Palladian proportions, readily available in 19th-century pattern books ( many still in print in facsimile editions ) and nonetheless exquisite for the house's modest scale."
Nerea Prieto de Apraiz letter comments on Sept 11 article on South Korea's marriage laws; drawing (S) ,"To the Editor: I read with interest your Sept. 11 Seoul Journal, on the problems that South Koreans have faced for falling in love with people who have their same last name. Discrimination because of names is not new. As a Spaniard in New York, I have noticed that some people are discriminated against here because they have a Spanish or'' foreign-sounding'' name. Why do so many people in the Philippines have Spanish last names? In this country, many people with African roots do not have their ancestors' names because they were given new names by their masters in slavery. Some stayed, converted and changed their names to more Catholic-sounding names like San Juan, San Mateo or Santiago."
Douglas Lasdon letter disputes assertions by New York City Deputy Mayor Fran Reiter in Sept 5 article regarding business improvement districts (S) ,"To the Editor: When Deputy Mayor Fran Reiter states that business improvement districts are'' creating public policy... No other entity in our political or economic system has an automatic income stream with virtually no oversight from an outside agency or body. Further, in a situation without parallel in American history, to dismantle a business improvement district, 51 percent of the actual property owners ( not just those who vote ) must step forward and vote to repeal the district. Short of this step, or new legislation, B.I.D.'s will continue to take advantage of an unfettered income stream. 1996The writer is executive director of the Urban Justice Center, which is representing residents of the Grand Central Partnership district in a voting rights lawsuit."
Ira Neimark letter disputes Sept 10 Advertising column on Bergdorf Goodman's men's store (S) ,"To the Editor: Stuart Elliott's Sept. 10 Advertising column states that Bergdorf Goodman's men's store has been perceived as not doing well and refers to the store's being called'' Ira's folly,'' leading me to believe that Mr. Elliott may be a good advertising man but that he comes up short as a merchandiser. The men's store opened just as the economy went into a decline. However, it continues to grow, yielding $ 40 million a year in 40,000 square feet. When the men's store was planned, Bergdorf had to build around a jewelry store that was to vacate in five years, allowing the men's store to expand into that space. IRA NEIMARKNew York, Sept. 10, 1996The writer is the former chairman of Bergdorf Goodman."
Dr Daniel H Johnson Jr letter disputes Sept 4 editorial on health care cost squeeze (S) ,"To the Editor: Your Sept. 4 editorial on the health care'' cost squeeze,'' calling the reduction in physician income'' encouraging,'' is slanted. Few if any experts believe that reducing physician income will lead to a more efficient health care system. The 4 percent decline in physician income in 1994 amounted to one half of 1 percent of health care spending that year. Moreover, although the best managed care has provided useful tools for physicians to coordinate and assess the care they deliver, the research that can reduce inappropriate care remains in its infancy. Leading managed-care analysts recognize that physicians, not accountants or middle managers, are finding the real money-saving ( and life-saving ) innovations in health care."
Brian Cooper letter disputes Anthony Lewis' Sept 6 Op-Ed column on hatred directed at Federal Government (M) ,"To the Editor: Anthony Lewis ( column, Sept. 6 ) is partly right. Americans want the services that government provides: Social Security, Medicare, public education, law enforcement, medical research. But we do n't want to have to pay for these services, which is why Bob Dole, the Republican Presidential candidate, can get cheers by promising to'' end the I.R.S. as we know it.''What we need is not merely a political leader who will have the honesty to talk to us about the need for government, but one who has the courage to remind us of that painful truth,'' You ca n't get something for nothing.''BRIAN COOPERJackson Hts., Queens, Sept. 7, 1996"
"Metropolitan Opera says it plans to expand its commitment to 20th-century opera as century comes to an end; Joseph Volpe, the Met's general manager, and James Levine, its artistic director, say among works company plans to add to its repertory are Strauss's Capriccio in 1997-98 season, Schoenberg's Moses und Aron and Carlisle Floyd's Susannah in 1998-99, and John Harbison's The Great Gatsby, Met commission that is to have its world premiere in 1999-2000 (S) ","The Metropolitan Opera plans to expand its commitment to 20th-century opera as the century comes to an end, the company announced yesterday at a news conference at the opera house. Joseph Volpe, the Met's general manager, and James Levine, its artistic director, said that among the works the company planned to add to its repertory were Strauss's'' Capriccio'' in the 1997- 98 season, Schoenberg's'' Moses und Aron'' and Carlisle Floyd's'' Susannah'' in 1998- 99, and John Harbison's'' Great Gatsby,'' a Met commission that is to have its world premiere in 1999- 2000. Also planned is the company's first staging of Rossini's'' Cenerentola,'' with Cecilia Bartoli, in 1997- 98."
Christopher Lehmann-Haupt reviews book I Want to Thank My Brain for Remembering Me by Jimmy Breslin; photo (L) ,"By Jimmy Breslin 219 pages. $ 22.95Although its title may sound funny on first reading, Jimmy Breslin is far from joking when he calls this memoir'' me.''For another thing, the brain that Mr. Breslin thanks is one he admires considerably. I invented the news column form and other papers immediately went out and hired imitators with Irish names. I was responsible for Irish names getting more money than any union since the founding of the wire lathers."
"Racing season at Saratoga next summer will be increased, as expected, by two days (S) ","The racing season at Saratoga next summer will be increased, as expected, by two days. The days will be added to the start of the meeting to stretch it to six full weeks from July 23 through Labor Day, Sept. 1. The trustees of the New York Racing Association, at their monthly meeting yesterday at Belmont Park, accepted the proposal of Kenny Noe Jr., chairman and president of the association, who said:'' Labor Day weekend was very successful in Saratoga. Certainly, it was much stronger than business would have been at Belmont Park.''Racing at Saratoga ran for 34 days this summer from Friday, July 26, through Labor Day, Monday, Sept. 2."
Article on ways to keep furniture fabric stain-free; focuses on factory-treated methods and do-it-yourself treatments; drawing (L) ,"Most likely, a pink stain would blossom, because professional cleaning and everyday use wear away at chemical finishes, they say. Fabrics treated in the mill with fluorochemical commercial finishes retain their stain-repellant properties best, making a store's application unnecessary. Some stores are quick to point out that any cleaning can be damaging to stain resisters. We recommend after about three years and three cleanings getting the finish reapplied.''Jennifer Convertibles offers a lifetime warranty with its $ 90 Upholstery Shield finish. Professional cleaners can clean the fabric and reapply commercial protectors ( look in the Yellow Pages under Furniture Cleaning ). Mr. Jain recommended that a fabric-finish treatment be reapplied only after the upholstery is thoroughly cleaned; otherwise, he said, dirt can become trapped beneath the new finish. Vacuum once a month with clean upholstery attachments."
"Allan Kozinn reviews classical compact disks of music for upcoming Jewish holidays: The Birthday of the World: Music and Traditions of the High Holy Days by Western Wind Vocal Ensemble, Synagogue Chants, featuring cantor Marcel Lorand and The Sacred Bridge by Joel Cohen and Boston Camerata; photos (L) ","The Jewish holidays about to begin are rich in music that is both introspective and public. But if Hebrew prayer and psalm settings are comparatively brief, they have a concentrated emotional resonance that is captured on recent recordings.'The Birthday of the World'In its two installments of'' The Birthday of the World: Music and Traditions of the High Holy Days,'' the Western Wind Vocal Ensemble offers a thoughtfully arranged, attractively sung overview of the music heard during Rosh ha-Shanah ( Western Wind 1854 ) and Yom Kippur ( Western Wind 1872 ). The cantorial singing, mostly by Marcel Lorand, is ornate, openly emotional and unfettered by Western notions of intonation and vocal color. Elsewhere the ensemble juxtaposes Christian and Jewish liturgical poetry set to similar music."
"Article on interior design of new Moschino store, which opened on Sept 9 on Madison Avenue near 68th Street in Manhattan; says apparel store was inspired by work of late fashion designer Franco Moschino; photos (L) ","The new Moschino store, however, which opened on Monday, takes the task of creating a fashion fun house for customers seriously. Inspired by the work of Franco Moschino, the late fashion designer whose creations were full of snide fashion asides, the store is a joker's delight, full of visual punch lines dreamt up by a decorative prankster. Situated at 803 Madison Avenue ( near 68th Street ), the store was created by Piero Capobianco, an Italian fashion designer turned set designer, who worked with Moschino. On one wooden chair the names of several Moschino employees have been carved, schoolhouse style; an ornate Louis XIV-style chair is covered in Mylar.' Throughout the store, some of Moschino's favorite sayings are painted on the walls."
"Ziegfeld Theater, Manhattan's most grandiose movie house, will close for three-week, $500,000 face lift, on Sept 12; theater will reopen on Oct 4; theater is owned by Cineplex-Odeon (M) ","The cases are maintained by the Ziegfeld Club, a charitable organization, originally made up of former Ziegfeld Follies girls, that helps women in the theater and perpetuates the name of Florenz Ziegfeld. Ziegfeld, the impresario who created the Ziegfeld Follies, built the original theater as a permanent home for his musical extravaganzas. After Ziegfeld's death in 1932, the theater was acquired by the Loews chain, which turned it into a second-run movie house. In December 1967, the Walter Reade Organization announced that it would build a new theater near the old Ziegfeld that would carry the Ziegfeld name. The new Ziegfeld opened in 1969 with a premiere of the film'' Marooned.''"
"Ben Ratliff reviews performances by all-women bands, The Raincoats and Bush Tetras, double-bill at Brownie's in Manhattan (M) ","Both bands released debut records in 1980, when punk's wrecking ball had done its work and pop seemed up for grabs, open for the first time to intellectually self-determining women. In different ways, their songs were miniatures, with self-contained riffs bound by bewitching dub-reggae bass lines. In'' Love a Loser,'' Ms. Birch sang:'' Show me a loser, and I'm on your side. Pat Place made textures out of simple guitar chords, not much more than decoration for the churning rhythm section, with Laura Kennedy's elastic, dub-struck bass lines coursing through Dee Pop's standard and solid rock drumming. The new songs were casually confrontational, though'' POP REVIEW"
"Lawwrence Van Gelder reviews The Repugnant Story of Clotario Demoniax by Hugo Hiriat, opening show of International Festival of Puppet Theater at Joseph Papp Public Theater; photo (L) ","The Repugnant Story of Clotario Demoniax,'' which opened the International Festival of Puppet Theater on Tuesday night at the Joseph Papp Public Theater. There are human actors who play out their roles alongside their puppet counterparts, and, occasionally, there are half-human, half-puppet characters. On their wedding night, in a wild, funny digression into striptease, the frustrated Clotario is forced to tell a series of stories involving a whole new set of puppet characters in exchange for pieces of his reluctant bride's clothing. The talented humans in the show are Ramon Barragan, Haydee Boetto, Aejandro Benitez and Mr. Cueto. International Festival of Puppet Theater. WITH: Ramon Barragan, Haydee Boetto, Pablo Cueto and Aejandro Benitez. THEATER REVIEW"
"Peter Watrous reviews performance by jazz musicians George Cables, Joe Locke and Ed Howard at Bradley's in Manhattan (M) ","But a show by the pianist George Cables on Tuesday night, along with a pointed notice in the club's window from its owner, Wendy Cunningham, made it clear that Bradley's is still with us, which is a good thing. In front of a rapt audience, Mr. Cables, the vibraphonist Joe Locke and the bassist Ed Howard played light, interactive music. The forms were flexible, and tunes opened up into wide vamps, sending the soloists into exploratory spasms in which quotes and riffs and melodies set up communication among the musicians. But for every open space there was plenty of harmonic structure. Both Mr. Locke and Mr. Cables rampaged through chord sequences, like Pac-Men on a quest for the next yellow dot of harmony."
"Neil Strauss reviews performance by music group The Cranberries at PNC Bank ARts Center, Holmdel, NJ; photo (M) ","The result is an album best summarized by the title of an earlier Cranberries song,'' Ridiculous Thoughts.''Nonetheless, the Cranberries have become one of the most popular Irish acts in America, using the instrumentation of a rock band to make lush, billowing folk-music abstractions topped by the silvery vocals of Dolores O'Riordan. Perhaps the Cranberries should take a tip from the Cocteau Twins, whose ethereal guitar swirl clearly influenced their music, and sing nonsense words. To her credit, Ms. O'Riordan can sing almost anything and make it seem musical, and she did this in concert, adding yodels, yips and all kinds of extraneous flourishes to the songs while prancing around the stage."
"African interior design is entering the mainstream; for generations, art and artifacts produced by African societies have been subjects of study, debate and inspiration among creative minds; African artifacts on display at Guggenheim Museum, Macy's department store in Manhattan and homes of some African-Americans in New York City discussed; photos (L) ","Inis is hardly alone in her appreciation of the African visual esthetic. Evidence of African design's new-found popularity can be found in the breadth of its appeal. In'' The Spirit of African Design'' ( Clarkson N. Potter, 1996 ), the designers Sharne Algotsson and Denys Davis maintain that Africa is one of the world's richest sources of design-- stylistically and emotionally. Davis added that African design, often laden with sophisticated symbolism, can be both complex and simple in its line and application of color. In Ms. Inis's Harlem apartment, she combines her collection of African musical instruments with a baby grand piano. Some designs that are often believed to be strictly American or European-- Art Deco and Empire, for example-- have African touchstones, Ms. Davis said."
