abstract,summary
"Monks at Montserrat Benedictine monastery near Barcelona, Spain, help police capture a group that stole nine rare manuscripts from monastery in July; monastery, which dates to 11th century, has one of best-preserved collections of rare manuscripts in Spain (M) ","After thieves posing as researchers stole nine rare manuscripts from a Benedictine monastery library near Barcelona last July, the monks did more than pray. Parsifal.''The Montserrat monastery has one of the best-preserved collections of rare manuscripts in Spain, said Jose Luis Sotoca, a rare book expert in Madrid. Monks told the police that when the the monastery library was visited by three Israelis last July, they said they were there to photograph certain manuscripts because microfilm documentation of these items in Israeli libraries was hard to read. Sotoca, of the Madrid auction house Fernando Duran, said the most valuable item, worth about $ 5,000, appeared to be three volumes in Hebrew of a 17th-century rabbinical manuscript from Rome."
"Bill Monroe, who helped lay foundation of country music as universally recognized father of bluegrass, dies at age 84; photo (L) ","Bill Monroe, who helped lay the foundation of country music as the universally recognized father of bluegrass, died yesterday in a nursing home in Springfield, Tenn. Monroe, who played mandolin and sang in a high, lonesome tenor, created one of the most durable idioms in American music. Monroe put together a band called the Blue Grass Boys in 1939, and they soon joined the Grand Ole Opry radio broadcasts. With Chubby Wise on fiddle and Howard Watts on bass, that lineup of the Blue Grass Boys defined bluegrass music.'' Monroe was named to the Country Music Hall of Fame in 1970. The Music of Bill Monroe: From 1936 to 1994,'' produced by the Country Music Foundation, a tribute to Mr. Monroe's virtuosity and perseverance.''If"
"Elizabeth Eyre de Lanux, American artist, writer and designer of 1920's Art Deco furnishings whose works were rediscovered in late 1980's, died on Sept 8 at age 102 (M) ","Elizabeth Eyre de Lanux, an American artist, writer and designer of 1920's Art Deco furnishings whose works were rediscovered in the late 1980's, died on Sunday at the DeWitt Nursing Home in Manhattan. The designs of Eyre de Lanux, the name she used professionally from the 1920's on, came to light in 1989 when two pieces she had designed were offered in the widely publicized New York auction of the Art Deco collection of Robin Symes, a London antiquities dealer. But her name was listed in the Manhattan telephone book, and despite her great age and infirmities-- she was legally blind-- she granted several interviews. Mrs. de Lanux lived alone until she moved in late July to the nursing home."
"Upscale retailers, including Saks Fifth Avenue and Bergdorf Goodman, are dressing up the menswear advertising campaigns as hip; Bergdorf Goodman is tyring to re-present its men's store in campaign that uses slogan 'Bergdorf Men'; store will spend $1.5 million to $2 million on the ads, which will run through November; photo (L) ","But as more men begin to follow fashion, retailers are moving to exploit that growing interest. in focus-group interviews, men would often say'' they have no knowledge we have a separate men's store.'' So to'' communicate those elements men are n't aware of,'' he added, a campaign that runs through November, with a budget of $ 1.5 million to $ 2 million, re-presents the store as'' Bergdorf Men.''''' Company in New York, which created the campaign after producing catalogues for Bergdorf.'' The centerpiece of the campaign is a'' Black Book,'' a pocket-sized catalogue being sent to 150,000 men."
"Toshiba Corp will enter American market for home computers with machines that represent further step in trying to make personal computer look and operate more like consumer appliances; with its new Infinia models, Toshiba is coming into home computer market in America just weeks after another big Japanese electronics company, Sony Corp, introduced personal computers in US (L) ","The Toshiba Corporation will enter the American market for home computers today with machines that represent a further step in trying to make personal computers look and operate more like consumer appliances. With its new Infinia models, Toshiba is coming into the home computer market in America just weeks after another big Japanese electronics company, the Sony Corporation, introduced personal computers here. For the consumer electronics giants, the home PC market is a risk, but one that companies increasingly believe they must take, analysts say. Even the leaders, like Packard Bell Electronics Inc. and the Compaq Computer Corporation, earn scant profits from their sales in the home market, with its fierce price competition, costly advertising and retail distribution."
"Rosa Parks, Morris K Udall, James Brady and Joseph Cardinal Bernardin are among recipients of Presidential Medal of Freedom, nation's highest civilian honor (S) ","It was a challenge for the 11 winners of the Presidential Medal of Freedom, this country's highest civilian honor, to get to the White House for the ceremony yesterday. But they all managed to make it except ROSA PARKS, the civil rights pioneer, and MORRIS K. UDALL, the former Arizona Representative. JAMES BRADY, the press secretary who was critically wounded in the 1981 assassination attempt on President Ronald Reagan and who made a special appearance at the Democratic National Convention last month, found himself surrounded by Democrats again.''His courage and determination were stronger than an assassin's bullet,'' President Clinton said.'' Brady, whose nickname is the Bear, gave his signature thumbs-up sign when the President hung the medal around his neck. Mr. Brady said last evening at the party.''"
OP-Ed comments by political experts on Ross Perot's possible choice for Vice Presidential running-mate (S) ,"After a long search, Ross Perot is scheduled to name his Reform Party running mate tonight. CHRISTOPHER BUCKLEY, editor of Forbes FYI: Ross Perot. LISA SCHIFFREN, former speechwriter for Vice President Dan Quayle: Rudolph Giuliani. A woman like Jeane Kirkpatrick, former Ambassador to the United Nations, or Bernadine Healy, former chief of the National Institutes of Health. The first qualified woman on a national ticket since Geraldine Ferraro would give Perot the boost he desperately needs. MICAH L. SIFRY, editor of The Perot Periodical, a newsletter: Ross Perot Jr. He's probably the only person Perot trusts 100 percent, besides himself."
Summary of editorial endorsements of candidates in New York primaries (M) ,Poll hours in the city are 6 A.M. to 9 P.M.Bronx HOUSE OF REPRESENTATIVES 17th District ASSEMBLY 42d District: Rhoda Jacobs ( D ); 51st District: Felix Ortiz ( D ); 55th District: William Boyland ( D ). Manhattan HOUSE OF REPRESENTATIVES Eighth District ( Manhattan and Brooklyn ): ( D ) ASSEMBLY 68th District: 72d District: Adriano Espaillat ( D ). CIVIL COURT First Municipal District: Paul Feinman ( D ); Fourth Municipal District: Eileen Rakower ( D ); Seventh Municipal District: Milton Tingling ( D ); Ninth Municipal District: Arthur Birnbaum ( D ). 36th District: Kimon Thermos ( D )
Article discusses victories of Pete Sampras and Steffi Graf in US Open tennis championships; photo (M) ,"Both are now a mere handful of Grand Slams away from becoming the most prolific champions in the history of their sport: Graf needs four Grand Slam victories to pass Margaret Court's record of 24, and Sampras needs five to nudge Roy Emerson's 12 Grand Slams from the top of the record book. But that's not to imply that the 25-year-old Sampras, who now owns four Open titles, and the 27-year-old Graf, a five-time Open champion, took it for granted that Sunday would be their day."
"Martha Phillips, notable force in luxury fashion retailing for more than 60 years and early supporter of many of today's leading designers, died on Sept 7 at age 98; photo (L) ","Martha Phillips, a notable force in luxury fashion retailing for more than 60 years and an early supporter of many of today's leading designers, died on Saturday at her home in Palm Beach, Fla. There were four Martha shops in the 1980's, when sales were said to be almost $ 40 million. The Palm Beach shop, operated by Mrs. Phillips's daughter, Lynn Manulis, remains, and Mrs. Phillips went in almost daily until shortly before her death.''There was never anybody like her and there wo n't be anyone like her,'' At 18, she married Phillip R. Phillips, a manufacturer of ready-to-wear clothing and in the early 1930's she opened a shop on the 12th floor of a Madison Avenue building."
"Giorgio Armani is set to open two stores, Giorgio Armani and Emporio Armani, on Madison Avenue in midtown Manhattan; photo (M) ","But that's the mood right now on Madison Avenue, where on Thursday Mr. Armani will open two 16,000-square-foot stores, Giorgio Armani and Emporio Armani at 601 Madison Avenue ( 57th Street).As happy as he was to see his photograph on the cover of this week's New York magazine, This week, the fashion crowd is having Armani almost every night, with parties and dinners for both the Emporio Armani and Giorgio Armani boutique openings, a dinner at S.I. Newhouse Jr.'s apartment and a concert featuring the Fugees and Eric Clapton. The major department stores have tributes to Giorgio Armani in their windows."
Article discusses increase in number of boutiques being opened in lower Manhattan by small fashion designers; photo (M) ,"Sui, who opened her boutique five years ago, said:'' The huge mergers of department stores has meant that there's not that searching fashion director looking for new excitement. so you know what they want.''While these small boutiques are a showcase for more innovative design in a cautious market, stores like the sleek shoe company Sigerson Morrison, tucked away at 242 Mott Street, get plenty of referrals from their department-store clients.''A department-store buyer is one person making one decision,'' said Kari Sigerson, who designs the line with Miranda Morrison.' And the stores love it. A retail store requires just a fraction of the capital required."
Stephen P Cohen Op-Ed article says that partnership for peace between Israelis and Palestinians must be forged and that Yasir Arafat should be present at next meeting between Pres Clinton and Prime Min Benjamin Netanyahu; drawing (M) ,"The next time President Clinton and Israeli Prime Minister Benjamin Netanyahu meet-- as they did yesterday in Washington-- Yasir Arafat should be present. But the meeting was a highly significant event in Israeli political life, in the history of Mr. Arafat's movement and in the peace process itself. When the main Israeli opponent of the 1993 Oslo accords meets the treaty's main Palestinian beneficiary, a new legitimacy emerges not only for the two leaders but also for the treaty itself. The debate that defined Israeli politics for 20 years has concluded: There is a Palestinian interlocutor, and it is Yasir Arafat."
There will be one tent in Bryant Park this fall instead of traditional two when American ready-to-wear shows begin on October 26 (M) ,"A Change in Bryant ParkThere will be one tent in Bryant Park instead of the traditional two when the American ready-to-wear shows begin on Oct. 26, ending a standoff between Seventh on Sixth, the trade group that organizes the shows, and Ark Restaurants, which owns Bryant Park Grill. Instead, there will be a large tent, to be called, well, the Tent, at Avenue of the Americas and 41st Street, running east to west in the park rather than north to south. It stocks the designer's popular classic bootleg pants, among other styles. Joseph pants are also sold in stores like Saks Fifth Avenue, Bergdorf Goodman, Henri Bendel and Fred Segal in Los Angeles. The basic stretch cotton pants in bootleg or straight-leg styles cost $ 225."
"David M Silfen, co-head of Goldman, Sachs &amp; Co's equities business, says he will retire as general partner on Nov 30, end of company's fiscal year, after 28 years with the firm; Silfen will remain a limited partner and continue as an adviser to his former colleagues (M) ","David M. Silfen, 50, co- head of Goldman, Sachs & amp; Company's equities business, said yesterday that he would retire as a general partner on Nov. 30, the end of the company's fiscal year, after 28 years with the Wall Street firm. A partner since 1978, Mr. Silfen is the second-longest tenured of the firm's 173 partners and is credited with a key role in building Goldman's equity derivatives business. Along with Roy Zuckerberg, the longest-tenured partner, Mr. Silfen has headed the firm's equity business since 1990.Mr. The other general partners retiring this year are: Angelo De Caro, John Ehara, Charles T. Harris 3d, Howard C. Katz, William C. Landreth, Laurence M. Weiss and Gary L. Zwerling."
"Prices of US Treasury securities rise for second consecutive session; 30-year bond rises 13/32 in price, to 96 2/32; its yield drops to 7.07 percent, from 7.10 percent on Sept 6; graph (L) ","Prices of Treasury securities rose for the second consecutive session yesterday, even as the market shifted its focus to reports on inflation and retail sales scheduled for release this week. Part of the price rise may well be that the market has priced in and is braced for an interest-rate rise of a quarter-percentage point at the Sept. 24 meeting of the Federal Open Market Committee, the Federal Reserve's policy-setting arm. At the Treasury's weekly bill auction yesterday, the three-month maturity was the surprise, exceeding expectations. Also, the Treasury cut the auction to $ 22 billion, from $ 24 billion the previous two auctions, and $ 25 billion the two auctions before that."
"Mayor Rudolph Giuliani, responding to days of questions about needs of New York's children, has begun to sound new theme on relationship between New Yorkers and their government; says that it is time for individuals, families and neighborhoods to assume more responsibility for city's well-being (M) ","Responding to days of questions about the needs of the city's children, Mayor Rudolph W. Giuliani began to sound a new theme last week on the relationship between New Yorkers and their government. It is time, he argued with exasperation, that individuals, families and neighborhoods assume more responsibility for the city's well-being. Learning is n't about the number of children in school. Last January, after conceding that he had not done enough for children, the Mayor announced in his annual speech to the City Council that the welfare of children would a paramount priority for the second half of his term."
"Friends and family mourn four-year-old Nadine Lockwood, who was starved to death by mother, at funeral in Harlem; collective grief among mothers gathered outside funeral home turns into chorus of rage as father and family members emerged from chapel; photos (M) ","The people had come with toys and prayers for Nadine Lockwood, the 4-year-old child who would be buried this day. They said that they were no strangers to struggle, that they had raised children alone and made a little bit last longer than it should. Nadine's body, withered to only 15 pounds, was discovered on Aug. 31 in her mother's Washington Heights apartment in Manhattan. He even delivered the eulogy at the child's funeral. ' One of the children comforted the father. If she needed help,'' she said of Mrs. Lockwood,'' why did n't she just say so?''But she did not blame Nadine's mother alone."
"Study, commissioned by National Center on Addiction and Substance Abuse at Columbia University, finds teen-agers whose baby-boom parents smoked marijuana regularly a generation ago are more likely to use drugs than other teen-agers; study was conducted by Luntz Research Companies (M) ","Teen-agers whose baby-boom parents smoked marijuana regularly a generation ago are more likely to use drugs than other teen-agers, a national study released today has found. The study says that teen-agers are more'' at risk'' of using drugs in general if their parents think that marijuana is relatively harmless.''The ambivalence of the baby boomers about marijuana is clearly a key factor'' in adolescent drug use, said Joseph A. Califano Jr., the president of the center. As in other studies, the report revealed that drugs are ubiquitous in teen-agers' lives."
"Japan's welfare system, which emphasizes work ethic and importance of family ties, almost never breeds dependence; system, which makes family main safety net rather than Government, requires that welfare applicants first receive help from families and rejects poor persons physically able to work or who have assets; only 0.7 percent of population receives welfare benefits, compared with US, where 4.8 percent receives grants for aid to dependent children, 9.7 percent food stamps and estimated 2.3 percent supplemental security income for elderly and disabled; Japanese system provides universal medical care and comprehensive day care, under which everyone has access to doctors and hospitals at affordable prices, with services free for poor; neighborhood nurseries provide care for children from six months old to school age; photos; chart (M) ","The number of Japanese in the basic welfare program has declined sharply over the last half century, as people became better off and built up savings. To be sure, Japan's welfare system operates in a very different milieu from America's. For all these reasons, the welfare system seems to have broad public support in Japan. Like many homeless people, he says he has not applied for welfare benefits because he would never get them. Japan does have two elements of a social welfare program that far surpass anything in the United States: universal medical care and comprehensive day care. Both work part-time while receiving a supplementary welfare check. About 5 percent of burakumin are on welfare, seven times the national average."
TV Sports column discusses television-per-view coverage of Mike Tyson's one round knockout of Bruce Seldon (M) ,"Saturday's Mike Tyson-Bruce Seldon bout failed the viewer value test. Tyson needed 2 minutes 5 seconds to walk in, Seldon 2:37. More measures of bad value: the one-named singer Desi's national anthem required 2:20. While the lure of a Tyson fight is to watch him pulverize foes, they should be worthy ones. Just get better fighters.''Seekers of pay-per-view value should be cheered that Evander Holyfield will be Tyson's next victim. Our only relief is a bye week, an ESPN or a TNT Sunday night game ( of which there are three ) and ABC Monday night games ( of which there are none ). The game posted a slim 4.5 overnight Nielsen rating, 33 percent below the network's regular Saturday night programming a year ago."
"Republican Vice Presidential nominee Jack Kemp, pressing message of inclusion and his outreach to black voters, praises Nation of Islam leader Louis Farrakhan for emphasizing black self-reliance and family values (S) ","Pressing his message of inclusion and his outreach to black voters, Jack Kemp has praised the Nation of Islam leader, Louis Farrakhan, for emphasizing black self-reliance and family values. In his stump speech he frequently quotes and praises black leaders like the Rev. Dr. Martin Luther King Jr., Jesse Jackson and Kweisi Mfume, the new leader of the National Association for the Advancement of Colored People. But his praise of Mr. Farrakhan came just days before he was set to speak in New York City before the Conference of Presidents of Major American Jewish Organizations. Kemp is scheduled to address the Jewish leaders on Tuesday night and is to be followed by Vice President Al Gore."
"House Democratic leader Richard A Gephardt campaigns for Congressional candidates in Iowa, notably criticizing Republicans on Medicare; warns unless Democrats regain control of Congress, Medicare will again face serious threat; expects to visit 50 to 60 Congressional districts by Election Day; photo (M) ","On a two-day campaign swing through Iowa over the weekend, Mr. Gephardt ripped into Mr. Gingrich and the Republicans for their records on Medicare, education and the environment and rallied behind surprisingly strong Democratic challengers to three of Iowa's five seats, all held by Republicans. Mr. Boswell, president of the Iowa Senate, is running for the Third Congressional District seat left open when Representative Jim Ross Lightfoot opted to run for the United States Senate. Recruiting good Democratic candidates for House seats anywhere a year ago was next to impossible, Mr. Gephardt said. At the same time, Mr. Gephardt said, he and other senior Democrats got a lesson in humility.' Mr. Gephardt told the Democratic faithful in Des Moines."
"State officials who have sought more authority over welfare policy for 15 years now say they need more Federal guidance on how to carry out new welfare law; many say they expect to reap financial windfalls from new law because number of welfare recipients have dropped far below levels of last few years, which are used in computing new Federal payments to states; express frustration over inability to get authoritative interpretations of new law from Clinton Administration (M) ","After seeking more authority over welfare policy for 15 years, state officials said today that they needed more Federal guidance on how to carry out the new welfare law. The law, signed by Mr. Clinton on Aug. 22, gives state officials vast new authority to run their own welfare and work programs with Federal money. Under the new law, each state will receive a lump sum of Federal money. The law generally requires welfare recipients to work within two years of getting cash assistance. But a state may grant'' hardship exceptions'' to 20 percent of its adult welfare recipients. In the coming year, he said, Mississippi expects to receive $ 86 million of Federal welfare money under the new law, whereas it would have received $ 54 million under the old law."
Article discusses outlook for women's collegiate soccer season (M) ,That raises the number of women's teams from the 181 that competed last season to 207 this season. The number of scholarships for women was increased to 12 from 11 this year and the N.C.A.A. tournament will expand to 32 teams from 24 this season. Notre Dame Coach Chris Petrucelli said of North Carolina's domination over the years.'' We gave everybody else hope by winning last year. North Carolina Coach Anson Dorance said.'' The team made the playoffs last season in its first year of existence and will be factor again this season. SOCCER:
Article discusses play of Kansas City Chiefs defense in victory over Oakland Raiders; photo (M) ,"Chiefs defense 9, Oakland Raiders offense 3. That was the subplot of Kansas City's 19- 3 victory over the Raiders at Arrowhead Stadium, Kansas City's seventh straight over Oakland. They made the Raiders' offense look gooey and sticky, especially near the Chiefs' goal line. When Kansas City can run it, coupled with this defense, this team is nearly unbeatable. He is 3- 0 now versus the Raiders. Score another one for the Chiefs' defense. It has scored a touchdown in each of the last four Raiders games. Thomas gained both sacks and was responsible for the Chiefs' safety when he knocked Raiders quarterback Thomas and this Chiefs defense are the reasons the Chiefs are 15- 3 in their last 18 regular-season games."
New York Rangers hockey player Luc Robitaille discusses his preparations for upcoming seasons (M) ,"Coach Colin Campbell sounded today as if Robitaille and Gretzky could be playing on a line together this season.''If there is a problem, there should n't be a problem,'' Campbell said at the Rangers' first day of training camp.'' I do n't where that comes from.''It came from Los Angeles, where Robitaille and Gretzky played for the Kings. Gretzky insisted that he had no problem with Robitaille.'' If it is with Gretzky, it will be the first time the two have played extensively on the same line. Robitaille said today that in Los Angeles, the two teamed mainly on the power play, maybe playing a month a season on the same line for a season or two.''But I know how he plays,'' Robitaille said.''"
"Bao Tong, highest-ranking Chinese Communist Party official jailed for actions during 1989 pro-democracy demonstration in Tiananmen Square, remains in isolated detention in hills near Beijing three months after release from prison; challenged Prime Min Li Peng and other hard-liners who advocated martial law to clear Square of thousands of protestors encamped there after crisis erupted (M) ","But three months after the release of Mr. Bao, the highest-ranking Communist Party official jailed for his actions during the 1989 pro-democracy demonstrations at Tiananmen Square, he remains in isolated detention in the hills west of Beijing. At the time, Mr. Bao was the chief of staff to the Communist Party chief, Zhao Ziyang. Mr. Zhao remains under close guard. May 17-- that Mr. Zhao decided to stand in opposition to a military crackdown. Bao is also said to believe that his punishment was more severe than that inflicted on other party members who opposed the use of armed force because Mr. Deng believed that Mr. Bao influenced Mr. Zhao's decision to dissent. Mr. Zhao was purged and Mr. Bao was imprisoned on charges of leaking state secrets and inciting rebellion."
