abstract,summary
Julia Kuskin and Joel Ian Bell are married in their parents' home Brooklyn; they were in their 20's when Kuskin's mother married Bell's father; photo (M) ,"It was like a Brooklyn version of'' The Brady Bunch,'' only the three Bell children and two Kuskins were in their 20's at the time of their parents' wedding. One morning, Joel recalled, the two were cooking eggs and bacon when he looked at Julia and suddenly thought of her as more than a great, cool stepsister. And,' Are we on some sort of karmic mission to heal the wounds of the Kuskin and Bell tribes?''' Last March they decided they were simply in love. Brooklyn Heights was a lot quieter then,'' Julia said.' It was like we were all good friends and old friends."
"Interview with Casper Citron, veteran radio host who has been broadcasting interview programs for 38 years; 78-year-old Citron began custom of conducting interviews in hotels, and now broadcasts from Hotel Kitano in New York; photo (S) ","Yet few New Yorkers today recall the years that downtown hotels doubled as entertainment broadcast centers. Dance bands seemed to come from the roof, or lavish halls, of every major hotel. Talk shows were broadcast from hotels and restaurants. The Citron show has holed up in as many hotel locations as a politician in full campaign swing. A few months ago, Mr. Citron had his Tuesday mornings in an ordinary guest room upstairs in a hotel in the West 50's. Shortly after his show began in the restaurant, Mr. Citron segued into hotels. Since then he has been in and out of other hotels, rooms and lobbies. Mr. Citron, who lives in an apartment on Central Park West, not in a hotel, commented.'"
"New drug called GHB is turning up among Ecstasy-taking crowd, with numerous mentions on Internet and cases of overdose and death in hospital emergency rooms; photo (S) ","The drug is called liquid Ecstasy, liquid E, liquid X, GBH and perhaps most often, GHB. And its current popularity-- among club kids, ravers and Internet surfers who have added it to their illegal formulary of designer drugs like Ecstasy and Special K-- is just the latest stop in its unusual trajectory. Since then, the drug has been blamed for several deaths, most recently that of a 17-year-old girl in La Porte, Tex., last month. It's a club drug, not a street drug,'' said John Galea of the State Office of Alcoholism and Substance Abuse. MICHAEL COOPERNEIGHBORHOOD REPORT: EAST VILLAGE"
Fifth anniversary party for Court TV is held in Metropolitan Museum of Art (M) ,"THE 800 lawyers and media honchos attending the fifth anniversary party for Court TV on Tuesday were so intent on exercising their First Amendment rights that they would n't stop talking.''We appreciate your being here,'' Steve Brill has combined journalistic integrity with legal ethics in a station designed to change the way people understand the inner workings of the law.''After Mayor Rudolph W. Giuliani made a similar-sounding speech, the guests got back to two other traditions as old as antiquity-- feasting on someone else's nickel and taking potshots at each other.''There's Barry Slotnick,'' said Edward McDonald, a former Federal prosecutor, as he pointed out the celebrity defense lawyer.'"
Stephen R Stinson letter calls for end to partisan trolling for trash in Whitewater case ,"To the Editor: Your editorial'' Whitewater Sparring'' ( Sept. 26 ) is an ill-conceived paean to justice and the American legal system. I for one am not an unqualified supporter of President Clinton, but I must admit I cheered when I heard him say,'' Is n't it obvious?'' to Jim Lehrer's question in his Public Broadcasting Service interview about the motives in this case. After years of fruitless sleuthing at the cost of millions of dollars, I resent my tax dollars being spent on furthering this enervating, lugubrious trolling for trash from the past for Republicans to hurl at the Democratic candidate for President. STEPHEN R. STINSONChicago, Sept. 26, 1996"
Anne Raver column on disposing of old pesticides and herbicides; cartoon (M) ,"These blue-sky days and chilly mornings fill a gardener's soul with energy-- for digging potatoes and cutting Red Splendor zinnias, and pulling up the old bean plants. When we arrived at the collection site, a line of about 20 cars was slowly moving toward a solid concrete building. So take them with your paint cans to your local hazardous waste site. Hold off planting deciduous trees until their leaves have fallen off. These chilly nights are a signal to bring in the potted house plants like geraniums, orange trees and jade plants."
Closing of big-budget musical Big noted; photo (S) ,"As a musical, it was one of the most expensive flops in Broadway history.'' know-how: a first-rank director, Mike Ockrent, and choreographer, Susan Stroman, and such veteran creative people as the composer David Shire, lyricist Richard Maltby Jr. and book writer John Weidman. It also had an association with the hit movie and the financial backing of, among others, F.A.O. Schwarz, the Fifth Avenue toy emporium in which several of the musical's scenes were set. The producers say the musical never recovered when the nominators for the Tony Awards declined to nominate it for best musical last season."
New York Daily News copywriter Len Valenti retires after 25 years of writing famously snappy headlines; he notes some of his favorites; photo (S) ,"At tabloids like The Daily News, where headlines of five words or less often speak volumes, Len Valenti has a reputation as one of the all-time great headline writers. He has survived three newspaper strikes, four owners, a dozen city editors, half a dozen editors in chief. Valenti, whom many credit with having taught them everything they know about solid copy editing, wants people at The News to remember him, first and foremost, as a fair boss.'' Valenti said a good headline writer needs a sense of humor.'' Valenti said he had only one regret in his long career: that he never became sports editor at The News."
Photos of charity events in New York this past week ,"Honors and charity abound in the worlds of medicine, the arts, antiques and fashion. EVENING HOURS"
"Eric M Kobren, founder of Mutual Fund Investors Assn, hopes to draw subscribers to his two newsletters through sweepstakes-like promotions; photo (S) ","IF a sweepstakes awarded you shares in the Fidelity Magellan fund, would that mean you won, or took the booby prize?That a sweepstakes is even contemplating giving away mutual fund shares as a prize might strike skeptics as an infallible indicator that the boom in mutual funds has reached its zenith. The Mutual Fund Investors Association is no Publishers Clearing House. ( The answer, presumably: Fidelity mutual funds.)Eric Kobren would never be mistaken for Dick Clark, another sweepstakes pitchman. This much is known: of all the options, Mr. Kobren considers the Magellan fund the least attractive. It is the only one of the sweepstakes funds that his newsletter is not recommending. MUTUAL FUNDS"
"Nut City candy and ice-cream store on Manhattan's Upper East Side is favorite local stop for friendliness of its owner, Mafoz Sharkar; photo; customers say he remembers names, birthdays and favorite flavors, and often sets up patrons on blind dates (S) ","Or maybe it's because each and every customer, it seems, knows Mr. Sharkar's birthday, speaks a few words of his native Bengali and swears undying loyalty to Nut City, the candy and ice-cream store on Second Avenue and 82d Street he owns with his brother Masud. , Nut City has thrived by remembering not only customers' names, but also job titles, marital status and the name of the last blind date they brought in for an after-dinner cup of crazy peanut butter, light on the sprinkles please. Many customers know each other, thanks to introductions by Mr. Sharkar, who often sets up patrons on blind dates.''"
Atlas Bio-Energy Corp yields to community opposition and gives up plan to build natural-gas-fueled generator in East New York section of Brooklyn; Con Edison buys out contract to purchase heat and electricity; company earlier gave up plan for wood-burning incinerator; chronology of plans (S) ,"Effectively capping a heated two-year community fight, an energy company has announced that it will not build a power generator in East New York, even though the proposed project had the necessary permits from the city and was deemed relatively safe for the environment. According to the company's study, the incinerator would have emitted hundreds of thousands of pounds of carbon monoxide and other contaminants into the air of East New York. Last week, news of the scrapped plans came as a relief to many in East New York.''We should n't be having to fight these fights all the time,'' said Mel Grizer, a member of the East New York United Front.' EAST NEW YORK-- Sparks Fly, and Plan for a Power Generator Fizzles Out"
"Profile of Eskimo Pie Corp, 75-year-old maker of famous chocolate-covered ice cream bar; chairman-chief executive David V Clark has resigned amid disappointment over earnings and plummeting stock price; photos; map; critics point to unprofitable new ventures, such as new line of low-fat, artificially-sweetened Eskimo Pies (S) ","THE Eskimo Pie Corporation, maker of a tasty slice of Americana, has had its share of troubles recently. So if you ca n't find the traditional Eskimo Pie, you're going to buy a Dove Bar or a Klondike A big reason for the bullish attitude, analysts say, is Eskimo Pie's strong brand name. Analysts also like the company's limited role in its one proprietary product, the Eskimo Pie. For all these reasons, Eskimo Pie stock looks attractive to cost-conscious investors.'' Unilever, which makes Popsicles, has 18 percent of the frozen-novelty market, Nestle has 8 percent and Eskimo Pie has 7.5 percent."
"Catholic charismatic renewal movement, ecstatic form of worship, attracts Hispanic teen-agers to rally in Flushing, New York City; photo (S) ","While the Catholic charismatic renewal movement-- an ecstatic form of worship that includes healing, prophesying and speaking in tongues-- has existed for nearly 30 years, there is evidence that its popularity among Hispanic teen-agers is rising. For example, in the Roman Catholic Diocese of Brooklyn, which covers Brooklyn and Queens, there are about 15 charismatic youth groups, said the Rev. Joseph Malagreca, the diocese's coordinator of Hispanic and Haitian charismatic renewal. The youth groups are about evenly split between teen-age immigrants whose first language is Spanish and the children of immigrants, Father Malagreca said."
"Women's rodeo is growing, and some women plan to compete against men; there are four times as many men's rodeos as women's, and women's rodeos attract smaller crowds and cannot offer the same kind of prize money; Tammy Kelly, a bull rider, says she wants the bigger earnings of the men's circuit; photo (M) ","Women's rodeos are a growing scene, just as dangerous as the men's competitions. Youren, for example, who is in the rodeo women's hall of fame for bareback riding, was the women's overall winnerlast year, taking in $ 3,900. Except for one event, barrel racing, women are not allowed to compete in the men's rodeos. The women's rodeo, however, which ran for one night, with seats at $ 6 to $ 10, filled only half the seats. Ms. Lane, 32, the No. 3 women's bareback rider, has won more than $ 1,500 this year. And some women are planning formal competition against men. The top male bull riders are expected to win $ 150,000 this"
"Security at Martin Luther King Jr High School in New York relies on metal detectors and constant vigilance of school safety officer Naomi T Aice, who patrols hallways to prevent violence; photo (S) ","Naomi T. Aice, one of six school safety officers on the metal-detector beat that morning, as a student set one detector's lights aglow. A student was raped in Bushwick High School. Mayor Giuliani renewed his calls for the police department to take over the School Safety Division, which has 3,200 officers. The safety officers have become a major presence in schools. Now 63 schools have them-- high schools, intermediate schools, junior high schools and even elementary schools-- and 10 more schools expect to have them by year's end. But I can see the need: my boyfriend was stabbed with a screwdriver in school one summer."
New York fashion mavens tell why they attend in-store promotions that retailers mount each fall to kick off one of the most important selling seasons of the year; photos (M) ,"SYL TANG arrived at Bergdorf Goodman for a recent personal appearance by the designer Marc Jacobs with a page from the September issue of Vogue featuring the model Naomi Campbell in a panne velvet blouse by Mr. Jacobs.''It's nice to be able to meet the designer,'' said Ms. Tang, who was on a lunch break from her job at a large accounting firm on the Upper East Side.'' After a quick hello from the designer, Ms. Porreca ordered a black wool trouser suit, leather pants in both black and gold, and the same velvet top as Ms. Tang.''It's part of a package,'' she said.'' Have the two ever met a famous designer?''"
"Richard McDermott, amateur New York historian, debunks bar myths and legends; actual facts he has uncovered about Pete's Tavern and McSorley's noted; photo (S) ","Enter Richard McDermott, an amateur historian who has made a cottage industry out of debunking bar myths and legends.''I've become a saloon scholar,'' McDermott made headlines last year when he discovered that McSorley's Old Ale House, the East Seventh Street watering hole immortalized in Joseph Mitchell's writings and John Sloan's paintings, was not really founded in 1854, as a sign in the window says. And he found evidence casting doubt on the bar's claims that it opened in 1864.Then there was the O. Henry business. Pete's Tavern, and guidebooks, have long claimed that O. Henry wrote his most famous story,'' Gift of the Magi,'' in its first booth. who says the story was penned in O. Henry's room."
"Bruce Weber article on his lifelong devotion to New York Yankees, affection that is often tested by behavior of fellow fans; photos; quotes from interview in which George Steinbrenner recalls his purchase of legendary team from William S Paley in 1973, for $8.8 million (M) ","I spent much of the last four weeks watching ball games, talking and thinking baseball, at Yankee Stadium in the Bronx and at home in front of the television. ' Take Me Out to the Ball Game'' in the kind of quaint display that makes me wistful. There are baseball fans and non-baseball fans. IT GETS UGLYBy the time the game was called I'd never been at a ball game before that As night came on, and the after-work crowd filled the ball park toward the end of the first game, the Yanks moved solidly in front. Many parents escorted their kids from the park between games. And indeed, by the time the second game was under way, the crowd was overwhelmingly male."
"Charles Barron, 45-year-old former Black Panther, led fight against construction of power plant in East New York section of Brooklyn; photo; chronology of Barron's community activism (S) ","In his own backyard, he has practiced what he preaches as the leader of East New York United Front, a community group that organized residents to oppose plans for building a power plant in their neighborhood.''This is 21st-century stuff,'' he said of his company, Dynamics of Leadership.'' And people in the community now know we have somebody who can help us in our plight.''But not all of the power plant opponents speak so highly of Mr. Barron. Mrs. Wooten nor Mr. Golden would comment on Mr. Barron's potential campaign for the Council seat. EAST NEW YORK-- Sparks Fly, and Plan for a Power Generator Fizzles Out"
"Residents and business owners in Little Italy and SoHo sections of New York City complain about noise, garbage and cluttered sidewalks from dozens of wholesale Asian vegetables stores that now operate on fringes of Chinatown; $10 million lawsuit against one wholesaler has been settled and association formed by Chinese greengrocers says it will educate Chinese merchants about sanitation and community relations (S) ","Peer inside the pink plastic bag of any Chinatown shopper and you will invariably find produce that was harvested only hours earlier on a farm in New Jersey, Long Island or upstate New York.'' For Chinese people, freshness is very, very important,'' said Abraham Tan, president of Valley View Farm, one of the city's largest vegetable wholesalers. To avoid the high-priced, congested center of Chinatown, many wholesalers have opened refrigerated warehouses on the neighborhood's western fringe in space that was long ago abandoned by manufacturers. But that has angered residents and business owners in SoHo and Little Italy, who complain about noise, garbage and sidewalks cluttered with piles of boxed produce.''"
"AT&amp;T's announcement of drop in profits has little effect on telecommunications mutual funds, because many of funds do not carry shares in giant company; list (S) ","The announcement by AT&amp;T last week that competition in the long-distance market was taking a toll on profits might have been expected to send telecommunications mutual funds into a tailspin. Guy Scott, who manages the Smith Barney Telecommunications Growth fund, said AT&amp;T had not been growing fast enough to qualify for his portfolio.' ' We see big changes coming in the telecommunications market, but when AT&amp;T will deliver that growth to the bottom line is a real question mark,'' he said. Michael Mahoney, manager of the GT Global Telecommunications fund, said a big part of AT&amp;T's business-- international fax calling-- could be eliminated in coming years as E-mail grows. So far this year, funds without AT&amp;T shares have mostly fared better than those with. MUTUAL FUNDS"
"New York's Madison Avenue between 57th and 72d Streets draws new breed of trendy young shoppers with opening of Giogio Armani, Valentino and other high-style stores; photo; map (S) ","Eight new stores opened in the last month with five more scheduled to open in the next two months.''It's unrecognizable,'' said Alexander Kabbaz, president of the Madison Avenue Business Improvement District.' He has been serving coffee and sandwiches for the past 20 years at Viand, a coffee shop at Madison and 61st Street.'' They want to expand, move or open second stores.''Prices per square foot on Madison Avenue now range from $ 250 per square foot for a store up to 5,000 square feet to $ 325 per square foot for store of less than 1,500 square feet. About 18 months ago, prices ran about $ 175 per square foot for all types of stores.''"
Art swap by National Gallery and Tate Gallery in London noted; photo (S) ,"The Metropolitan Museum of Art in New York defines itself as an'' everything'' museum, covering every region of the world and every period of artistic creation. With overlapping collections of non-British art from the late 19th century and the early 20th century, the National Gallery and the Tate Gallery decided to exchange paintings in order to strengthen each museum's collection. Still, as of next spring, 52 pre-1900 works will move from the Tate to the National Gallery and 14 post-1900 paintings will travel in the opposite direction. The dividing date means that works by Picasso, Braque and Matisse will all form part of the Tate's modern collection, but Cezanne, Monet, Pissarro and Renoir, 19th century artists who also worked into this century, will be present in both museums."
Shares of Pan Am Corp take off along with inaugural flight of resuscitated airline; photo (S) ,"The shares of the Pan Am Corporation, a start-up airline that owns the Pan Am name but is otherwise unrelated to the defunct aviation pioneer, have taken off. To be sure, the name Pan Am and its famous blue globe still resonate with travelers.'' Its chief executive is Martin R. Shugrue Jr., who was the trustee for Eastern Air Lines during its bankruptcy after working at the old Pan Am for two decades. Still, the new Pan Am has barely taken off. Mr. Shugrue, while experienced, left the old Pan Am in a management shake-up and received mixed reviews for his handling of Eastern. Pan Am shares have already had a bumpy ride, down nearly 25 percent from Tuesday's peak of $ 17.50."
"Problems faced by many executors, especially relatives of deceased, in sorting out complex financial matters discussed; Joan McGarry and Jerrie Taylor recount their experience in California; photo (S) ","Most estates have both probate and nonprobate assets. If the probate assets are modest, the estate may qualify for expedited procedures under small-estate exceptions. Many executors slog through probate with a lawyer and a financial adviser, whose fees, together, commonly eat up 5 to 10 percent of an estate's assets. In addition, most states charge an estate tax or an inheritance tax, paid by beneficiaries. Those assets are protected from estate taxes when the primary heir An executor who is the estate's principal or sole beneficiary may waive the fee rather than pay income tax on it. Make a preliminary estimate of the value of real estate and personal property, and of the estate's total value."
Market Watch column speculates about appeal of inflation-linked savings bonds (S) ,"Inflation bonds are coming. The bonds will prove to be a good buy if inflation rises, but not if inflation continues to decline. So popular were they that investors accepted a real yield of just 2.5 percent, and that figure soon declined as people passed up double-digit yields on normal bonds to buy protection from inflation. Since then, as inflation scares have eased, higher real yields have been needed to attract buyers. But those investors can, if they wish, buy inferior inflation protection now, in the form of investments like natural resources stocks. If the real yield does come in at a relatively high figure, these bonds are likely to be good investments."
Flat-rate offers by AT&amp;T and other telephone companies compared with reduced-rate calling plans for certain hours (S) ,"AT&amp;T introduced a flat-rate calling plan last week amid much fanfare. Flat-rate plans are not new. MCI Communications, Sprint and a host of smaller long-distance providers have had similar plans for years. You do n't have to check the time before making a call under most of the plans or worry about the cost of calling across the country. If you are on a savings plan, on average, for all kinds of calling, the cost is 14.5 cents a minute,'' said Mark Siegel, an AT&amp;T spokesman. But the flat-rate plans are still popular. Some consumers may even be willing to pay slightly more because the plans are so simple ' Enroll in a plan,'' he warned,'' or you will pay a rate that is way too"
Question-and-answer column about new US Savings Bonds pegged to inflation rates (S) ,"But are the new'' inflation-protection bonds'' Here are the answers to some basic questions about the bonds. What does the Government get in the deal?A. In return for inflation protection, the Treasury expects to pay investors a little less interest than it pays on regular bonds. Q. How exactly will the new bonds work?A. As with regular bonds, an investor lends the Government money, say $ 1,000, and the Government promises to pay interest on the loan of, say, 3.25 percent. The Government also promises to repay the borrowed money on a certain date; to begin, all the new bonds will mature in 10 years. The interest rate will remain fixed, but because the principal amount of the loan or bond is growing, the interest payments will be bigger."
"Drug researchers enlist tens of thousands of people a year to take part in some 3,000 new clinical trials nationwide; payments to subjects are small expense in $15.8-billion drug research budget, although small number of people are earning meager livings as guinea pigs by enrolling in several tests at once; participants describe their roles and occasional discomfort; photos; guidelines prohibit exposure to incurable diseases, but trials can be dangerous; Marc Kusinitz contracted malaria in study at Johns Hopkins, where he works, and 19-year-old Hoi Yan Wan died of heart attack during study at University of Rochester (L) ","( In many drug trials, the test ends only when the subject finally suffers a reaction. ) Years ago, clinical trials like these would have paid almost nothing, but not any longer. Of the 3,000 clinical trials that will begin this year, many will pay $ 100 to $ 200 for each day. Experienced guinea pigs learn how to play a'' feed and bleed'' study, medical lingo for a clinical trial. I had some time wrapped up in the trial, but it definitely paid dividends.''Most guinea pigs work only occasionally. Both sites list trials by diseases and by geographic research centers in the United States and abroad. Clinical trials are n't trials when the doctors are reckless."
Summary of major stories on inside pages of business section ,"INVESTING IT 5/The name is familiar. Otherwise, the new Pan Am bears little resemblance to the great airline of the past. By Reed Abelson. INVESTING IT /Page 5/The ins and outs of withdrawing money from an individual retirement account. By Bruce Felton. MUTUAL FUNDS /Page 7/No free Chevys or island getaways here. This contest offers mutual funds as prizes. By Edward Wyatt. SPENDING IT /Page 8/Now that AT&amp;T is offering a flat 15 cents a minute , it may be time to review your long-distance plan. By Roy Furchgott."
