abstract,summary
"LIRR ticket agents at stations where new ticket machines have been installed now spend their time helping riders use machines, which are to eliminate their own jobs; photo; lawsuits to force railroad to retain agents noted (S) ","IRA S. LONDON of Northport walked up to the ticket machine at the Greenlawn railroad station and tried to insert a $ 10 bill. Moments later, the machine spit out his ticket and change.''I'm wondering, why are you here?'' Machines have replaced agents at 36 of the 134 stations. He directed the railroad to keep agents at an initial group of seven stations where the L.I.R.R. had closed ticket windows. Daniel R. Dwydir of Greenlawn said he had been commuting for 30 years and had changed from buying his monthly tickets at Greenlawn to buying them at Pennsylvania Station in Manhattan.'"
"Comment on history of Breezy Point, giant Heinsheimer mansion built in 1907 in Far Rockaway, fashionable resort in mid-19th century; house evokes Far Rockaway's Gatsby era; mansion was demolished in 1987, and all that remains is shell of its vandalized conservatory; photos (M) ","TAKE a trip to the dreamy new Bayswater Point Park, a cool, leafy peninsula at the foot of Mott Avenue in Far Rockaway, Queens. This little fragment is all that is left of'' Breezy Point,'' the giant Heinsheimer mansion, built in 1907 when Far Rockaway would n't even sniff at the Hamptons. By the 1890's Louis Bossert, the Brooklyn lumber magnate, had a Victorian-style house at the foot of Mott Avenue, which leads away from the village center of Far Rockaway to the bay. The New York City Audubon Society viewed Breezy Point as a key element in its'' Buffer the Bay'' project, aimed at protecting 700 acres of natural wetlands on Jamaica Bay."
"Interview with Jay Bergen, divorced lawyer and father of three who decided to move from his seven-room apartment on Broadway and 90th Street in Manhattan to mid-19th century Italianate duplex in townhouse in Brooklyn Heights, at 220 Columbia Heights, street parallel to Promenade and just behind it; photos (L) ","But he kept looking at smaller apartments, primarily on the Upper East Side. What about Brooklyn Heights?'' But he could n't wait: Thanksgiving Day 1995, found him wandering around the streets of Brooklyn Heights. Then he walked to the rear of the apartment, the Columbia Heights side, to a magnificent room with a grand fireplace with plaster carving in a Grinling Gibbons motif: pea pods intertwined with fruits and flowers. Then upstairs to two small rooms with a full bath.'' and I think I'll put it in the living room."
"Beate Gordon, longtime performing arts director at Asia Society, recalls how, at age 22, she was assigned by Gen Douglas MacArthur to write women's rights section of Japan's postwar Constitution; interview; Gordon grew up in Japan, where her father was concert pianist before World War II; she returned as Army translator in order to see her parents, who as Jews were interned in 1943; her lifelong involvement with Asian culture recounted (M) ","So it was with Beate Gordon, who at the age of 22 found herself one woman among 25 men, precipitously assigned by MacArthur to write the Japanese constitution still in use today. She was the force behind bringing the Vietnamese Thang Long Water Puppet Theater first to Lincoln Center and now to Southampton College, where it is presenting its last three performances today. She worked for the Office of War Information, even having her own radio show, a nostalgia program to try to convince the Japanese people to surrender, that was supposed to be the counterpart of Tokyo Rose. She told me how in her programs at the Asia Society she instituted pre-performance demonstrations in which people sit on the floor very close to the performers."
Plans for summer opera performances on East End of Long Island noted; photo (S) ,"This month opera aficionados will not have to venture far to hear a live aria. Mr. de Blasis has just resigned as artistic director of the Cincinnati Opera after 28 years. The singer lives in New Jersey with his wife, Susan Quittmeyer, a mezzo-soprano for the Metropolitan Opera and a native of Port Washington. In fact, all the performers are in their late 30s, he said, which is relatively young in opera. When the director asked these professionals to donate their services to the benefit, which would ordinarily cost an opera company about $ 30,000, he said that no one refused.'' Before this season, the director said'' we mixed opera with Broadway''''S but not this time.'' People want opera,'' she said."
"Crash of TWA Flight 800 thrusts Suffolk County, New York, medical examiner Charles V Wetli into limelight; experienced pathologist, who was appointed 18 months ago, is highly regarded, if little known, in his field; he says he does not fault Gov George Pataki for overruling him and calling in team to help with TWA autopsies, but objected to how Pataki carried out intentions; photos (M) ","The family members' headquarters at the Ramada Plaza Hotel at Kennedy International Airport, Dr. Wetli said, was disastrous and complicated identifications. He and Dr. Wetli said they did not know who had decided against moving the families to Hauppauge. Dr. Wetli said having the families nearer would have helped him address them directly.' In an early press briefing Dr. Wetli discouraged family members from going to the office. Officials said they knew of no family members who had insisted on going to Hauppauge to make identifications. Gray said Dr. Wetli deserved praise.'' I ca n't say enough accolades for the Suffolk County Medical Examiner and his staff,''"
Question &amp; Answer column on housing and real-estate subjects ,"As required by law, the landlord gets 1 percentage point of the security deposit interest as an administration fee. Tenants whose tenancies are subject to the New York City Rent Stabilization Law have additional protections regarding security deposits, he said. Under the Rent Stabilization Code, the amount of the security deposit can not exceed one month's rent, provided however that where a greater security deposit was paid by the tenant in continuous occupancy since the date the apartment became subject to the code, the deposit may continue in effect during the term of such lease and any lease renewals. Renting a House From a New OwnerQ I currently rent a town house in northern New Jersey. In New Jersey, tenants must be given 30 days' written notice of a rent increase."
Summer concert season at Norfolk Festival in Connecticut noted (S) ,"FOR more than half a century the Norfolk Festival has been the summer home of the Yale School of Music, but it was in 1899 that Ellen Battell Stoeckel, a pianist and singer, was instrumental in organizing the Litchfield Choral Society and building a festival around its programs. Evoking the spirit of earlier days are Sibelius's aforementioned'' Oceanides'' and several pieces by Percy Grainger, another composer whose music was premiered in early Norfolk days. Among other events at Norfolk this week are a family concert today at 3, young artists' recitals tomorrow, Wednesday and Thursday evenings at 7:30, and an 8 P.M. Friday chamber program featuring performances by Ms. Panetti and her pianist-colleague Claude Frank, Mr. Harth and his violinist-partner Syoko Aki, the violist Paul Neubauer and the cellist Timothy Eddy."
Long Island gerontologist Linda Costanza discusses planning for needs of the elderly; interview; photo (S) ,"Also, people need to know not only what those services are, but how they are to be financed. These centers provide a social setting for people who might otherwise be alone. Medical-model day care is like a daytime nursing home. Social-model day care is private pay, although there are other ways to pay for it. Medical-model day care is paid for as private pay or through Medicaid. What happens if their relative needs a nursing home and how to select one. But with nursing homes that cost $ 8,000 a month, that wo n't even last them a year. They may need a companion, a live-in, a home health aide or a social day-care center. Finally, there are nursing homes, when the elderly needs more care than you can give them."
Steven Suskin letter comments on Anthony Tommasini's July 21 article on Stephen Sondheim ,"To the Editor: Let's give poor Stephen Sondheim a break. All are different, but all are distinctively Sondheim. He finds'' Company,'' for example,'' strewn with disco rhythms''-- did n't disco burst onto the scene four years after'' Company'' closed?-- and featuring a band'' spiked with synthesizers'' ( of which there were precisely none, merely a lone electric piano).Yes, the choral writing did recall Dionne Warwick's backup singers; this had less to do with Sondheim's compositions, though, than with the orchestrator Jonathan Tunick's pit-scoring innovations the previous season for Burt Bacharach's'' Promises, Promises.''"
Larry Farsace letter on Ben Ratliff's article on Billy Strayhorn ,"To the Editor: Regarding Ben Ratliff's article on Billy Strayhorn,'' The Invisible Man at Ellington's Elbow'' $ ( July 14 $ ), who was such a prolific composer but never in the national limelight. There was another such'' invisible'' man in the Ellington organization. This was Juan Tizol, who composed the timeless standard'' Caravan.''But at least the Duke was more honest than Al Jolson, who would not introduce a new song unless his name was also on the piece as a composer. LARRY FARSACERochesterBILLY STRAYHORN"
Letter on Bernard Holland's July 21 article on state of music criticism ,"To the Editor: In his essay $ ('' Colleagues, Critique Thyselves,'' July 21 $ ), Bernard Holland does for music criticism what Alexander Pope did for poetry. Mr. Holland seconds Pope's observation that''' Tis hard to say if greater want of skill / Appear in writing or in judging ill.''Especially fitting is Mr. Holland's interpolated tribute to Harold C. Schonberg, his predecessor, who was consistently guided by principles of music criticism enunciated in his essay. He approached all his tasks sufficiently prepared to avoid the consequence to which some critics in some of the arts are sometimes otherwise prone, as Pope puts it:''"
Evelyn Ronell letter on Bernard Holland's article (July 21) offering advice to music critics ,"Holland has written yet another exquisite article about the role of the music critic. Neither he nor any other critic came to the concert. He later wrote me a wonderful letter citing time and space constraints. Then, on July 11, he found nothing better to say about the opening of the Mostly Mozart Festival-- where Pinchas Zukerman and Itzhak Perlman outdid themselves in a way no one can duplicate-- than that he wished some new faces would have had the opportunity to participate. It is precisely because Mr. Holland and his colleagues do n't attend'' fresh faces'' concerts that no manager will touch these unknown performers. When the press ignores'' no names,'' these performers are doomed to linger in limbo."
Letter from Cathy and Wayne Lauden holds it was mistake for Peter M Nichols to recommend (July 14 review) movie Independence Day for young children ,"For children aged 3 to 7, he wrote,'' the explosions, warfare and weird-looking aliens could scare some little ones.'' Our 7-year-old-- hardly a'' little one''-- has thrilled to plenty of explosions and'' weird-looking aliens'' in his moviegoing lifetime, as has his 10-year-old brother. As we hesitated, the graphic dissection of a live alien found our staunch 10-year-old with his hands over his eyes, asking to have hands put over his ears as well. We support and encourage reviews like'' Taking the Children'' that make an effort to help parents screen films for their children, as the PG and PG-13 ratings can be bewilderingly erratic. When parents are misled, children suffer the consequences. MOVIES FOR CHILDREN"
Col Chester F Cotter letter contends photo of Denzel Washington (July 7) depicting lieutenant colonel of United States Cavalry (Armor) has Washington in an incorrect uniform ,"To the Editor: It struck me like cold water to see a photo of Denzel Washington on the front page of Arts and Leisure $ ('' Carnage and Glory, Legends and Lies,'' July 7 $ ) depicting a lieutenant colonel of the United States Cavalry ( Armor ) in an incorrect uniform. Mr. Washington was costumed in a dress blue uniform wearing cavalry crossed sabers, as the story line required. But the branch markings on his sleeve ( the commission stripes ), the background color on his shoulder boards and the band around his hat were orange ( not cavalry yellow, as they should have been ). Orange is the color of a signal officer, not a cavalryman. COL. CHESTER F. COTTER, retired Beaufort, S.C.MILITARY ON FILM"
"Increased tourism in Westchester County, New York, discussed; Historic Hudson River Towns, group of 11 municipalities, and Historic Hudson Valley Preservation Group now run weekend trolley connecting historic sites, shops and restaurants from Irvington to North Tarrytown; photo (S) ","IN travelspeak, this is Westchester's description: The county's revved-up tourist promotion efforts are paying off, say those who are experiencing economic benefits from increased tourism this summer.''Hotel occupancy is up; hotel managers are reporting that their business is even better than it was last summer, which was good,'' said Marcia Dmochowski, who is the general manager of the Tarrytown Hilton and is also president of the Westchester Hotel Association. ' Four million people come into Westchester on day trips, and our hotels are selling out every night. Hudson Valley Tourism, the only state-designated tourism promotional agency for the region, which includes Westchester, recently won the two top New York State tourism awards for regional travel guides in a competition against 61 other countries and 10 other regions.'"
"Gala set for White Barn Theater and Museum in Westport, Conn; photos; Lucille Lortel comments on 48th summer season (S) ","' just came up,'' as Ms. Lortel put it. About the current White Barn season, she said:'' I'm tired, darling, but I ca n't resist the theater,'' hastening to name two productions--'' The Tooth of Crime''-- coming up at the Lucille Lortel Theater, and a limited engagement of Ms. Montevecchi's new revue, in memory of Martin Kaufman, at the Kaufman Theater. THEATER"
Laurentian String Quartet at Sarah Lawrence College offers summer music camp for young people; photo; first violinist Sung-Rai Sohn comments (S) ,"Sung-Rai Sohn told a quartet of young string players.'' Mr. Sohn is first violinist with the Laurentian String Quartet. His group has been in residence at Sarah Lawrence since 1978.In addition to performing for 17 summers, quartet members have taught string playing to students 7 to 20 years old. This year,'' Mr. Watson observed,'' we seem to have a lot of quartets by Mozart. The Laurentian Quartet began during Mr. Sohn's years as a candidate for his masters degree. Aisha Buckley, 18, of Mount Vernon, who has played the viola for two years and played violin for eight years before that, said:'' You can concentrate on your music more than the rest of the year."
"Westchester County pediatrician Lori Semel also answers questions, for free, on Moms Online service of America Online; photo (S) ","By night, Dr. Semel takes off for space. On Mondays, from 10 to 11 P.M., mothers ask Dr. Semel questions. Questions Dr. Semel answered questions that night. Then, Dr. Semel asked Moms Online if she could start an on-line advice service. Every other week, Dr. Semel is host of a symposium on America Online. At Dr. Semel's symposium, up to 500 mothers talk to one another and ask questions. Questions for Dr. Semel can reach her through electronic mail, where her address is LoriDoc@aol.com, through the Monday night Moms Online chat room ( The America Online''"
"Maren Rudolph, president of Vintage Hudson Valley, discusses efforts to preserve old inns and other historic sites in New York's Hudson Valley; interview; photo (S) ","And I come from the American West, and even though the history there is not quite as old as it is in the Hudson Valley, I saw how, through development, historic treasures were destroyed to create shopping malls and new homes. Certainly in the Hudson Valley the attitude is not the same as in the West. the history of the Hudson Valley is really the history of America. How do Historic Hudson Valley and Vintage Hudson Valley fit?A. We have been working with Historic Hudson Valley, and it is our desire to enhance what they are doing. In no way are we in competition with Historic Hudson Valley. These are historic places with a unique history. They will restore the historic buildings on the property."
"Cooperative garden run by volunteers in Pawcatuck is one of several providing food for the poor in Connecticut; photos; Willimantic Food Co-Op members, who run retail food store, also grow vegetables for local soup kitchen (S) ","The emergency food locker provides bags of groceries for those who need them.'' Other gardens-- and the AmeriCorps project-- provide fresh produce for the Connecticut Food Bank, a nonprofit clearinghouse for food for more than 450 charitable organizations. The Food Bank tallied it up; we've contributed 22,000 pounds of food,'' said Dennis C. Hunt, a church member. Also aiding the Food Bank this summer is the AmeriCorps Summer Gleaning Program. By mid-July, the Gleaning Program had provided the Food Bank with close to 1,000 pounds of food.'' The Holcomb Farm Community Supported Agriculture project in Granby, now in its third year, works to provide not only good food but also new opportunities for its members, including people from poor neighborhoods."
Guide to upcoming events in Connecticut; photo (S) ,"PHOTO RAFFLEThe Arts Council of Greater New Haven holds its'' Off the Wall'' photography show and raffle today, beginning at 5 P.M. with a pre-raffle viewing in the Artspace Gallery, 70 Audubon Street. Proceeds from the event support some 600 artists and 100 arts organizations in New Haven. The numbers for more information are 772- 2788 or 772- 2377.VIETNAM'S LEGACYA seminar on Vietnam war literature and films will be offered at Western Connecticut State University in Danbury on Thursday, Friday and Aug. 12, 13 and 14 from 9 A.M. to 5 Mittelmann studied art and music at the University of Hartford, Southern Connecticut State University in New Haven, and the Paier College of Art in Hamden."
"Federal enterprise grants have had vastly different effects in Bridgeport and New Haven, Conn, illustrating effects of money and politics; grant appears to have drawn New Haven together and strengthened neighborhood activities, because committee set up to allocate funds grew out of established local organizations; Bridgeport started off with factional bickering as local activists argued that authority over grant was controlled by few politicians and business leaders; open warfare erupted, leading muncipal government to take control; New Haven Mayor John DeStefano Jr and Bridgeport officials comment (M) ","TWO and a half years ago, when the Federal Government announced that 100 cities would receive $ 3 million Enterprise Community grants with which to create jobs in poor neighborhoods, Bridgeport and New Haven were among the recipients. In New Haven, the grant appeared to draw the community together and strengthened neighborhood activism. How New Haven and Bridgeport dealt with the Enterprise Community money provides a glimpse into what happens-- or does not-- after such a grant. Twenty of its members were selected from among representatives on neighborhood police district management teams, and the rest from the city government and several major businesses and institutions in the city. The initial committee, formed to apply for the larger Empowerment Community grant, consisted of representatives from the city government, the business community and major institutions."
"Annual Villa Maria Golf and Tennis classic is one of number of golf tournaments that raise money with help of sports and entertainment celebrities; photo; Villa Maria Education Center in Stanford, Conn, is school for children with learning disabilities (S) ","Sister Carol Ann is the principal of the Villa Maria Education Center in Stamford, and her annual fund-raising golf and tennis tournament was scheduled for that rainy day. But those who take part in the Tournament of Charities Celebrity Classic at the Oak Lane Country Club in Woodbridge are baseball players from yesteryear. Others included the Yale football coach, Carmen Cozza, and the Eli men's basketball coach, Dick Kuchen, both of whom played golf, as did all of the former baseball players.'' ' I would n't play on game days because if you play golf and baseball on the same day, it affects your swing."
Article on emergency medical care provided by helicopter evaucation crews from Westchester County Medical Center; photos; service brings critically-ill trauma victims and high-risk patients to hospital from all around region (S); ,"To increase the odds of saving lives, a trauma team is alerted with a single telephone call, and an ambulance or a helicopter from the Medical Center is dispatched. About 50 emergency service providers in the county, including police and fire departments and Emergency Medical Service units, can request the helicopters. Between 1994 and 1995, the emergency helicopter flights increased 56 percent, to 824 from 527, the Medical Center reported.''The two helicopters are mirror images of one another so that the crew can use one or the other without problems,'' said Ted Tully, director of the trauma center."
"Several after-school child-care programs in Westchester County, New York, report they are being squeezed out of space in schools by increasing school enrollment; nervous parents comment (S) ","With ever-increasing student enrollment putting pressure on classroom space, many child-care programs are likely to be pushed out of school buildings in the fall. Those that remain may have to scramble for space in a gymnasium or cafeteria.''Looking at September, we wo n't have room in every school,'' said Carole Weisberg, executive director of the Lakeland Children's Center, which has been in the Lakeland School District for the last 14 years.'' Her son's program is one of those that may have to be moved out of the school in the fall.''"
"Sycamore drive-in at busy intersection in Bethel, Conn, still serves fresh hamburgers to customers in their cars; operations have change little since opening in 1947; photos (S) ","Indeed, it has flourished and in an area replete with fast food places. A waiter, or esp., a waitress who serves food to customers in cars at a drive-in restaurant.'' At least a representative of the Connecticut Restaurant Association reported that no one there knew of any other place in the state that has carhops. Once, she said, the job was so popular that a big bench was placed outside so all the carhops would have a place to sit while waiting for the cars to roll in. The Sycamore today is basically what it was when a great war was over and millions of ex- G.I.'s were getting married and buying little tract houses and cars and going to drive-ins."
"Commission appointed by County Exec Andrew O'Rourke will study public financing of campaigns for office in Westchester County, New York, with goal of ending corruptive special-interest contributions (S) ","The report, part of the New York State Commission on Government Integrity, called for reform. The commission, which looked at governmental units statewide, also recommended in the late 1980's that the state adopt a system of public campaign financing similar to New York City's, which provides partial public financing to candidates who accept certain contribution and expenditure limits. For example, the New York State Business Group, which sells health insurance, gave $ 25,000. The commission will also look at ways to reduce the cost of running a campaign, thereby encouraging more individuals to run for public office, she said. The county's Public Campaign Finance Commission will hold three public meetings in October to receive comments on reform proposals."
White Plains Hospital Center's advanced imaging techniques for early detection of breast cancer described; Dr Arthur G Lerner comments; photo (S) ,"ABOUT one in every nine women will develop breast cancer, said Dr. Arthur G. Lerner, chief of surgery and medical director of the Cancer Program at White Plains Hospital Center. We are trying to detect smaller and smaller tumors.''The Breast Imaging Center at the White Plains Hospital Center has a full range of diagnostic and screening techniques. They are used in combination with one another, depending on the particular breast tissue profile of each woman. At the Breast Imaging Center, a woman may choose to have the tissue removed with stereotactic biopsy, a departure from the traditional surgical removal. With Breast UnitsOther hospitals besides White Plains Hospital Center offering new breast imaging technology include the following:*Westchester County Medical Center in Valhalla, which offers stereotactic biopsy, ultrasound mammography and breast M.R.I.*St."
